,keyword,site_name,URL,snippet,ranking,target
0,Apple Pencil Amazon,Apple Pencil : Electronics - Amazon.com,https://www.amazon.com/Apple-MK0C2AM-A-Apple-Pencil/dp/B016NY7784,"Apple Pencil features the precision, responsiveness, and natural fluidity of a traditional writing instrument and the versatility to become so much more. · With ...Compatible Devices: IPad Air (3rd generation), ...Item Weight: 27 GramsNumber of Batteries: 1 Lithium Polymer batteries ...Item Dimensions LxWxH: 0.39 x 0.39 x 0.39 in... Rating: 4.8 · ‎78,599 reviews · ‎$89.99 · ‎In stock",1,Apple Pencil features the precision responsiveness and natural fluidity of a traditional writing instrument and the versatility to become so much more With Compatible Devices IPad Air 0 rd generation Item Weight 0 GramsNumber of Batteries 0 Lithium Polymer batteries Item Dimensions LxWxH 0 0 x 0 0 x 0 0 in Rating 0 0 0 0 reviews 0 0 In stock
1,Apple Pencil Amazon,"1-16 of over 1000 results for ""apple pencil"" - Amazon.com",https://www.amazon.com/apple-pencil/s?k=apple+pencil,"Results 1 - 16 of 1000+ — Stylus Pen for ipad,with Palm Rejection,Tilt,Magnetic Function, Active Pencil Compatible with (2018-2021) Apple iPad Pro (11/12.9 Inch) ...",2,Results 0 0 of 0 Stylus Pen for ipad with Palm Rejection Tilt Magnetic Function Active Pencil Compatible with 0 0 Apple iPad Pro 0 0 0 Inch
2,Apple Pencil Amazon,Apple Pencil (2nd Generation) : Electronics - Amazon.com,https://www.amazon.com/Apple-MU8F2AM-A-Pencil-Generation/dp/B07K1WWBJK,"Apple Pencil (2nd generation) brings your work to life. With imperceptible lag, pixel-perfect precision, and tilt and pressure sensitivity, it transforms into ...Compatible Devices: Compatible with iPad mini ...Item Weight: 0.73 OuncesNumber of Batteries: 1 Lithium Polymer batteries ...Item Dimensions LxWxH: 6.53 x 0.35 x 0.35 in... Rating: 4.8 · ‎38,788 reviews · ‎$124.98 · ‎In stock",3,Apple Pencil 0 nd generation brings your work to life With imperceptible lag pixel perfect precision and tilt and pressure sensitivity it transforms into Compatible Devices Compatible with iPad mini Item Weight 0 0 OuncesNumber of Batteries 0 Lithium Polymer batteries Item Dimensions LxWxH 0 0 x 0 0 x 0 0 in Rating 0 0 0 0 reviews 0 0 In stock
3,Apple Pencil Amazon,"1-16 of 478 results for ""apple pencil 1st generation"" - Amazon ...",https://www.amazon.com/apple-pencil-1st-generation/s?k=apple+pencil+1st+generation,"Results 1 - 16 of 478 — Stylus Pen for iPad with Tilt Sensitive and Magnetic Design, Digital Pencil Compatible with 2018 and Later Model,Apple iPad Pro 11/12.9 ...",4,Results 0 0 of 0 Stylus Pen for iPad with Tilt Sensitive and Magnetic Design Digital Pencil Compatible with 0 and Later Model Apple iPad Pro 0 0 0
4,Apple Pencil Amazon,"1-16 of 569 results for ""apple pencil 2nd generation"" - Amazon ...",https://www.amazon.com/apple-pencil-2nd-generation/s?k=apple+pencil+2nd+generation,"Results 1 - 16 of 569 — Amazon.com: apple pencil 2nd generation. ... Stylus Pen for iPad, Palm Rejection iPad Pencil for iPad Pro 2021 11/12.9 Inch(2018-2021), ...",5,Results 0 0 of 0 Amazon com apple pencil 0 nd generation Stylus Pen for iPad Palm Rejection iPad Pencil for iPad Pro 0 0 0 0 Inch 0 0
5,Apple Pencil Amazon,"1-16 of 50 results for ""apple pencils for iphone"" - Amazon.com",https://www.amazon.com/apple-pencils-iphone/s?k=apple+pencils+for+iphone,"Results 1 - 16 of 50 — Amazon.com: apple pencils for iphone. ... Stylus Pens for Touch Screens, Fine Point Stylist Pen Pencil Compatible with iPhone iPad Pro ...",6,Results 0 0 of 0 Amazon com apple pencils for iphone Stylus Pens for Touch Screens Fine Point Stylist Pen Pencil Compatible with iPhone iPad Pro
6,Apple Pencil Amazon,"1-16 of 142 results for ""apple pencil 2"" - Amazon.com",https://www.amazon.com/apple-pencil-2/s?k=apple+pencil+2,"Results 1 - 16 of 142 — Stylus Pen for iPad with Palm Rejection, Active Pencil Compatible with (2018-2020) Apple iPad Pro (11/12.9 Inch),iPad Air 3rd/4th Gen ...",7,Results 0 0 of 0 Stylus Pen for iPad with Palm Rejection Active Pencil Compatible with 0 0 Apple iPad Pro 0 0 0 Inch iPad Air 0 rd 0 th Gen
7,Apple Pencil Amazon,"1-16 of 367 results for ""Apple Pencil Alternative"" - Amazon.com",https://www.amazon.com/Apple-Pencil-Alternative/s?k=Apple+Pencil+Alternative,"Results 1 - 16 of 367 — Logitech Crayon Digital Pencil for iPad Pro 12.9-Inch (3rd Gen), iPad Pro 11-Inch, iPad (6th, 7th, 8th and 9th Gen), iPad Air (3rd and 4th ...",8,Results 0 0 of 0 Logitech Crayon Digital Pencil for iPad Pro 0 0 Inch 0 rd Gen iPad Pro 0 Inch iPad 0 th 0 th 0 th and 0 th Gen iPad Air 0 rd and 0 th
8,Apple Pencil Amazon,apple pencil: Electronics - Amazon.com,https://www.amazon.com/apple-pencil-Electronics/s?k=apple+pencil&rh=n%3A172282,"Results 1 - 24 of 162 — Stylus Pen for iPad with Palm Rejection, Active Pencil Compatible with (2018-2020) Apple iPad Pro (11/12.9 Inch),iPad Air 3rd/4th Gen ...",9,Results 0 0 of 0 Stylus Pen for iPad with Palm Rejection Active Pencil Compatible with 0 0 Apple iPad Pro 0 0 0 Inch iPad Air 0 rd 0 th Gen
9,Apple Pencil Amazon,"1-16 of over 1000 results for ""apple pen"" - Amazon.com",https://www.amazon.com/apple-pen/s?k=apple+pen,"Results 1 - 16 of 1000+ — Active Stylus Pen Compatible with Apple,Stylus Pens for Touch Screens,1.5mm Fine Point Digital Pen,Rechargeable Stylus for iPad/iPad Pro/ ...",10,Results 0 0 of 0 Active Stylus Pen Compatible with Apple Stylus Pens for Touch Screens 0 0 mm Fine Point Digital Pen Rechargeable Stylus for iPad iPad Pro
10,Apple Pencil Amazon,"1-16 of over 4000 results for ""black apple pencil"" - Amazon.com",https://www.amazon.com/black-apple-pencil/s?k=black+apple+pencil,"Results 1 - 16 of 4000+ — Stylus Pencil for iPad 8th Generation, Active Pen with Palm Rejection Compatible with (2018-2021) Apple iPad 8th 7th 6th Gen/iPad Pro 11 ...",11,Results 0 0 of 0 Stylus Pencil for iPad 0 th Generation Active Pen with Palm Rejection Compatible with 0 0 Apple iPad 0 th 0 th 0 th Gen iPad Pro 0
11,Apple Pencil Amazon,"1-24 of 144 results for ""apple pencil 2"" - Amazon.com",https://www.amazon.com/apple-pencil-2-Electronics/s?k=apple+pencil+2&rh=n%3A172282,"Results 1 - 24 of 144 — Stylus Pen Compatible with Apple iPad (2018 and Later), Palm Rejection, Tilting Detection, Magnetic Adsorption for iPad Pro (11/12.9 Inch), ...",12,Results 0 0 of 0 Stylus Pen Compatible with Apple iPad 0 and Later Palm Rejection Tilting Detection Magnetic Adsorption for iPad Pro 0 0 0 Inch
12,Apple Pencil Amazon,apple pencil 1st generation - Amazon.com,https://www.amazon.com/apple-pencil-1st-generation/s?k=apple+pencil+1st+generation&page=2,"Results 17 - 32 of 470 — Amazon.com: apple pencil 1st generation. ... iPad Pro 12.9 Pencil 4th Generation 2020 with Palm Rejection, Digital Pen with 1.0mm ...",13,Results 0 0 of 0 Amazon com apple pencil 0 st generation iPad Pro 0 0 Pencil 0 th Generation 0 with Palm Rejection Digital Pen with 0 0 mm
13,Apple Pencil Amazon,apple pencil for ipad 7th generation - Amazon.com,https://www.amazon.com/apple-pencil-ipad-7th-generation/s?k=apple+pencil+for+ipad+7th+generation,Results 1 - 16 of 373 — Amazon.com: apple pencil for ipad 7th generation. ... Stylus Pen for Apple iPad Pencil: Touch Pencil with Palm Rejection for Precise ...,14,Results 0 0 of 0 Amazon com apple pencil for ipad 0 th generation Stylus Pen for Apple iPad Pencil Touch Pencil with Palm Rejection for Precise
14,Apple Pencil Amazon,"1-16 of over 1000 results for ""apple pens"" - Amazon.com",https://www.amazon.com/apple-pens/s?k=apple+pens,"Results 1 - 16 of 1000+ — Stylus Pens for Touch Screens,Active Stylus Compatible for Apple iPad,Rechargeable 1.5mm Fine Point Smart Pencil Digital Compatible ...",15,Results 0 0 of 0 Stylus Pens for Touch Screens Active Stylus Compatible for Apple iPad Rechargeable 0 0 mm Fine Point Smart Pencil Digital Compatible
15,Apple Pencil Amazon,apple pencil replacement - Amazon.com,https://www.amazon.com/apple-pencil-replacement/s?k=apple+pencil+replacement,Results 1 - 16 of 2000+ — Amazon.com: apple pencil replacement. ... TITACUTE Replacement for Apple Pencil Cap iPencil Magnetic Cap for Apple Pen Stylus for ...,16,Results 0 0 of 0 Amazon com apple pencil replacement TITACUTE Replacement for Apple Pencil Cap iPencil Magnetic Cap for Apple Pen Stylus for
16,Apple Pencil Amazon,"1-16 of 238 results for ""apple pencil refurbished"" - Amazon.com",https://www.amazon.com/apple-pencil-refurbished/s?k=apple+pencil+refurbished,"Results 1 - 16 of 238 — Stylus Pen for iPad with Palm Rejection, Active Pencil Compatible with (2018-2020) Apple iPad Pro (11/12.9 Inch),iPad Air 3rd/4th Gen ...",17,Results 0 0 of 0 Stylus Pen for iPad with Palm Rejection Active Pencil Compatible with 0 0 Apple iPad Pro 0 0 0 Inch iPad Air 0 rd 0 th Gen
17,Apple Pencil Amazon,Apple Pencil (2nd Generation) › Customer reviews - Amazon ...,https://www.amazon.com/Apple-MU8F2AM-A-Pencil-Generation/product-reviews/B07K1WWBJK,Find helpful customer reviews and review ratings for Apple Pencil (2nd Generation) at Amazon.com. Read honest and unbiased product reviews from our users.,18,Find helpful customer reviews and review ratings for Apple Pencil 0 nd Generation at Amazon com Read honest and unbiased product reviews from our users
18,Apple Pencil Amazon,Apple Pencil 2 returns to Amazon all-time low for a limited time,https://www.imore.com/rare-apple-pencil-2-deal-saving-you-30-amazon-not-be-missed,"Aug 31, 2021 — Amazon and Best Buy are offering the latest Apple Pencil model at a $30 discount. That's close to 25% off and a match for the lowest it has ...",19,Aug 0 0 Amazon and Best Buy are offering the latest Apple Pencil model at a 0 discount That s close to 0 off and a match for the lowest it has
19,Apple Pencil Amazon,Buy Apple Pencil,https://www.apple.com/shop/product/MK0C2AM/A/apple-pencil-1st-generation,"Apple Pencil expands the power of iPad and opens up new creative possibilities. It's sensitive to pressure and tilt so you can easily vary line weight, ...$99.00 · ‎In stock",20,Apple Pencil expands the power of iPad and opens up new creative possibilities It s sensitive to pressure and tilt so you can easily vary line weight 0 0 In stock
20,Apple Pencil Amazon,Upgrade your iPad experience with the prev-gen. Apple ...,https://9to5toys.com/2021/08/20/apple-pencil-sale-walmart-amazon/,"Aug 20, 2021 — Amazon is now offering the original Apple Pencil for $70 shipped. Also at Walmart. Down from its normal rate of $95 right now, today's deal ...",21,Aug 0 0 Amazon is now offering the original Apple Pencil for 0 shipped Also at Walmart Down from its normal rate of 0 right now today s deal
21,Apple Pencil Amazon,Amazon's best Labor Day Apple deals: $99 Apple Pencil 2 ...,https://appleinsider.com/articles/21/09/01/septembers-best-deals-on-amazon-deliver-99-apple-pencil-2-100-off-m1-ipad-pro-more,"Sep 1, 2021 — Matching the lowest price we've seen, Amazon has the 2nd Generation Apple Pencil on sale for $99, with units in stock and ready to ship.",22,Sep 0 0 Matching the lowest price we ve seen Amazon has the 0 nd Generation Apple Pencil on sale for 0 with units in stock and ready to ship
22,Apple Pencil Amazon,Apple Pencil Styluses for Amazon for sale | eBay,https://www.ebay.com/b/Apple-Pencil-Styluses-for-Amazon/176981/bn_97785495,Get the best deals on Apple Pencil Styluses for Amazon and find everything you'll need to improve your home office setup at eBay.com.,23,Get the best deals on Apple Pencil Styluses for Amazon and find everything you ll need to improve your home office setup at eBay com
23,Apple Pencil Amazon,Best Stylus for Your iPad 2021 | Reviews by Wirecutter,https://www.nytimes.com/wirecutter/reviews/best-ipad-stylus/,"The Apple Pencil supports pressure sensitivity, making it a better choice for artists using iPads with a Lightning port. Buying Options. $94 from Amazon · $100 ...$94.00 to $100.00 · ‎In stock",24,The Apple Pencil supports pressure sensitivity making it a better choice for artists using iPads with a Lightning port Buying Options 0 from Amazon 0 0 0 to 0 0 In stock
24,Apple Pencil Amazon,Apple Pencil (1st Generation) - Walmart.com,https://www.walmart.com/ip/Apple-Pencil-1st-Generation/47362890,"EEEkit 2-Pack 2 in 1 Luxury Fine Point Stylus Pen Touch Screen Pen for Apple iPad Air, iPhone Xs Xr Xs Max X 8,Samsung Galaxy Tablet, Kindle and Other ...Assembled Product Weight: 0.14 lbsFeatures: No features description availableColor: Multicolor Rating: 4.6 · ‎669 reviews · ‎$89.99 · ‎In stock",25,EEEkit 0 Pack 0 in 0 Luxury Fine Point Stylus Pen Touch Screen Pen for Apple iPad Air iPhone Xs Xr Xs Max X 0 Samsung Galaxy Tablet Kindle and Other Assembled Product Weight 0 0 lbsFeatures No features description availableColor Multicolor Rating 0 0 0 reviews 0 0 In stock
25,Apple Pencil Amazon,Apple Pencil (2nd Generation) $99 at Amazon - Slickdeals,https://slickdeals.net/f/15248419-apple-pencil-2nd-generation-99-at-amazon,Amazon Apple Pencil (2nd Generation) $99 https://www.amazon.com/gp/product/B07K1WWBJK.$99.00 · ‎In stock,26,Amazon Apple Pencil 0 nd Generation 0 https www amazon com gp product B 0 K 0 WWBJK 0 0 In stock
26,Apple Pencil Amazon,Looking for the best Apple Pencil alternatives? - Creative Bloq,https://www.creativebloq.com/buying-guides/best-apple-pencil-alternatives,"Aug 4, 2021 — The best Apple Pencil alternatives in full · 01. Logitech Crayon · 02. Awavo Stylus Pen · 03. Adonit Pixel · 04. Meko Universal Stylus · 05. Wacom ...",27,Aug 0 0 The best Apple Pencil alternatives in full 0 Logitech Crayon 0 Awavo Stylus Pen 0 Adonit Pixel 0 Meko Universal Stylus 0 Wacom
27,Apple Pencil Amazon,The best Apple Pencil alternatives in 2021 | Tom's Guide,https://www.tomsguide.com/buying-guide/best-apple-pencil-alternatives,"3 days ago — (As of this writing, there were more than 3,000 reviews on Amazon, averaging a 4.5-star rating overall. Not too shabby.) This stylus supports ...",28,0 days ago As of this writing there were more than 0 0 reviews on Amazon averaging a 0 0 star rating overall Not too shabby This stylus supports
28,Apple Pencil Amazon,Rare Apple Pencil (2nd gen) sale at Amazon: $99 (save $30),https://malaysia.news.yahoo.com/apple-pencil-sale-amazon-152440885.html,"Aug 20, 2021 — Here's the rub: Apple charges a hefty $129 for the current-generation Apple Pencil. $129! For a plastic stylus! Yes, it's technologically fancy- ...",29,Aug 0 0 Here s the rub Apple charges a hefty 0 for the current generation Apple Pencil 0 For a plastic stylus Yes it s technologically fancy
29,Apple Pencil Amazon,Top 12 Apple Pencil Alternatives You Can Buy (2021) | Beebom,https://beebom.com/apple-pencil-alternatives/,"Aug 16, 2021 — Rounding up the list is a simple yet functional stylus from Amazon itself – the AmazonBasics is a cheap yet exceptionally good stylus. While it ...",30,Aug 0 0 Rounding up the list is a simple yet functional stylus from Amazon itself the AmazonBasics is a cheap yet exceptionally good stylus While it
30,Apple Pencil Amazon,The Apple Pencil just hit a brand new price low - TechRadar,https://www.techradar.com/news/the-apple-pencil-just-hit-a-brand-new-price-low-in-amazons-spring-sale,"Mar 28, 2021 — Apple Pencil deals are dropping to record low prices in this weekend's Amazon Spring Sale.",31,Mar 0 0 Apple Pencil deals are dropping to record low prices in this weekend s Amazon Spring Sale
31,Apple Pencil Amazon,Apple Pencil prices updated daily - MacPrices.net,https://www.macprices.net/applepencil.shtml,"Pencil original. MSRP $99 ↕, Pencil 2 2018. MSRP $129 ↕. Abt Electronics dynamic pricing*, $89.99 · $124.98 · Adorama, $99.99 · $129 · Amazon ...",32,Pencil original MSRP 0 Pencil 0 0 MSRP 0 Abt Electronics dynamic pricing 0 0 0 0 Adorama 0 0 0 Amazon
32,Apple Pencil Amazon,Apple's iPad Air drops to $500 at Amazon | Engadget,https://www.engadget.com/apple-ipad-air-64gb-wifi-drops-to-500-all-color-options-on-sale-with-coupon-131523018.html,"Sep 7, 2021 — Like the iPad Pro, the Air is compatible with the second-generation Apple Pencil and the Magic Keyboard. While those accessories drive the ...",33,Sep 0 0 Like the iPad Pro the Air is compatible with the second generation Apple Pencil and the Magic Keyboard While those accessories drive the
33,Apple Pencil Amazon,Apple Pencil (B016NY7784) | Amazon price tracker / tracking ...,https://camelcamelcamel.com/product/B016NY7784,"Apple Pencil (B016NY7784), B016NY7784, 088846202566, MK0C2AM/A at camelcamelcamel: Amazon price tracker, Amazon price history charts, price watches, ...",34,Apple Pencil B 0 NY 0 B 0 NY 0 0 MK 0 C 0 AM A at camelcamelcamel Amazon price tracker Amazon price history charts price watches
34,Apple Pencil Amazon,Apple Pencil (1st Generation) White MK0C2AM/A - Best Buy,https://www.bestbuy.com/site/apple-pencil-1st-generation-white/4538802.p?skuId=4538802,"Shop Apple Pencil (1st Generation) White at Best Buy. Find low everyday prices and buy online for delivery or in-store pick-up. Price Match Guarantee. Rating: 4.7 · ‎23,704 reviews · ‎$86.99 to $99.99",35,Shop Apple Pencil 0 st Generation White at Best Buy Find low everyday prices and buy online for delivery or in store pick up Price Match Guarantee Rating 0 0 0 0 reviews 0 0 to 0 0
35,Apple Pencil Amazon,Amazon Has 5 Prime Day iPad Deals That Are Bound to Sell Out,https://people.com/tech/apple-ipad-amazon-prime-day-deals-2021/,"Jun 21, 2021 — Amazon Prime Day 2021 is underway, and includes Apple iPad deals that ... the brand's various Apple Pencil and smart keyboard accessories.",36,Jun 0 0 Amazon Prime Day 0 is underway and includes Apple iPad deals that the brand s various Apple Pencil and smart keyboard accessories
36,Apple Pencil Amazon,The second-generation Apple Pencil is cheaper than ever,https://www.pcworld.com/article/3626909/the-second-generation-apple-pencil-is-cheaper-than-ever.html,"Jul 26, 2021 — Amazon is selling the Apple Pencil 2 for $99, down from $125.",37,Jul 0 0 Amazon is selling the Apple Pencil 0 for 0 down from 0
37,Apple Pencil Amazon,"Apple Pencil Second Generation, Only $99 on Amazon - The ...",https://thekrazycouponlady.com/2021/08/19/apple-pencil-second-generation-only-99-on-amazon,"Aug 19, 2021 — Grab the Second Generation Apple Pencil on sale for $99 online on Amazon. This pencil is compatible with three different iPad models and ...",38,Aug 0 0 Grab the Second Generation Apple Pencil on sale for 0 online on Amazon This pencil is compatible with three different iPad models and
38,Apple Pencil Amazon,Apple Pencil 1st Generation - Target,https://www.target.com/p/apple-pencil-1st-generation/-/A-50220026,"Read reviews and buy Apple Pencil 1st Generation at Target. Choose from contactless Same Day Delivery, Drive Up and more. Rating: 4.8 · ‎226 reviews · ‎$99.99 · ‎In stock",39,Read reviews and buy Apple Pencil 0 st Generation at Target Choose from contactless Same Day Delivery Drive Up and more Rating 0 0 0 reviews 0 0 In stock
39,Apple Pencil Amazon,20 Best Apple Pencil Alternatives for 2021 - JUST™ Creative,https://justcreative.com/best-apple-pencil-alternatives/,"Aug 31, 2021 — While it's not the best replacement for an Apple Pencil, it comes pretty close. Learn More. Latest Price on Amazon:.",40,Aug 0 0 While it s not the best replacement for an Apple Pencil it comes pretty close Learn More Latest Price on Amazon
40,Apple Pencil Amazon,Kindle IOS App and Apple Pencil - Amazon Forum,https://www.amazonforum.com/s/question/0D54P00006zSxS2/kindle-ios-app-and-apple-pencil,Does anyone know if the apple pencil works on the Kindle IOS App on an iPad pro? I read textbooks and I am looking for something more than just turning ...,41,Does anyone know if the apple pencil works on the Kindle IOS App on an iPad pro I read textbooks and I am looking for something more than just turning
41,Apple Pencil Amazon,Apple just unveiled the brand new 9th-gen iPad - BGR,https://bgr.com/tech/apple-just-unveiled-the-brand-new-9th-gen-ipad/,4 days ago — Today's Top Deal Amazon just kicked off a massive new sale — see all the best deals right here! ... Apple iPad 9 with Apple Pencil support.,42,0 days ago Today s Top Deal Amazon just kicked off a massive new sale see all the best deals right here Apple iPad 0 with Apple Pencil support
42,Apple Pencil Amazon,Deals: Apple Pencil 2 on Sale for $99 at Amazon ($30 Off,https://www.macrumors.com/2020/12/14/deals-apple-pencil-2-on-sale/,"Dec 14, 2020 — Amazon today is discounting the Apple Pencil 2 to $99.00, down from $129.00. This is the lowest price that we've ever tracked for the Apple ...",43,Dec 0 0 Amazon today is discounting the Apple Pencil 0 to 0 0 down from 0 0 This is the lowest price that we ve ever tracked for the Apple
43,Apple Pencil Amazon,"Apple Pencil on Sale for $99 on Amazon, Save $29",https://www.iphoneincanada.ca/deals/apple-pencil-on-sale-for-99-on-amazon-save-29/,"If you recently picked up an iPad for Christmas, Apple's first-generation Apple Pencil is on sale for $99.99 on Amazon Canada right now at 22% off, ...",44,If you recently picked up an iPad for Christmas Apple s first generation Apple Pencil is on sale for 0 0 on Amazon Canada right now at 0 off
44,Apple Pencil Amazon,Save a small fortune by buying this $22 Apple Pencil alternative,https://www.cnet.com/tech/computing/save-a-small-fortune-by-buying-this-22-apple-pencil-alternative/,"Jan 20, 2020 — The Aceirst Stylus Pen combines the best of the old and new Apple Pencil styluses and works with all the most recent Pencil-compatible iPads.",45,Jan 0 0 The Aceirst Stylus Pen combines the best of the old and new Apple Pencil styluses and works with all the most recent Pencil compatible iPads
45,Apple Pencil Amazon,I ordered a Apple Pencil But Amazon Sent Me A Local Pencil,https://consumercomplaintscourt.com/i-ordered-a-apple-pencil-but-amazon-sent-me-a-local-pencil-fraud/,"Dec 6, 2020 — Text of Complaint by AJAYA KUMAR SWAIN: I order a Apple Pencil in Amazon But It Shipped A Local Pencil. When I Received A Packet of Amazon ...",46,Dec 0 0 Text of Complaint by AJAYA KUMAR SWAIN I order a Apple Pencil in Amazon But It Shipped A Local Pencil When I Received A Packet of Amazon
46,Apple Pencil Amazon,Amazon Celebrates Yesterday's Apple Announcements With ...,https://www.digitaltrends.com/dtdeals/airpods-ipad-macbook-deal-amazon-september-2021/,3 days ago — Amazon is celebrating yesterday's Apple announcements with DEALS! ... and it supports the Apple Pencil 2 and Magic Keyboard.,47,0 days ago Amazon is celebrating yesterday s Apple announcements with DEALS and it supports the Apple Pencil 0 and Magic Keyboard
47,Apple Pencil Amazon,Apple Pencil Review | PCMag,https://www.pcmag.com/reviews/apple-pencil,"The Apple Pencil is the best stylus for the sixth-gen iPad and iPad Pro, but its design could use an upgrade. MSRP $99.00. $89.99 at Amazon.Pros and cons include: Extremely accurate in testing ⋅ Easy to pair ⋅ No eraser end Rating: 4 · ‎Review by Sascha Segan · ‎$89.99",48,The Apple Pencil is the best stylus for the sixth gen iPad and iPad Pro but its design could use an upgrade MSRP 0 0 0 0 at Amazon Pros and cons include Extremely accurate in testing Easy to pair No eraser end Rating 0 Review by Sascha Segan 0 0
48,Apple Pencil Amazon,Your guide to the best deals in Apple's Amazon store - CNN,https://www.cnn.com/2021/08/03/cnn-underscored/amazon-apple-sale/index.html,"Aug 3, 2021 — Yes, Apple has a shop on Amazon. And that means you can get official Apple products with free Prime shipping, and even better, ...",49,Aug 0 0 Yes Apple has a shop on Amazon And that means you can get official Apple products with free Prime shipping and even better
49,Apple Pencil Amazon,best Apple Pencil alternatives compatible with your iPad and ...,https://www.makeuseof.com/tag/apple-pencil-alternatives/,"Jan 20, 2021 — Looking for an Apple Pencil alternative with iPad and iPhone compatibility? These styluses offer a choice for every ... See On Amazon. Review by Brent Dirks",50,Jan 0 0 Looking for an Apple Pencil alternative with iPad and iPhone compatibility These styluses offer a choice for every See On Amazon Review by Brent Dirks
50,Apple Pencil Amazon,"Forget the $99 Apple Pencil, this 4.5-star iPad stylus is just ...",https://www.macworld.com/article/233695/forget-the-99-apple-pencil-this-4-5-star-ipad-stylus-is-just-32-today.html,"However, at $99 and $129, the Apple Pencil is pretty pricey. But it's not the only option. Today, Amazon is selling a third-party stylus built ...Jan 3, 2020",51,However at 0 and 0 the Apple Pencil is pretty pricey But it s not the only option Today Amazon is selling a third party stylus built Jan 0 0
51,Apple Pencil Amazon,"Apple Pencil Case Holder, Apple Pen Accessories,1 Pouch for ...",https://www.pinterest.com/pin/299770918949564873/,"Oct 9, 2019 - Buy Apple Pencil Case Holder, Apple Pen Accessories, 1 Pouch for ... Samsung Stylus iPad Pro Pen Pencil Holder Rose Gold: Sleeves - Amazon.com ...",52,Oct 0 0 Buy Apple Pencil Case Holder Apple Pen Accessories 0 Pouch for Samsung Stylus iPad Pro Pen Pencil Holder Rose Gold Sleeves Amazon com
52,Apple Pencil Amazon,"Apple Pencil 2 is $99 at Amazon (-$30), AP 1 is $79 (-$20).: ipad",https://www.reddit.com/r/ipad/comments/kd2ctx/apple_pencil_2_is_99_at_amazon_30_ap_1_is_79_20/,"Dec 14, 2020 — 428 votes, 46 comments. Apple Pencil 2: Apple Pencil 1: (it's $80, not $79. Didn't realize until after I posted)",53,Dec 0 0 0 votes 0 comments Apple Pencil 0 Apple Pencil 0 it s 0 not 0 Didn t realize until after I posted
