,keyword,site_name,URL,snippet,ranking,target
53,Apple Pencil Amazon,50 best iPad covers and sleeves – the ultimate 2020-21 guide,https://ebookfriendly.com/best-ipad-case-covers/,"Nov 6, 2020 — It features a built-in Apple Pencil holder and comes with a free screen protector. ⇢ Amazon. 8. Best rotating 360-degree cover for iPad 10.2 ...",54,Nov 0 0 It features a built in Apple Pencil holder and comes with a free screen protector Amazon 0 Best rotating 0 degree cover for iPad 0 0
54,Apple Pencil Amazon,"Apple Pencil deal drops to $115, Twelve South sale, more",https://9to5mac.com/2021/04/19/deals-apple-pencil-2-more/,"Apr 19, 2021 — Hit the jump for all that and more in the latest 9to5Toys Lunch Break. Apple Pencil 2 sees rare deal to $115. Amazon is now offering the second- ...",55,Apr 0 0 Hit the jump for all that and more in the latest 0 to 0 Toys Lunch Break Apple Pencil 0 sees rare deal to 0 Amazon is now offering the second
55,Apple Pencil Amazon,Apple May Reveal New-Look Apple Pencil 3 For iPad Pro This ...,https://www.forbes.com/sites/davidphelan/2021/04/18/apple-may-reveal-new-look-apple-pencil-3-for-ipad-pro-this-week-release-date/,"Apr 18, 2021 — The next iPad Pro is a shoo-in for next Tuesday's Apple event, but it now seems Apple Pencil will appear in a third-generation model.",56,Apr 0 0 The next iPad Pro is a shoo in for next Tuesday s Apple event but it now seems Apple Pencil will appear in a third generation model
56,Apple Pencil Amazon,Here's where to pre-order the new Apple iPad mini - Mashable,https://mashable.com/deals/sept-15-apple-ipad-mini-preorder,"3 days ago — Apple's new and improved iPad mini is already up for preorder on Amazon ... Apple Pencil support, and vastly improved cameras; the rear one ...",57,0 days ago Apple s new and improved iPad mini is already up for preorder on Amazon Apple Pencil support and vastly improved cameras the rear one
57,Apple Pencil Amazon,Best stylus for ipad air 2 - Badilo Ltd,https://nguyenminh.badiloltd.com/azeh/gbr.php?htlh=best-stylus-for-ipad-air-2,"Items 1 - 13 of 13 — Jun 10, 2021 · The Apple Pencil 2 only works with certain iPads ... on Amazon. ; 【Design for iPad 2018 -2020】Stylus pen for Apple ...",58,Items 0 0 of 0 Jun 0 0 The Apple Pencil 0 only works with certain iPads on Amazon Design for iPad 0 0 Stylus pen for Apple
58,Apple Pencil Amazon,Ditch the Apple Pencil for These Top-Rated iPad Styluses - SPY,https://spy.com/articles/gadgets/electronics/best-apple-pencil-alternatives-228841/,"Jun 17, 2020 — The best Apple Pencil alternatives are just as great as the official ... The simple design not only makes it a favorite among Amazon users, ...",59,Jun 0 0 The best Apple Pencil alternatives are just as great as the official The simple design not only makes it a favorite among Amazon users
59,Apple Pencil Amazon,The Best Apple Pencil Alternatives - Review Geek,https://www.reviewgeek.com/14870/the-best-apple-pencil-alternatives/,"Plus, this Bluetooth feature ensures that the Adonit Pixel can connect to older iPads that aren't Pencil-compatible. Buy on Amazon. Wacom Bamboo Fineline Stylus ...",60,Plus this Bluetooth feature ensures that the Adonit Pixel can connect to older iPads that aren t Pencil compatible Buy on Amazon Wacom Bamboo Fineline Stylus
60,Apple Pencil Amazon,Apple's new iPad and iPad Mini: how to preorder - The Verge,https://www.theverge.com/22665133/apple-ipad-mini-2021-preorder-buy-how-to-price-release-date,"2 days ago — The 64GB configuration retails for $499 and the 256GB model for $649; both models are available for preorder at Apple, as well as Amazon, ...",61,0 days ago The 0 GB configuration retails for 0 and the 0 GB model for 0 both models are available for preorder at Apple as well as Amazon
61,Apple Pencil Amazon,"iPad Mini 6 Preorders $50 Off, $179 AirPods Pro, Apple Watch ...",https://hothardware.com/news/ipad-mini-6-preorders-50-off-airpods-pro-for-179-apple-watch-s6-319,18 hours ago — Walmart and Amazon are getting in on the Apple frenzy today with discounts on new ... and support for the second-generation Apple Pencil.,62,0 hours ago Walmart and Amazon are getting in on the Apple frenzy today with discounts on new and support for the second generation Apple Pencil
62,Apple Pencil Amazon,"Best iPad deals at Best Buy, Amazon, Walmart and more",https://www.phonearena.com/news/best-ipad-deals_id126717,Best Apple iPad deals from Apple — Apple: Get up to $525 in credit when you buy an iPad ... pair of AirPods or an Apple Pencil for your new iPad.,63,Best Apple iPad deals from Apple Apple Get up to 0 in credit when you buy an iPad pair of AirPods or an Apple Pencil for your new iPad
63,Apple Pencil Amazon,10 Best Apps to download in your new Apple iPad Mini 2021,https://www.gadgetbridge.com/gadget-bridge-ace/10-best-apps-to-download-in-your-new-apple-ipad-mini-2021/,"2 days ago — With the support of the new Apple Pencil, Adobe Lightroom is a ... The Amazon Kindle application has been available for iPad for a long time ...",64,0 days ago With the support of the new Apple Pencil Adobe Lightroom is a The Amazon Kindle application has been available for iPad for a long time
64,Apple Pencil Amazon,"Best iPad deals at Best Buy, Amazon, Walmart and more",https://fortyblocks.com/best-ipad-deals-at-best-buy-amazon-walmart-and-more-updated-september-2021/,"1 day ago — With that credit, you can possibly grab yourself a pair of AirPods or an Apple Pencil for your new iPad. Cases and other accessories are ...",65,0 day ago With that credit you can possibly grab yourself a pair of AirPods or an Apple Pencil for your new iPad Cases and other accessories are
65,Apple Pencil Amazon,Pre-compra de iPad mini 6: condiciones que ofrece Amazon,https://lamanzanamordida.net/noticias/lanzamientos/pre-compra-ipad-mini-6-amazon/,"2 days ago — También este iPad es compatible con Apple Pencil de 2ª generación. ipad mini 6. ¿Qué implica hacer la reserva en Amazon? Como ya decíamos, el ...",66,0 days ago También este iPad es compatible con Apple Pencil de 0 generación ipad mini 0 Qué implica hacer la reserva en Amazon Como ya decíamos el
66,Apple Pencil Amazon,Apple's charger sprawl is bananas | ZDNet,https://www.zdnet.com/article/apple-charger-sprawl-is-bananas/,"1 day ago — Older models of iPad Pro (2018-2020) use USB 3.0, whereas the 2021 M1 iPad Pro and all current M1 MacBooks use Thunderbolt. View now at Amazon ...",67,0 day ago Older models of iPad Pro 0 0 use USB 0 0 whereas the 0 M 0 iPad Pro and all current M 0 MacBooks use Thunderbolt View now at Amazon
67,Apple Pencil Amazon,Llévate el iPad Air (2020) más barato que nunca en Amazon ...,https://www.applesfera.com/seleccion/llevate-ipad-air-2020-barato-que-nunca-amazon-529-euros-mejores-tabletas-para-vuelta-a-clases,4 days ago — El catálogo de Apple tiene más modelos de tabletas que nunca. ... bordes y la compatibilidad con accesorios como el Apple Pencil de segunda ...,68,0 days ago El catálogo de Apple tiene más modelos de tabletas que nunca bordes y la compatibilidad con accesorios como el Apple Pencil de segunda
68,Apple Pencil Amazon,iPad mini 6 Case Leaks to Show Relocated Volume Buttons ...,https://wccftech.com/ipad-mini-6-case-leaks-to-show-relocated-volume-buttons-on-top-for-apple-pencil-placement/,"5 days ago — ... situated on the top to accomodate the Apple Pencil on the side. ... As an Amazon Associate, Wccftech.com may earn from qualifying ...",69,0 days ago situated on the top to accomodate the Apple Pencil on the side As an Amazon Associate Wccftech com may earn from qualifying
69,Apple Pencil Amazon,"AirPods Pro drop to $180, plus the rest of this week's best tech ...",https://us.newschant.com/technology/airpods-pro-drop-to-180-plus-the-rest-of-this-weeks-best-tech-deals/,"22 hours ago — Apple's iPad Air is $100 off proper now, bringing it down to $500. All 5 colours are on sale at Amazon. thanks to robotically utilized coupons, ...",70,0 hours ago Apple s iPad Air is 0 off proper now bringing it down to 0 All 0 colours are on sale at Amazon thanks to robotically utilized coupons
70,Apple Pencil Amazon,New 2021 iPad and iPad Mini Are Up for Preorder - IGN,https://www.ign.com/articles/new-2021-apple-ipad-and-ipad-mini-preorders-are-live,"2 days ago — See on Amazon ... This iPad Mini works with the second-generation Apple Pencil, which connects magnetically to the side of the device for ...",71,0 days ago See on Amazon This iPad Mini works with the second generation Apple Pencil which connects magnetically to the side of the device for
71,Apple Pencil Amazon,Agora você pode reservar o novo iPad Mini na Amazon,https://www.actualidadiphone.com/pt/reservar-ipad-mini/,"1 day ago — Além disso, ele também incorporou compatibilidade com o Apple Pencil de segunda geração. Recorde-se que o iPad mini de quinta geração foi o ...",72,0 day ago Além disso ele também incorporou compatibilidade com o Apple Pencil de segunda geração Recorde se que o iPad mini de quinta geração foi o
72,Apple Pencil Amazon,How Much Is an Apple Pencil? a Breakdown of IPad Styluses,https://www.businessinsider.com/how-much-is-apple-pencil,"Sep 13, 2019 — The original Apple Pencil costs $99, and the Apple Pencil 2nd Generation costs $129. The two Apple Pencils work with specific iPads.",73,Sep 0 0 The original Apple Pencil costs 0 and the Apple Pencil 0 nd Generation costs 0 The two Apple Pencils work with specific iPads
73,Apple Pencil Amazon,Hp Pen On Ipad - Kraftfahrervereinigung Grenzland eV,http://kraftfahrervereinigung-grenzland.de/hp-pen-on-ipad.html,The all-new iPad Air. Find Details about DAGi Stylus Pen P505 fits Apple iPad Pro Air Mini iPhone X 8 7 6 S plus ASUS Acer Amazon Samsung Dell HP OPPO from ...,74,The all new iPad Air Find Details about DAGi Stylus Pen P 0 fits Apple iPad Pro Air Mini iPhone X 0 0 0 S plus ASUS Acer Amazon Samsung Dell HP OPPO from
74,Apple Pencil Amazon,Ipad Pencil | Etsy,https://www.etsy.com/market/ipad_pencil,Cute Pastel Colored Pencil Skin For The Apple Pencil | Gen 1 And Gen 2 Options · Cute Soft Apple Pencil 1 2 Pastel Silicone Paw Flower Protective Case for iPad ...,75,Cute Pastel Colored Pencil Skin For The Apple Pencil Gen 0 And Gen 0 Options Cute Soft Apple Pencil 0 0 Pastel Silicone Paw Flower Protective Case for iPad
75,Apple Pencil Amazon,Ipad Pencil | Etsy,https://www.etsy.com/market/ipad_pencil,Cute Pastel Colored Pencil Skin For The Apple Pencil | Gen 1 And Gen 2 Options · Cute Soft Apple Pencil 1 2 Pastel Silicone Paw Flower Protective Case for iPad ...,76,Cute Pastel Colored Pencil Skin For The Apple Pencil Gen 0 And Gen 0 Options Cute Soft Apple Pencil 0 0 Pastel Silicone Paw Flower Protective Case for iPad
76,Apple Pencil Amazon,Apple Pencil | Etsy,https://www.etsy.com/market/apple_pencil,"Check out our apple pencil selection for the very best in unique or custom, handmade pieces from our stickers, labels & tags shops.",77,Check out our apple pencil selection for the very best in unique or custom handmade pieces from our stickers labels tags shops
77,Apple Pencil Amazon,IPad For Dummies - Page 357 - Google Books Result,https://books.google.com/books?id=avtmCgAAQBAJ&pg=PA357&lpg=PA357&dq=Apple+Pencil+Amazon&source=bl&ots=mCXRlm0ZrC&sig=ACfU3U1PLzO8PmyhPfw4wz4Bgsk0kvm-4Q&hl=en&sa=X&ved=2ahUKEwiA5Zm-0ojzAhUHfnAKHftGARAQ6AF6BQiUAhAD,"Edward C. Baig, ‎LeVitus · 2015 · ‎Computers... 240 Amazon Comixology app, 342–343 Amazon Instant Video streaming app, ... 147, 150, 156 Apple Newton, 23 Apple Pay, 28, 29, 302 Apple Pencil, 8,47, ...",78,Edward C Baig LeVitus 0 Computers 0 Amazon Comixology app 0 0 Amazon Instant Video streaming app 0 0 0 Apple Newton 0 Apple Pay 0 0 0 Apple Pencil 0 0
78,Apple Pencil Amazon,Mac Fan 2019年3月号 - Page 53 - Google Books Result,https://books.google.com/books?id=fheFDwAAQBAJ&pg=PA53&lpg=PA53&dq=Apple+Pencil+Amazon&source=bl&ots=UpzRVBP-is&sig=ACfU3U03tjgLoGqDGiLLtDdrjoVa9lXzMg&hl=en&sa=X&ved=2ahUKEwiA5Zm-0ojzAhUHfnAKHftGARAQ6AF6BQiZAhAD,Mac Fan編集部 · 2019 · ‎Computersたとえ Air、iPad(第6世代)、iPad Pro、Apple Pencil、Apple Watch、Beats製品などが販売されており、iPhoneや Apple公式サイトで14万5584円(税込)ですが、Amazon ...,79,Mac Fan 編集 部 0 Computers たとえ Air iPad 0 世代 iPad Pro Apple Pencil Apple Watch Beats 製品 販売 さ おり iPhone Apple 公式 ｻｲﾄ 0 万 0 円 税込 Amazon
79,Apple Pencil Amazon,Mac Fan 2018年6月号 - Page 79 - Google Books Result,https://books.google.com/books?id=5jlYDwAAQBAJ&pg=PA79&lpg=PA79&dq=Apple+Pencil+Amazon&source=bl&ots=IWgnvY7Ve0&sig=ACfU3U1wQPZCPJbCzyZOGXjTT11dhIQ0CQ&hl=en&sa=X&ved=2ahUKEwiA5Zm-0ojzAhUHfnAKHftGARAQ6AF6BQiWAhAD,Mac Fan編集部 · 2018 · ‎Technology & EngineeringiPadとApple Pencilを勉強仕様に仕上げるアクセサリ Apple Pencilをマグネットで固定 ... Apple Pencil用グリップ c FRTMA a 1400円前後 A https://www.amazon.co.jp/ ...,80,Mac Fan 編集 部 0 Technology EngineeringiPad Apple Pencil 勉強 仕様 仕上げる ｱｸｾｻﾘ Apple Pencil ﾏｸﾞﾈｯﾄ 固定 Apple Pencil ｸﾞﾘｯﾌﾟ c FRTMA a 0 円 前後 A https www amazon co jp
80,Apple Pencil Amazon,"My iPad (Covers iOS 9 for iPad Pro, all models of iPad Air ...",https://books.google.com/books?id=9xXPCgAAQBAJ&pg=PT823&lpg=PT823&dq=Apple+Pencil+Amazon&source=bl&ots=Lehp_08JBi&sig=ACfU3U05zIdCZFz25oOwZF7GEMVE5Lj-ug&hl=en&sa=X&ved=2ahUKEwiA5Zm-0ojzAhUHfnAKHftGARAQ6AF6BQiXAhAD,"Gary Rosenzweig · 2015 · ‎ComputersAlways Bcc Myself option (Mail), 195 Amazon Instant Video, 102,407 Angry Birds HD, ... 98100 signing up for, 97 Apple password, resetting, 66 Apple Pencil, ...",81,Gary Rosenzweig 0 ComputersAlways Bcc Myself option Mail 0 Amazon Instant Video 0 0 Angry Birds HD 0 signing up for 0 Apple password resetting 0 Apple Pencil
81,Apple Pencil Amazon,IPad For Seniors For Dummies - Page 421 - Google Books Result,https://books.google.com/books?id=NPtFDwAAQBAJ&pg=PA421&lpg=PA421&dq=Apple+Pencil+Amazon&source=bl&ots=kOVJnexJum&sig=ACfU3U1xwk4TPL_DwswPDtPmXujDhTwj_g&hl=en&sa=X&ved=2ahUKEwiA5Zm-0ojzAhUHfnAKHftGARAQ6AF6BQiYAhAD,"Dwight Spivey · 2017 · ‎Computers... 88 accessories Apple Digital AV Adapter, 19 Apple Pencil, 9, ... 183 volume, adjusting, 93–94 waking, setting, 354–356 Amazon.com, 253 Android tablet, ...",82,Dwight Spivey 0 Computers 0 accessories Apple Digital AV Adapter 0 Apple Pencil 0 0 volume adjusting 0 0 waking setting 0 0 Amazon com 0 Android tablet
82,Apple Pencil Amazon,The Principles and Processes of Interactive Design,https://books.google.com/books?id=Vt8yBgAAQBAJ&pg=PA114&lpg=PA114&dq=Apple+Pencil+Amazon&source=bl&ots=Tju5rKGHTJ&sig=ACfU3U1LrALWQ5_hsep9WJnjvl5CZqGhBA&hl=en&sa=X&ved=2ahUKEwiA5Zm-0ojzAhUHfnAKHftGARAQ6AF6BQiVAhAD,"Jamie Steane · 2015 · ‎Design... as Amazon's Kindle and Apple's iPad, have reignited interest in the art of book and magazine ... With each of the following steps, start with pencil and.",83,Jamie Steane 0 Design as Amazon s Kindle and Apple s iPad have reignited interest in the art of book and magazine With each of the following steps start with pencil and
83,Apple Pencil Amazon,Mac Fan 2019年1月号 - Page 200 - Google Books Result,https://books.google.com/books?id=Td57DwAAQBAJ&pg=PA200&lpg=PA200&dq=Apple+Pencil+Amazon&source=bl&ots=kc_4vgvU2I&sig=ACfU3U23ikgntbkk7u8Z-xpjCuMeh3ReWA&hl=en&sa=X&ved=2ahUKEwiA5Zm-0ojzAhUHfnAKHftGARAQ6AF6BQiRAhAD,Mac Fan編集部 · 2018 · ‎Technology & Engineering7 1 名様※掲載写真にあるMac、iPhone、iPad、Apple Pencil等はプレゼントに含まれませ ... また、Amazon Echoなどのスマートスピーカと連係させれば、音声で家電を操作 ...,84,Mac Fan 編集 部 0 Technology Engineering 0 0 名 掲載 写真 ある Mac iPhone iPad Apple Pencil ﾌﾟﾚｾﾞﾝﾄ 含ま Amazon Echo ｽﾋﾟｰｶ 連係 さ 音声 家電 操作
84,Apple Pencil Amazon,The English Ladder Level 4 Activity Book with Songs Audio CD,https://books.google.com/books?id=7JE4Uh6m6c8C&pg=PT3&lpg=PT3&dq=Apple+Pencil+Amazon&source=bl&ots=l7pdZcBQMx&sig=ACfU3U3oVMukthPlnqu_r00ta5TfvnSkXQ&hl=en&sa=X&ved=2ahUKEwiA5Zm-0ojzAhUHfnAKHftGARAQ6AF6BQiSAhAD,"Susan House, ‎Katharine Scott · 2012 · ‎Foreign Language Study... long (hair),white (hair) School objects: apple, books, bottle of water, crayons, computer game, glue, mobile phone, MP3 player, notebooks, pencil case, ...",85,Susan House Katharine Scott 0 Foreign Language Study long hair white hair School objects apple books bottle of water crayons computer game glue mobile phone MP 0 player notebooks pencil case
85,Apple Pencil Amazon,"Using Thematic Thinking to Achieve Business Success, Growth, ...",https://books.google.com/books?id=SGNoAwAAQBAJ&pg=PA36&lpg=PA36&dq=Apple+Pencil+Amazon&source=bl&ots=DMOZzBPqrs&sig=ACfU3U0qLZFIo7T17qRJ05zAmZlyMgaFRg&hl=en&sa=X&ved=2ahUKEwiA5Zm-0ojzAhUHfnAKHftGARAQ6AF6BQiTAhAD,"Julia Kathi Froehlich, ‎Martin Hoegl, ‎Michael Gibbert · 2014 · ‎Business & EconomicsiPod & iTunes Apple Purchase, storage, and replay of music are convenient. ... Amazon Purchase, storage, and reading of e-books are convenient.",86,Julia Kathi Froehlich Martin Hoegl Michael Gibbert 0 Business EconomicsiPod iTunes Apple Purchase storage and replay of music are convenient Amazon Purchase storage and reading of e books are convenient
