,Unnamed: 0,keyword,site_name,URL,snippet,ranking,target
0,0,あっぷる,Apple（日本）,https://www.apple.com/jp/,革新に満ちたAppleの世界へようこそ。AppleのウェブサイトではiPhoneからiPad、Apple Watch、Mac、Apple TVまで、すべての製品の購入ができます。アクセサリやエンターテインメントを探す時も、専任スペシャリストによるデバイスのサポートが必要な時も ...,1,革新 満ち Apple 世界 よう Apple ｳｪﾌﾞｻｲﾄ iPhone iPad Apple Watch Mac Apple TV すべて 製品 購入 でき ｱｸｾｻﾘ ｴﾝﾀｰﾃｲﾝﾒﾝﾄ 探す 時 専任 ｽﾍﾟｼｬﾘｽﾄ よる ﾃﾞﾊﾞｲｽ ｻﾎﾟｰﾄ 必要 時
1,1,あっぷる,Apple（日本）,https://www.apple.com/jp/,革新に満ちたAppleの世界へようこそ。AppleのウェブサイトではiPhoneからiPad、Apple Watch、Mac、Apple TVまで、すべての製品の購入ができます。アクセサリやエンターテインメントを探す時も、専任スペシャリストによるデバイスのサポートが必要な時も ...,2,革新 満ち Apple 世界 よう Apple ｳｪﾌﾞｻｲﾄ iPhone iPad Apple Watch Mac Apple TV すべて 製品 購入 でき ｱｸｾｻﾘ ｴﾝﾀｰﾃｲﾝﾒﾝﾄ 探す 時 専任 ｽﾍﾟｼｬﾘｽﾄ よる ﾃﾞﾊﾞｲｽ ｻﾎﾟｰﾄ 必要 時
2,2,あっぷる,Apple - Wikipedia,https://ja.wikipedia.org/wiki/Apple,Apple Inc. （アップル）は、カリフォルニア州クパチーノに本社を置くアメリカ合衆国の多国籍テクノロジー企業である。デジタル家庭電化製品、ソフトウェア、オンラインサービスの開発・販売を行っている。,3,Apple Inc ｱｯﾌﾟﾙ ｶﾘﾌｫﾙﾆｱ 州 ｸﾊﾟﾁｰﾉ 本社 置く ｱﾒﾘｶ 合衆 国籍 ﾃｸﾉﾛｼﾞｰ 企業 ある ﾃﾞｼﾞﾀﾙ 家庭 電化 ｿﾌﾄｳｪｱ ｵﾝ ﾗｲﾝ ｻｰﾋﾞｽ 開発 販売 行っ いる
3,3,あっぷる,アップル(Apple) - 【メルカリ】No.1フリマアプリ - Mercari,https://www.mercari.com/jp/brand/3272/,アップル - アップルはアメリカの企業で、日本においてもさまざまな製品やサービスが人気を集めています。デザイナーを中心に人気のあるMac、スマートフォンの認知度を広めたとも言えるiPhone、タブレット端末のiPadなどがあります。,4,ｱｯﾌﾟﾙ ｱｯﾌﾟﾙ ｱﾒﾘｶ 企業 日本 おい 製品 ｻｰﾋﾞｽ 人気 集め い ﾃﾞｻﾞｲﾅｰ 中心 人気 ある Mac ﾌｫﾝ 認知 度 広め 言える iPhone ﾀﾌﾞﾚｯﾄ 端末 iPad あり
4,4,あっぷる,Appleに関する最新記事831件 | WIRED.jp,https://wired.jp/tag/apple/,Apple（アップル）は、インターネット関連製品、デジタル家庭電化製品、ソフトウェア製品を開発・販売する多国籍企業。代表的なハードウェア製品として、スマートフォンのiPhone、タブレット型情報端末のiPad、パーソナルコンピュータのMacintosh、携帯 ...,5,Apple ｱｯﾌﾟﾙ ｲﾝﾀｰﾈｯﾄ 関連 ﾃﾞｼﾞﾀﾙ 家庭 電化 ｿﾌﾄｳｪｱ 製品 開発 販売 する 国籍 企業 代表 ﾊｰﾄﾞｳｪｱ し ﾌｫﾝ iPhone ﾀﾌﾞﾚｯﾄ 情報 端末 iPad ﾊﾟｰｿﾅﾙ ｺﾝﾋﾟｭｰﾀ Macintosh 携帯
5,5,あっぷる,アップル（読み）あっぷる（英語表記）Apple Inc. - コトバンク,https://kotobank.jp/word/%E3%82%A2%E3%83%83%E3%83%97%E3%83%AB-11391,日本大百科全書(ニッポニカ) - アップルの用語解説 - アメリカのコンピュータ会社。本社所在地はカリフォルニア州クパーチーノ。カナダ産のリンゴであるマッキントッシュMacintoshに由来するリンゴのロゴマークで有名。2007年1月に社名を従来のアップル・ ...,6,日本 百科 全書 ﾆｯﾎﾟﾆｶ ｱｯﾌﾟﾙ 用語 解説 ｱﾒﾘｶ ｺﾝﾋﾟｭｰﾀ 会社 本社 所在 地 ｶﾘﾌｫﾙﾆｱ 州 ｸﾊﾟｰﾁｰﾉ ｶﾅﾀﾞ ﾘﾝｺﾞ ある ﾏｯｷﾝﾄｯｼｭ Macintosh 由来 する ﾘﾝｺﾞ ﾛｺﾞ ﾏｰｸ 0 年 0 月 社名 従来 ｱｯﾌﾟﾙ
6,6,あっぷる,介護の応援団【あっぷる】 姫路市 - 加古川市 - たつの市 - 明石市,https://www.apple-117.jp/,介護保険申請代行・ケアプラン作成・介護サービスなら117グループ「あっぷる」へ.,7,介護 保険 申請 代行 ｹｱ ﾌﾟﾗﾝ 作成 介護 ｻｰﾋﾞｽ 0 ｸﾞﾙｰﾌﾟ あっぷる
7,7,あっぷる,あっぷる新着情報 - NBC長崎放送,https://www.nbc-nagasaki.co.jp/apple/,あっぷる新着情報. 3/19（木）ささみと豆もやしの香草和え他. 礒永 由紀 先生 料理レシピはこちら ... 出演者. NBCあっぷるtwitter. あっぷるfacebook. あっぷるテレPlus+. あっぷる. 番組でご紹介した情報 · 出演者の紹介 · あっぷるクッキング ...,8,あっぷる 新着 情報 0 0 木 ささみ 豆もやし 香草 他 礒 永 由紀 先生 料理 ﾚｼﾋﾟ 出演 NBC あっぷる twitter あっぷる facebook あっぷる ﾃﾚ Plus あっぷる 番組 紹介 し 情報 出演 紹介 あっぷる ｸｯｷﾝｸﾞ
8,8,あっぷる,あっぷる (@ririka0221apple) | Twitter,https://twitter.com/ririka0221apple,The latest Tweets from あっぷる (@ririka0221apple). PKAのA（@pka_123） サブ（@aptan_21）  あぽちゃんねる↪︎ https://t.co/P1Ecuu5iUq.,9,The latest Tweets from あっぷる ririka 0 apple PKA A pka 0 ｻﾌﾞ aptan 0 ねる https t co P 0 Ecuu 0 iUq
9,9,あっぷる,田中店 | 美容室あっぷる,https://apple-biyou.com/tanaka,田中店. 新型コロナウイルス感染予防対策について. いつも美容室あっぷるをご愛顧いただき誠にありがとうございます。 お客様とスタッフの安全・安心を守るため、お願いがございます。 集団感染を未然に防ぐため、下記のいずれかに該当される方は事前に ...,10,田中 新型 ｺﾛﾅ ｳｲﾙｽ 感染 予防 対策 つい 美容 あっぷる 愛顧 いただき 誠 ござい 客 ｽﾀｯﾌ 安全 安心 守る ため 願い ござい 集団 感染 未然 防ぐ ため 下記 該当 さ 方 事前
10,10,あっぷる,コンタクトレンズ通販 レンズアップル,https://www.lens-apple.jp/,コンタクトレンズ通販レンズアップルは、安心・便利なコンタクトレンズのオンラインショップです。ワンデーアキュビュー、デイリーズアクアの国内正規コンタクトレンズやケア用品を超特価でお届けします。,11,ｺﾝﾀｸﾄ ﾚﾝｽﾞ 通販 ﾚﾝｽﾞ ｱｯﾌﾟﾙ 安心 便利 ｺﾝﾀｸﾄ ﾚﾝｽﾞ ｵﾝ ﾗｲﾝ ｼｮｯﾌﾟ ﾜﾝ ﾃﾞｰ ｱｷｭﾋﾞｭｰ ﾃﾞｲﾘｰｽﾞ ｱｸｱ 国内 正規 ｺﾝﾀｸﾄ ﾚﾝｽﾞ ｹｱ 特価 届け し
11,11,あっぷる,アップルの一覧 | ギズモード・ジャパン,https://www.gizmodo.jp/tag/enterprise/apple/,アップルに関する記事一覧ページです。GIZMODO JAPANは最新のスマートフォンなどのデジタルデバイス情報や最新のガジェット情報から、テクノロジー、サイエンス、ビジネス、エンターテイメントの情報まで、刺激的で他とは違う情報をお届けします。,12,ｱｯﾌﾟﾙ 関する 記事 一覧 ﾍﾟｰｼﾞ GIZMODO JAPAN 最新 ﾌｫﾝ ﾃﾞｼﾞﾀﾙ ﾃﾞﾊﾞｲｽ 情報 最新 ｶﾞｼﾞｪｯﾄ 情報 ﾃｸﾉﾛｼﾞｰ ｻｲｴﾝｽ ﾋﾞｼﾞﾈｽ ｴﾝﾀｰﾃｲﾒﾝﾄ 情報 刺激 他 違う 情報 届け し
12,12,あっぷる,あっぷる 関西 神戸有馬店 | 中古車なら【カーセンサーnet】,https://www.carsensor.net/shop/hyogo/315129005/,あっぷるグループ総在庫600台以上！ 法人名: 株式会社BuyA; 住所: 兵庫県神戸市北区有野町唐櫃144－1. MAP; 営業時間: 10:00～20:00 来店予約OK; 定休日: 水曜日 ※祝日の場合は営業. お電話でのお問い合わせ. 無料. 0078-6003-694593. 評価: 4.8 · ‎25 票 · ‎価格帯: 30.3万円～410万円,13,あっぷる ｸﾞﾙｰﾌﾟ 在庫 0 台 以上 法人 名 株式 会社 BuyA 住所 兵庫 県 神戸 市 北 区 有野 町 唐櫃 0 0 MAP 営業 時間 0 0 0 0 来店 予約 OK 定休 日 水曜 日 祝日 場合 営業 電話 問い合わせ 無料 0 0 0 評価 0 0 0 票 価格 0 0 万 円 0 万 円
13,13,あっぷる,Apple（アップル） - 価格.com,https://kakaku.com/maker/Apple_9/,Apple（アップル）の製品をカテゴリから探すことができます。カテゴリごとの人気売れ筋製品ランキングや、新着ニュースなど、Apple（アップル）の製品に関する情報はここでチェック！,14,Apple ｱｯﾌﾟﾙ 製品 ｶﾃｺﾞﾘ 探す こと でき ｶﾃｺﾞﾘ 人気 売れ筋 製品 ﾗﾝｷﾝｸﾞ 新着 ﾆｭｰｽ Apple ｱｯﾌﾟﾙ 製品 関する 情報 ﾁｪｯｸ
14,14,あっぷる,秋田プレミアムあっぷる | TOP,http://www.xn--l8j6cuc0dv605bd1f.jp/,秋田あっぷるで秋田の情報を知る！秋田県のタウン情報誌あっぷるが発信する秋田県の食べ処やラーメン、温泉、秋田美人、お得なクーポンまで情報満載サイト！,15,秋田 あっぷる 秋田 情報 知る 秋田 県 ﾀｳﾝ 情報 あっぷる 発信 する 秋田 県 食べ 処 ﾗｰﾒﾝ 温泉 秋田 美人 得 ｸｰﾎﾟﾝ 情報 満載 ｻｲﾄ
15,15,あっぷる,GRANNY SMITH APPLE PIE & COFFEE グラニースミス ...,https://grannysmith-pie.com/,ドリンク無料の“早得”キャンペーンが期間延長！！秋限定ドリンク&キッシュが発売開始！！「キャラメルナッツアップルパイ」販売開始！！秋限定「スイートポテトアップルパイ」販売開始！！「モンブランアップルパイ」限定販売！！夏季限定『アフォガード ...,16,ﾄﾞﾘﾝｸ 無料 早 得 ｷｬﾝﾍﾟｰﾝ 期間 延長 秋 限定 ﾄﾞﾘﾝｸ ｷｯｼｭ 発売 開始 ｷｬﾗﾒﾙﾅｯﾂｱｯﾌﾟﾙﾊﾟｲ 販売 開始 秋 限定 ｽｲｰﾄﾎﾟﾃﾄｱｯﾌﾟﾙﾊﾟｲ 販売 開始 ﾓﾝﾌﾞﾗﾝｱｯﾌﾟﾙﾊﾟｲ 限定 販売 夏季 限定 ｱﾌｫｶﾞｰﾄﾞ
16,16,あっぷる,株式会社あっぷる,https://www.apple-inc.co.jp/,相続、コンサルティング、住宅・マンション・土地​、不動産のことならあっぷるへ！株式会社あっぷる（東京都板橋区大山金井町37-5）。TEL03-5966-1221。板橋区を中心に住宅・マンション・土地等の不動産に関わる事業を展開。皆様のベストパートナー ...,17,相続 ｺﾝｻﾙﾃｨﾝｸﾞ 住宅 ﾏﾝｼｮﾝ 土地 動産 こと あっぷる 株式 会社 あっぷる 東京 都 板橋 区 大山 金井 町 0 0 TEL 0 0 0 板橋 区 中心 住宅 ﾏﾝｼｮﾝ 土地 動産 関わる 事業 展開 皆 ﾍﾞｽﾄ ﾊﾟｰﾄﾅｰ
17,17,あっぷる,かふぇ あっぷる - 人形町/カフェ | 食べログ,https://tabelog.com/tokyo/A1302/A130204/13036682/,"かふぇ あっぷる (人形町/カフェ)の店舗情報は食べログでチェック！人形駅前の隠れ家的なカフェ 【禁煙】口コミや評価、写真など、ユーザーによるリアルな情報が満載です！地図や料理メニューなどの詳細情報も充実。支払い方法： カード可 （JCB、AMEX、Diners） 電...お問い合わせ： 03-3639-1445営業時間： 営業時間, 10:30～22:30 LO, 10:30～...ジャンル： カフェ、ケーキ、コーヒー専門店 評価: 3.6 · ‎78 票 · ‎価格帯: ￥1,000～￥1,999",18,かふぇ あっぷる 人形町 ｶﾌｪ 店舗 情報 食べ ﾛｸﾞ ﾁｪｯｸ 人形 駅前 隠れ家 ｶﾌｪ 禁煙 口ｺﾐ 評価 写真 ﾕｰｻﾞｰ よる ﾘｱﾙ 情報 満載 地図 料理 ﾒﾆｭｰ 詳細 情報 充実 支払い 方法 ｶｰﾄﾞ 可 JCB AMEX Diners 電 問い合わせ 0 0 0 営業 時間 営業 時間 0 0 0 0 LO 0 0 ｼﾞｬﾝﾙ ｶﾌｪ ｹｰｷ ｺｰﾋｰ 専門 評価 0 0 0 票 価格 0 0 0 0
18,18,あっぷる,中古車買取・中古車査定のアップル【公式】,https://www.applenet.co.jp/,アップルの中古車買取・中古車査定サービス。無料で自動車の査定相場が分かります。車のことなら国内最大級の買取実績アップルへ！,19,ｱｯﾌﾟﾙ 中古 買取 中古 査定 ｻｰﾋﾞｽ 無料 自動 査定 相場 分かり 車 こと 国内 最大 買取 実績 ｱｯﾌﾟﾙ
19,19,あっぷる,中古車買取・中古車査定のアップル【公式】,https://www.applenet.co.jp/,アップルの中古車買取・中古車査定サービス。無料で自動車の査定相場が分かります。車のことなら国内最大級の買取実績アップルへ！,20,ｱｯﾌﾟﾙ 中古 買取 中古 査定 ｻｰﾋﾞｽ 無料 自動 査定 相場 分かり 車 こと 国内 最大 買取 実績 ｱｯﾌﾟﾙ
20,20,あっぷる,稲沢店 - 中古車査定のアップル,https://www.applenet.co.jp/shop/0091/,稲沢店 |アップルの車買取・車査定サービス。無料で自動車の買取相場が分かります。車のことなら国内最大級の買取実績アップルへ！,21,稲沢 ｱｯﾌﾟﾙ 車 買取 車 査定 ｻｰﾋﾞｽ 無料 自動 買取 相場 分かり 車 こと 国内 最大 買取 実績 ｱｯﾌﾟﾙ
21,21,あっぷる,「アップルストア」の検索結果 - 【楽天市場】ジャンルトップ ...,https://search.rakuten.co.jp/search/mall/%E3%82%A2%E3%83%83%E3%83%97%E3%83%AB%E3%82%B9%E3%83%88%E3%82%A2/,楽天市場-「アップルストア」598件 人気の商品を価格比較・ランキング･レビュー・口コミで検討できます。ご購入でポイント取得がお得。セール商品・送料無料商品も多数。「あす楽」なら翌日お届けも可能です。,22,楽天 市場 ｱｯﾌﾟﾙ ｽﾄｱ 0 件 人気 商品 価格 比較 ﾗﾝｷﾝｸﾞ ﾚﾋﾞｭｰ 口ｺﾐ 検討 でき 購入 ﾎﾟｲﾝﾄ 取得 得 ｾｰﾙ 商品 送料 無料 商品 多数 あす 楽 翌日 届け
22,22,あっぷる,あっぷるとは何？ - Weblio辞書,https://www.weblio.jp/content/%E3%81%82%E3%81%A3%E3%81%B7%E3%82%8B,「あっぷる」の意味はりんごのこと。Weblio国語辞典では「あっぷる」の意味や使い方、用例、類似表現などを解説しています。,23,あっぷる 意味 りんご こと Weblio 国語 辞典 あっぷる 意味 使い 用例 類似 表現 解説 し い
23,23,あっぷる,あっぷる神戸有馬店 | GROUP店舗一覧,https://www.apple-car.jp/shop/kobearima,あっぷる 神戸有馬店 所在地 ：〒651-1331 兵庫県神戸市北区有野町唐櫃144-1連絡先 ：TEL. 078-987-5055 FAX. 078-987-5115営業時間 ：10:00～20:00 来店予約OK定休日 ：水曜日 ※祝日の場合は営業修復歴車の取り扱いも行っておりますが、走行には支障の ...,24,あっぷる 神戸 有馬 所在 地 0 0 兵庫 県 神戸 市 北 区 有野 町 唐櫃 0 0 連絡 先 TEL 0 0 0 FAX 0 0 0 営業 時間 0 0 0 0 来店 予約 OK 定休 日 水曜 日 祝日 場合 営業 修復 取り扱い 行っ おり 走行 支障
24,24,あっぷる,あっぷる神戸有馬店 | GROUP店舗一覧,https://www.apple-car.jp/shop/kobearima,あっぷる 神戸有馬店 所在地 ：〒651-1331 兵庫県神戸市北区有野町唐櫃144-1連絡先 ：TEL. 078-987-5055 FAX. 078-987-5115営業時間 ：10:00～20:00 来店予約OK定休日 ：水曜日 ※祝日の場合は営業修復歴車の取り扱いも行っておりますが、走行には支障の ...,25,あっぷる 神戸 有馬 所在 地 0 0 兵庫 県 神戸 市 北 区 有野 町 唐櫃 0 0 連絡 先 TEL 0 0 0 FAX 0 0 0 営業 時間 0 0 0 0 来店 予約 OK 定休 日 水曜 日 祝日 場合 営業 修復 取り扱い 行っ おり 走行 支障
25,25,あっぷる,あっぷる関西 グループ公式 | 西日本最大級の国産車・輸入車の ...,https://www.apple-car.jp/,あっぷる関西 グループ総在庫数500台以上！西日本最大クラスの特選中古車販売店 最新のチラシと在庫情報はもちろん、各店舗の情報も掲載中！,26,あっぷる 関西 ｸﾞﾙｰﾌﾟ 在庫 数 0 台 以上 西 日本 最大 ｸﾗｽ 特選 中古 販売 最新 ﾁﾗｼ 在庫 情報 店舗 情報 掲載
26,26,あっぷる,原子力広報チームあっぷる 原子力研究開発機構敦賀事業本部,https://www.jaea.go.jp/04/xturuga/chiiki/apple.html,私たち「あっぷる」は、原子力機構の敦賀地区に勤務する女性職員で構成する広報チームです。 主に福井県内で、「もんじゅ」や「ふげん」をはじめとする敦賀の業務紹介をはじめ、原子力やエネルギーについて地域の皆様に分かりやすく伝えることを目指した ...,27,あっぷる 原子 機構 敦賀 地区 勤務 する 女性 職員 構成 する 広報 ﾁｰﾑ 福井 県 もんじゅ ふげん はじめ する 敦賀 業務 紹介 はじめ 原子 ｴﾈﾙｷﾞｰ つい 地域 皆 分かり 伝える こと 目指し
27,27,あっぷる,株式会社あっぷる ソーシャルメディアポリシー - 117グループ,https://www.117.co.jp/compliance/apple.html,株式会社あっぷるの役員および従業員（正社員、嘱託社員、パート、アルバイト、派遣社員など全ての従業者をいい、以下、「私たち」といいます。）は、ソーシャルメディアでのコミュニケーションにおいて、発信した情報が容易かつ瞬時に拡散すると共に、 ...,28,株式 会社 あっぷる 役員 従業 正 社員 嘱託 社員 ﾊﾟｰﾄ ｱﾙﾊﾞｲﾄ 派遣 社員 全て 従業 いい 以下 いい ｿｰｼｬﾙ ﾒﾃﾞｨｱ ｺﾐｭﾆｹｰｼｮﾝ おい 発信 し 情報 瞬時 拡散 する 共
28,28,あっぷる,アップル引越センター | 公式サイトなら最安値,https://apple-hikkoshi.jp/,引越しはアップルセンターにご相談ください。面倒なやり取りや電話なしで、24時間365日、見積もり表示も予約も全てネットで完了できます。テレビCM放映、創業13年・引っ越し実績16万件の実績、 東京圏を中心に大阪圏、名古屋圏で15支店を展開する引越会社 ...,29,引越し ｱｯﾌﾟﾙ ｾﾝﾀｰ 相談 ください 面倒 やり取り 電話 なし 0 時間 0 見積もり 表示 予約 全て ﾈｯﾄ 完了 でき ﾃﾚﾋﾞ CM 放映 創業 0 年 引っ越し 実績 0 万 件 実績 東京 中心 大阪 名古屋 0 支店 展開 する 引越 会社
29,29,あっぷる,AAPL:NASDAQ GS 株価 - アップル - Bloomberg Markets,https://www.bloomberg.co.jp/quote/AAPL:US,アップル (AAPL:NASDAQ GS) の株価、株式情報、チャート、関連ニュースなど、企業概要や株価の分析をご覧いただけます。,30,ｱｯﾌﾟﾙ AAPL NASDAQ GS 株価 株式 情報 ﾁｬｰﾄ 関連 ﾆｭｰｽ 企業 概要 株価 分析 ご覧 いただけ
30,30,あっぷる,英会話｜大阪・梅田と難波の英会話スクール【アップルk ...,https://www.applek.com/,英会話 大阪梅田と難波の英会話スクール創立30周年【アップルkランゲージ】。 初心者からビジネスまでOK1回2475円〜月謝制で英語・英会話・資格を習得！ 独自教授法トレーニングに合格した講師陣が個室レッスン。全外協加盟。 駅前の大人スクール。,31,英 会話 大阪 梅田 難波 英 会話 ｽｸｰﾙ 創立 0 周年 ｱｯﾌﾟﾙ k ﾗﾝｹﾞｰｼﾞ 初心 ﾋﾞｼﾞﾈｽ OK 0 回 0 円 月謝 英語 英 会話 資格 習得 教授 法 ﾄﾚｰﾆﾝｸﾞ 合格 し 講師 陣 個室 ﾚｯｽﾝ 加盟 駅前 大人 ｽｸｰﾙ
31,31,あっぷる,あっぷるワイド - NHK,https://www4.nhk.or.jp/P2933/,3 日後 — 青森のホットなニュースを速くわかりやすく！県内各地にリポーターが出かけて魅力を発掘するコーナーもお届けします。気象予報士が伝える気象情報やお天気の話題も充実。「ストップ！詐欺」「お国ことばで川柳」「あっぷる ...,32,0 青森 ﾎｯﾄ ﾆｭｰｽ 速く わかり 県内 各地 ﾘﾎﾟｰﾀｰ 出かけ 魅力 発掘 する ｺｰﾅｰ 届け し 気象 予報 伝える 気象 情報 天気 話題 充実 ｽﾄｯﾌﾟ 詐欺 国 ことば 川柳 あっぷる
32,32,あっぷる,アップル【AAPL】：掲示板/株価 - Yahoo!ファイナンス,https://stocks.finance.yahoo.co.jp/us/bbs/AAPL,8 時間前 — アップル【AAPL】の掲示板。NYSE（ニューヨーク証券取引所）とNASDAQに上場している全銘柄の株価やチャート、業績などを網羅。ADR日本株やランキングも充実しています。,33,0 時間 前 ｱｯﾌﾟﾙ AAPL 掲示 NYSE ﾆｭｰﾖｰｸ 証券 取引 NASDAQ 上場 し いる 銘柄 株価 ﾁｬｰﾄ 業績 網羅 ADR 日本 株 ﾗﾝｷﾝｸﾞ 充実 し い
33,33,あっぷる,求人を探す | 株式会社あっぷる(117グループ),https://job-gear.net/apple1172/all/tGo_1_20_DUD%2CID/MLkyujin_l.htm,お持ちの資格や経験を活かしませんか？／ ▽充実の福利厚生が自慢！ 「わが社の健康宣言」認定企業☆ 交通費規定支給・マイカー通勤や 育休制度など働きやすい条件... 詳しく見る. 給与: 時給1100円～1560円（経験・能力による）. 勤務地: あっぷる居宅 ...,34,持ち 資格 経験 活かし 充実 福利 厚生 自慢 社 健康 宣言 認定 企業 交通 規定 支給 ﾏｲ ｶｰ 通勤 育休 制度 働き 条件 詳しく 見る 給与 時給 0 円 0 円 経験 能力 よる 勤務 地 あっぷる 居宅
34,34,あっぷる,アップル豊橋佐藤店 (愛知県豊橋市) の詳細 - 中古車 - グーネット,https://www.goo-net.com/usedcar_shop/0207745/detail.html,アップル豊橋佐藤店の店舗詳細情報。中古車・中古車情報のことなら【クルマ、まるごと。グーネット中古車（Goo-net）】中古自動車登録台数が豊富だから、あなたにピッタリな1台が見つかるはず。中古車購入、中古車販売の情報も満載！営業時間： 10：00-19：00 評価: 3.7 · ‎3 票,35,ｱｯﾌﾟﾙ 豊橋 佐藤 店舗 詳細 情報 中古 中古 情報 こと ｸﾙﾏ まる ｸﾞｰ ﾈｯﾄ 中古 Goo net 中古 自動 登録 台数 0 台 見つかる はず 中古 購入 中古 販売 情報 満載 営業 時間 0 0 0 0 評価 0 0 0 票
35,35,あっぷる,アップル豊橋佐藤店 (愛知県豊橋市) の詳細 - 中古車 - グーネット,https://www.goo-net.com/usedcar_shop/0207745/detail.html,アップル豊橋佐藤店の店舗詳細情報。中古車・中古車情報のことなら【クルマ、まるごと。グーネット中古車（Goo-net）】中古自動車登録台数が豊富だから、あなたにピッタリな1台が見つかるはず。中古車購入、中古車販売の情報も満載！営業時間： 10：00-19：00 評価: 3.7 · ‎3 票,36,ｱｯﾌﾟﾙ 豊橋 佐藤 店舗 詳細 情報 中古 中古 情報 こと ｸﾙﾏ まる ｸﾞｰ ﾈｯﾄ 中古 Goo net 中古 自動 登録 台数 0 台 見つかる はず 中古 購入 中古 販売 情報 満載 営業 時間 0 0 0 0 評価 0 0 0 票
36,36,あっぷる,アップル各務原店 （株）ゴトウスバル - 岐阜県 - グーネット,https://www.goo-net.com/usedcar_shop/0203428/detail.html,アップル各務原店 （株）ゴトウスバルの店舗詳細情報。中古車・中古車情報のことなら【クルマ、まるごと。グーネット中古車（Goo-net）】中古自動車登録台数が豊富だから、あなたにピッタリな1台が見つかるはず。中古車購入、中古車販売の情報も満載！営業時間： 10:00~19:00 評価: 4.9 · ‎72 票,37,ｱｯﾌﾟﾙ 各務原 ｺﾞﾄｳｽﾊﾞﾙ 店舗 詳細 情報 中古 中古 情報 こと ｸﾙﾏ まる ｸﾞｰ ﾈｯﾄ 中古 Goo net 中古 自動 登録 台数 0 台 見つかる はず 中古 購入 中古 販売 情報 満載 営業 時間 0 0 0 0 評価 0 0 0 票
37,37,あっぷる,アップルアンドローゼス: 【Apple&Roses】薔薇のタルト ...,http://apple-roses.com/,信州のりんご農家と共に育てた、りんごで作ったアップルタルトやアップルパイを販売しています。薔薇のタルト(アップルアンドローゼス)は、女性に人気でプレゼントにも最適! ギフトや贈答用・ご褒美におしゃれなタルトはいかがですか？,38,信州 りんご 農家 共 育て りんご 作っ ｱｯﾌﾟﾙ ﾀﾙﾄ ｱｯﾌﾟﾙ ﾊﾟｲ 販売 し い 薔薇 ﾀﾙﾄ ｱｯﾌﾟﾙ ｱﾝﾄﾞ ﾛｰｾﾞｽ 女性 人気 ﾌﾟﾚｾﾞﾝﾄ ｷﾞﾌﾄ 贈答 褒美 おしゃれ ﾀﾙﾄ
