,keyword,site_name,snnipet,URL,ranking,target
7,あっぷる,Apple Music - Apple（日本）,Apple Musicはどうすれば聴くことができますか？,"=HYPERLINK(""https://www.apple.com/jp/apple-music/"")",8,Apple Music すれ 聴く こと でき
9,あっぷる,Apple - Wikipedia,Apple Inc. （アップル）は、カリフォルニア州クパチーノに本社を置くアメリカ合衆国の多国籍テクノロジー企業である。デジタル家庭電化製品、ソフトウェア、オンラインサービスの開発・販売を行っている。,"=HYPERLINK(""https://ja.wikipedia.org/wiki/Apple"")",10,Apple Inc ｱｯﾌﾟﾙ ｶﾘﾌｫﾙﾆｱ 州 ｸﾊﾟﾁｰﾉ 本社 置く ｱﾒﾘｶ 合衆 国籍 ﾃｸﾉﾛｼﾞｰ 企業 ある ﾃﾞｼﾞﾀﾙ 家庭 電化 ｿﾌﾄｳｪｱ ｵﾝ ﾗｲﾝ ｻｰﾋﾞｽ 開発 販売 行っ いる
15,あっぷる,アップル(Apple) - 【メルカリ】No.1フリマアプリ - Mercari,アップル - アップルはアメリカの企業で、日本においてもさまざまな製品やサービスが人気を集めています。デザイナーを中心に人気のあるMac、スマートフォンの認知度を広めたとも言えるiPhone、タブレット端末のiPadなどがあります。,"=HYPERLINK(""https://www.mercari.com/jp/brand/3272/"")",16,ｱｯﾌﾟﾙ ｱｯﾌﾟﾙ ｱﾒﾘｶ 企業 日本 おい 製品 ｻｰﾋﾞｽ 人気 集め い ﾃﾞｻﾞｲﾅｰ 中心 人気 ある Mac ﾌｫﾝ 認知 度 広め 言える iPhone ﾀﾌﾞﾚｯﾄ 端末 iPad あり
16,あっぷる,Appleに関する最新記事831件 | WIRED.jp,Apple（アップル）は、インターネット関連製品、デジタル家庭電化製品、ソフトウェア製品を開発・販売する多国籍企業。代表的なハードウェア製品として、スマートフォンのiPhone、タブレット型情報端末のiPad、パーソナルコンピュータのMacintosh、携帯 ...,"=HYPERLINK(""https://wired.jp/tag/apple/"")",17,Apple ｱｯﾌﾟﾙ ｲﾝﾀｰﾈｯﾄ 関連 ﾃﾞｼﾞﾀﾙ 家庭 電化 ｿﾌﾄｳｪｱ 製品 開発 販売 する 国籍 企業 代表 ﾊｰﾄﾞｳｪｱ し ﾌｫﾝ iPhone ﾀﾌﾞﾚｯﾄ 情報 端末 iPad ﾊﾟｰｿﾅﾙ ｺﾝﾋﾟｭｰﾀ Macintosh 携帯
20,あっぷる,Apple Arcade - Apple（日本）,どのくらいのペースで新しいゲームが追加されますか？,"=HYPERLINK(""https://www.apple.com/jp/apple-arcade/"")",21,ﾍﾟｰｽ 新しい ｹﾞｰﾑ 追加 さ
29,あっぷる,アップル（読み）あっぷる（英語表記）Apple Inc. - コトバンク,日本大百科全書(ニッポニカ) - アップルの用語解説 - アメリカのコンピュータ会社。本社所在地はカリフォルニア州クパーチーノ。カナダ産のリンゴであるマッキントッシュMacintoshに由来するリンゴのロゴマークで有名。2007年1月に社名を従来のアップル・ ...,"=HYPERLINK(""https://kotobank.jp/word/%E3%82%A2%E3%83%83%E3%83%97%E3%83%AB-11391"")",30,日本 百科 全書 ﾆｯﾎﾟﾆｶ ｱｯﾌﾟﾙ 用語 解説 ｱﾒﾘｶ ｺﾝﾋﾟｭｰﾀ 会社 本社 所在 地 ｶﾘﾌｫﾙﾆｱ 州 ｸﾊﾟｰﾁｰﾉ ｶﾅﾀﾞ ﾘﾝｺﾞ ある ﾏｯｷﾝﾄｯｼｭ Macintosh 由来 する ﾘﾝｺﾞ ﾛｺﾞ ﾏｰｸ 0 年 0 月 社名 従来 ｱｯﾌﾟﾙ
30,あっぷる,あっぷる新着情報 - NBC長崎放送,あっぷる新着情報. 3/19（木）ささみと豆もやしの香草和え他. 礒永 由紀 先生 料理レシピはこちら ... 出演者. NBCあっぷるtwitter. あっぷるfacebook. あっぷるテレPlus+. あっぷる. 番組でご紹介した情報 · 出演者の紹介 · あっぷるクッキング ...,"=HYPERLINK(""https://www.nbc-nagasaki.co.jp/apple/"")",31,あっぷる 新着 情報 0 0 木 ささみ 豆もやし 香草 他 礒 永 由紀 先生 料理 ﾚｼﾋﾟ 出演 NBC あっぷる twitter あっぷる facebook あっぷる ﾃﾚ Plus あっぷる 番組 紹介 し 情報 出演 紹介 あっぷる ｸｯｷﾝｸﾞ
31,あっぷる,介護の応援団【あっぷる】 姫路市 - 加古川市 - たつの市 - 明石市,介護保険申請代行・ケアプラン作成・介護サービスなら117グループ「あっぷる」へ.,"=HYPERLINK(""https://www.apple-117.jp/"")",32,介護 保険 申請 代行 ｹｱ ﾌﾟﾗﾝ 作成 介護 ｻｰﾋﾞｽ 0 ｸﾞﾙｰﾌﾟ あっぷる
36,あっぷる,あっぷる (@ririka0221apple) | Twitter,The latest Tweets from あっぷる (@ririka0221apple). PKAのA（@pka_123） サブ（@aptan_21）  あぽちゃんねる↪︎ https://t.co/P1Ecuu5iUq.,"=HYPERLINK(""https://twitter.com/ririka0221apple"")",37,The latest Tweets from あっぷる ririka 0 apple PKA A pka 0 ｻﾌﾞ aptan 0 ねる https t co P 0 Ecuu 0 iUq
37,あっぷる,Apple（アップル） - 価格.com,Apple（アップル）の製品をカテゴリから探すことができます。カテゴリごとの人気売れ筋製品ランキングや、新着ニュースなど、Apple（アップル）の製品に関する情報はここでチェック！,"=HYPERLINK(""https://kakaku.com/maker/Apple_9/"")",38,Apple ｱｯﾌﾟﾙ 製品 ｶﾃｺﾞﾘ 探す こと でき ｶﾃｺﾞﾘ 人気 売れ筋 製品 ﾗﾝｷﾝｸﾞ 新着 ﾆｭｰｽ Apple ｱｯﾌﾟﾙ 製品 関する 情報 ﾁｪｯｸ
38,あっぷる,あっぷるぐりむグループ,株式会社あっぷるアイビー. ［あっぷるぐりむグループ］イタリアンレストラン ピッツェリア／焼肉のバーンズ／あっぷるぐりむ／やきとり居酒屋きらび本店（長野県・新潟県・富山県）. © 2021 あっぷるぐりむグループ ...,"=HYPERLINK(""https://appleivy.co.jp/"")",39,株式 会社 あっぷる ｱｲﾋﾞｰ ｸﾞﾙｰﾌﾟ ｲﾀﾘｱﾝ ﾚｽﾄﾗﾝ ﾋﾟｯﾂｪﾘｱ 焼肉 ﾊﾞｰﾝｽﾞ あっぷる やきとり 居酒屋 本店 長野 県 新潟 県 富山 県 0 あっぷる ｸﾞﾙｰﾌﾟ
39,あっぷる,アップルの一覧 | ギズモード・ジャパン,アップルに関する記事一覧ページです。GIZMODO JAPANは最新のスマートフォンなどのデジタルデバイス情報や最新のガジェット情報から、テクノロジー、サイエンス、ビジネス、エンターテイメントの情報まで、刺激的で他とは違う情報をお届けします。,"=HYPERLINK(""https://www.gizmodo.jp/tag/enterprise/apple/"")",40,ｱｯﾌﾟﾙ 関する 記事 一覧 ﾍﾟｰｼﾞ GIZMODO JAPAN 最新 ﾌｫﾝ ﾃﾞｼﾞﾀﾙ ﾃﾞﾊﾞｲｽ 情報 最新 ｶﾞｼﾞｪｯﾄ 情報 ﾃｸﾉﾛｼﾞｰ ｻｲｴﾝｽ ﾋﾞｼﾞﾈｽ ｴﾝﾀｰﾃｲﾒﾝﾄ 情報 刺激 他 違う 情報 届け し
41,あっぷる,コンタクトレンズ通販 レンズアップル,コンタクトレンズ通販レンズアップルは、安心・便利なコンタクトレンズのオンラインショップです。ワンデーアキュビュー、デイリーズアクアの国内正規コンタクトレンズやケア用品を超特価でお届けします。,"=HYPERLINK(""https://www.lens-apple.jp/"")",42,ｺﾝﾀｸﾄ ﾚﾝｽﾞ 通販 ﾚﾝｽﾞ ｱｯﾌﾟﾙ 安心 便利 ｺﾝﾀｸﾄ ﾚﾝｽﾞ ｵﾝ ﾗｲﾝ ｼｮｯﾌﾟ ﾜﾝ ﾃﾞｰ ｱｷｭﾋﾞｭｰ ﾃﾞｲﾘｰｽﾞ ｱｸｱ 国内 正規 ｺﾝﾀｸﾄ ﾚﾝｽﾞ ｹｱ 特価 届け し
42,あっぷる,Apple TV+ - Apple（日本）,どうすれば観ることができますか？,"=HYPERLINK(""https://www.apple.com/jp/apple-tv-plus/"")",43,すれ 観る こと でき
46,あっぷる,アップル、「iOS 15」発表 - ケータイ Watch,アップルは8日（日本時間）、開発者向けイベント「WWDC21」で、「iOS 15」を発表した。今秋提供される。7月にはパブリックベータが登場する。あわせて対応機種も発表された。 ティム・クックCEO. iOS 15のサマリー ...,"=HYPERLINK(""https://k-tai.watch.impress.co.jp/docs/news/1329838.html"")",47,ｱｯﾌﾟﾙ 0 日本 時間 開発 ｲﾍﾞﾝﾄ WWDC 0 iOS 0 発表 し 今秋 提供 さ 0 月 登場 する あわせ 対応 機種 発表 さ ﾃｨﾑ ｸｯｸ CEO iOS 0 ｻﾏﾘｰ
47,あっぷる,| 介護の応援団【あっぷる】,介護保険申請代行・ケアプラン作成・介護サービスなら117グループ「あっぷる」へ. お気軽にお問い合わせ下さい フリーダイヤル 0120-39-1199 · お問い合わせ・資料請求はこちら · ホーム · 介護サービス · 介護事業所を探す · 介護でお困りの方へ ...,"=HYPERLINK(""https://www.apple-117.jp/index.html"")",48,介護 保険 申請 代行 ｹｱ ﾌﾟﾗﾝ 作成 介護 ｻｰﾋﾞｽ 0 ｸﾞﾙｰﾌﾟ あっぷる 問い合わせ 下さい ﾌﾘｰ ﾀﾞｲﾔﾙ 0 0 0 問い合わせ 資料 請求 ﾎｰﾑ 介護 ｻｰﾋﾞｽ 介護 事業 探す 介護 困り 方
48,あっぷる,あっぷるタイムス最新号更新しました - アップルハウジング,アップルハウジングは、福岡の新築住宅・リフォーム・マンションリフォームを通して、「人・環境」にやさしい住まいづくりを実現します。 ... あっぷるタイムス最新号更新しました. 組合員だけに発行しているチラシがご覧いただけます。,"=HYPERLINK(""https://www.applehousing.jp/news/info/131/"")",49,ｱｯﾌﾟﾙ ﾊｳｼﾞﾝｸﾞ 福岡 新築 住宅 ﾘﾌｫｰﾑ ﾏﾝｼｮﾝ ﾘﾌｫｰﾑ 通し 人 環境 やさしい 住まいづくり 実現 し あっぷる ﾀｲﾑｽ 最新 号 更新 し 組合 発行 し いる ﾁﾗｼ ご覧 いただけ
49,あっぷる,アップル - Wikipedia,アップル (apple) は、英語でリンゴ（林檎）のこと。 目次. 1 会社、団体. 1.1 架空の団体. 2 地名; 3 製品; 4 人物. 4.1 架空の人物; 4.2 音楽. 5 関連項目. 会社、団体[編集]. Apple (Apple Inc.) - アメリカ合衆国のインターネット（ICT）、デジタル ...,"=HYPERLINK(""https://ja.wikipedia.org/wiki/%E3%82%A2%E3%83%83%E3%83%97%E3%83%AB"")",50,ｱｯﾌﾟﾙ apple 英語 ﾘﾝｺﾞ 林檎 こと 目次 0 会社 団体 0 0 架空 団体 0 地名 0 製品 0 人物 0 0 架空 人物 0 0 音楽 0 関連 項目 会社 団体 編集 Apple Apple Inc ｱﾒﾘｶ 合衆 ｲﾝﾀｰﾈｯﾄ ICT ﾃﾞｼﾞﾀﾙ
50,あっぷる,かふぇ あっぷる - 人形町/カフェ | 食べログ,"価格帯: ￥1,000～￥1,999","=HYPERLINK(""https://tabelog.com/tokyo/A1302/A130204/13036682/"")",51,価格 0 0 0 0
51,あっぷる,GRANNY SMITH APPLE PIE & COFFEE グラニースミス ...,ドリンク無料の“早得”キャンペーンが期間延長！！秋限定ドリンク&キッシュが発売開始！！「キャラメルナッツアップルパイ」販売開始！！秋限定「スイートポテトアップルパイ」販売開始！！「モンブランアップルパイ」限定販売！！夏季限定『アフォガード ...,"=HYPERLINK(""https://grannysmith-pie.com/"")",52,ﾄﾞﾘﾝｸ 無料 早 得 ｷｬﾝﾍﾟｰﾝ 期間 延長 秋 限定 ﾄﾞﾘﾝｸ ｷｯｼｭ 発売 開始 ｷｬﾗﾒﾙﾅｯﾂｱｯﾌﾟﾙﾊﾟｲ 販売 開始 秋 限定 ｽｲｰﾄﾎﾟﾃﾄｱｯﾌﾟﾙﾊﾟｲ 販売 開始 ﾓﾝﾌﾞﾗﾝｱｯﾌﾟﾙﾊﾟｲ 限定 販売 夏季 限定 ｱﾌｫｶﾞｰﾄﾞ
53,あっぷる,iPhone SEを購入 - Apple（日本）,"￥49,800～￥55,800","=HYPERLINK(""https://www.apple.com/jp/shop/buy-iphone/iphone-se"")",54,0 0 0 0
57,あっぷる,坂城店 | 美容室あっぷる,坂城店. 新型コロナウイルス感染予防対策について. いつも美容室あっぷるをご愛顧いただき誠にありがとうございます。 お客様とスタッフの安全・安心を守るため、お願いがございます。 集団感染を未然に防ぐため、下記のいずれかに該当される方は事前に ...,"=HYPERLINK(""https://apple-biyou.com/sakaki"")",58,坂城 新型 ｺﾛﾅ ｳｲﾙｽ 感染 予防 対策 つい 美容 あっぷる 愛顧 いただき 誠 ござい 客 ｽﾀｯﾌ 安全 安心 守る ため 願い ござい 集団 感染 未然 防ぐ ため 下記 該当 さ 方 事前
58,あっぷる,「アップルストア」の検索結果 - 【楽天市場】ジャンルトップ ...,楽天市場-「アップルストア」593件 人気の商品を価格比較・ランキング･レビュー・口コミで検討できます。ご購入でポイント取得がお得。セール商品・送料無料商品も多数。「あす楽」なら翌日お届けも可能です。,"=HYPERLINK(""https://search.rakuten.co.jp/search/mall/%E3%82%A2%E3%83%83%E3%83%97%E3%83%AB%E3%82%B9%E3%83%88%E3%82%A2/"")",59,楽天 市場 ｱｯﾌﾟﾙ ｽﾄｱ 0 件 人気 商品 価格 比較 ﾗﾝｷﾝｸﾞ ﾚﾋﾞｭｰ 口ｺﾐ 検討 でき 購入 ﾎﾟｲﾝﾄ 取得 得 ｾｰﾙ 商品 送料 無料 商品 多数 あす 楽 翌日 届け
59,あっぷる,車販売 - 中古車買取・中古車査定のアップル,車販売 |アップルの車買取・車査定サービス。無料で自動車の買取相場が分かります。車のことなら国内最大級の買取実績アップルへ！,"=HYPERLINK(""https://www.applenet.co.jp/buy/"")",60,車 販売 ｱｯﾌﾟﾙ 車 買取 車 査定 ｻｰﾋﾞｽ 無料 自動 買取 相場 分かり 車 こと 国内 最大 買取 実績 ｱｯﾌﾟﾙ
62,あっぷる,株式会社あっぷる ソーシャルメディアポリシー - 117グループ,株式会社あっぷるの役員および従業員（正社員、嘱託社員、パート、アルバイト、派遣社員など全ての従業者をいい、以下、「私たち」といいます。）は、ソーシャルメディアでのコミュニケーションにおいて、発信した情報が容易かつ瞬時に拡散すると共に、 ...,"=HYPERLINK(""https://www.117.co.jp/compliance/apple.html"")",63,株式 会社 あっぷる 役員 従業 正 社員 嘱託 社員 ﾊﾟｰﾄ ｱﾙﾊﾞｲﾄ 派遣 社員 全て 従業 いい 以下 いい ｿｰｼｬﾙ ﾒﾃﾞｨｱ ｺﾐｭﾆｹｰｼｮﾝ おい 発信 し 情報 瞬時 拡散 する 共
63,あっぷる,秋田プレミアムあっぷる | TOP,秋田あっぷるで秋田の情報を知る！秋田県のタウン情報誌あっぷるが発信する秋田県の食べ処やラーメン、温泉、秋田美人、お得なクーポンまで情報満載サイト！,"=HYPERLINK(""http://www.xn--l8j6cuc0dv605bd1f.jp/"")",64,秋田 あっぷる 秋田 情報 知る 秋田 県 ﾀｳﾝ 情報 あっぷる 発信 する 秋田 県 食べ 処 ﾗｰﾒﾝ 温泉 秋田 美人 得 ｸｰﾎﾟﾝ 情報 満載 ｻｲﾄ
65,あっぷる,Appleのスマートフォン・格安スマホ 最新人気機種ランキング,Apple(アップル)のスマートフォンをランキング形式でご紹介。メーカーや機能、スペックを指定して人気のスマホが探せます。大手キャリア・MVNOで契約した場合の月々のお支払い目安やSIMフリーの端末価格で比較・検討できます。,"=HYPERLINK(""https://kakaku.com/keitai/smartphone/?pdf_ma=9"")",66,Apple ｱｯﾌﾟﾙ ﾌｫﾝ ﾗﾝｷﾝｸﾞ 形式 紹介 ﾒｰｶｰ 機能 ｽﾍﾟｯｸ 指定 し 人気 ｽﾏﾎ 探せ 大手 ｷｬﾘｱ MVNO 契約 し 場合 月々 支払い 目安 SIM ﾌﾘｰ 端末 価格 比較 検討 でき
66,あっぷる,最新の apple ニュース - Engadget 日本版,"Epic、アップルApp Store訴訟の判決を不服として控訴。独自のアプリ内決済認められず ... アップル発表イベント直前に「iPhone 13」と「Apple Watch Series 7」の詳細な予想公開 · Kiyoshi Tane・2021年09月13日, 午後 12:20. 9月12日 ...","=HYPERLINK(""https://japanese.engadget.com/tag/apple"")",67,Epic ｱｯﾌﾟﾙ App Store 訴訟 判決 不服 し 控訴 ｱﾌﾟﾘ 決済 認め ｱｯﾌﾟﾙ 発表 ｲﾍﾞﾝﾄ 直前 iPhone 0 Apple Watch Series 0 詳細 予想 公開 Kiyoshi Tane 0 年 0 月 0 午後 0 0 0 月 0 日
67,あっぷる,(株) あっぷる関西 尼崎南店｜ (兵庫県尼崎市) 中古車なら - グー ...,149 票,"=HYPERLINK(""https://www.goo-net.com/usedcar_shop/0707918/detail.html"")",68,0 票
68,あっぷる,アップル引越センター,株式会社アップル（アップル引越センター）の公式企業サイトです。サービス、企業情報、特徴、採用情報、メディア向け情報、お知らせなどを掲載しています。,"=HYPERLINK(""https://www.apple-hikkoshi.co.jp/"")",69,株式 会社 ｱｯﾌﾟﾙ ｱｯﾌﾟﾙ 引越 ｾﾝﾀｰ 公式 企業 ｻｲﾄ ｻｰﾋﾞｽ 企業 情報 特徴 採用 情報 ﾒﾃﾞｨｱ 情報 知らせ 掲載 し い
69,あっぷる,APPLE｜マネキン トルソ 株式会社アップル,株式会社アップルはマネキン、トルソ、DPツール、什器、ハンガー、インテリアデザイン等の主にファッション業界で利用されている販売促進演出備品類を企画／製造／販売／リースをする会社です。,"=HYPERLINK(""http://www.apple-display.com/"")",70,株式 会社 ｱｯﾌﾟﾙ ﾏﾈｷﾝ ﾄﾙｿ DP ﾂｰﾙ 什器 ﾊﾝｶﾞｰ ｲﾝﾃﾘｱ ﾃﾞｻﾞｲﾝ 主 ﾌｧｯｼｮﾝ 利用 さ いる 販売 促進 演出 備品 企画 製造 販売 ﾘｰｽ する 会社
70,あっぷる,元気あっぷる体操 - 青森放送局 - NHK,NHK青森放送局の番組「元気あっぷる体操」のホームページです。 ... NHK青森では、2013年から「脱・短命プロジェクト」を立ち上げ、「体を動かす」ことをテーマに、NHK青森オリジナルの「元気あっぷる体操」を開発しました。赤いジャージ姿の宮川香織 ...,"=HYPERLINK(""https://www.nhk.or.jp/aomori/taiso/"")",71,NHK 青森 放送 局 番組 元気 あっぷる 体操 ﾎｰﾑ ﾍﾟｰｼﾞ NHK 青森 0 年 短命 ﾌﾟﾛｼﾞｪｸﾄ 立ち上げ 体 動かす こと ﾃｰﾏ NHK 青森 ｵﾘｼﾞﾅﾙ 元気 あっぷる 体操 開発 し 赤い ｼﾞｬｰｼﾞ 姿 宮川 香織
75,あっぷる,秋田プレミアムあっぷる | TOP,秋田あっぷるで秋田の情報を知る！秋田県のタウン情報誌あっぷるが発信する秋田県の食べ処やラーメン、温泉、秋田美人、お得なクーポンまで情報満載サイト！,"=HYPERLINK(""http://xn--l8j6cuc0dv605bd1f.jp/"")",76,秋田 あっぷる 秋田 情報 知る 秋田 県 ﾀｳﾝ 情報 あっぷる 発信 する 秋田 県 食べ 処 ﾗｰﾒﾝ 温泉 秋田 美人 得 ｸｰﾎﾟﾝ 情報 満載 ｻｲﾄ
76,あっぷる,アップル【AAPL】：掲示板/株価 - Yahoo!ファイナンス,アップル【AAPL】の掲示板。NYSE（ニューヨーク証券取引所）とNASDAQに上場している全銘柄の株価やチャート、業績などを網羅。ADR日本株やランキングも充実しています。,"=HYPERLINK(""https://stocks.finance.yahoo.co.jp/us/bbs/AAPL"")",77,ｱｯﾌﾟﾙ AAPL 掲示 NYSE ﾆｭｰﾖｰｸ 証券 取引 NASDAQ 上場 し いる 銘柄 株価 ﾁｬｰﾄ 業績 網羅 ADR 日本 株 ﾗﾝｷﾝｸﾞ 充実 し い
77,あっぷる,アップル引越センター | 公式サイトなら最安値,引越しはアップルセンターにご相談ください。面倒なやり取りや電話なしで、24時間365日、見積もり表示も予約も全てネットで完了できます。テレビCM放映、創業13年・引っ越し実績16万件の実績、 東京圏を中心に大阪圏、名古屋圏で15支店を展開する引越会社 ...,"=HYPERLINK(""https://apple-hikkoshi.jp/"")",78,引越し ｱｯﾌﾟﾙ ｾﾝﾀｰ 相談 ください 面倒 やり取り 電話 なし 0 時間 0 見積もり 表示 予約 全て ﾈｯﾄ 完了 でき ﾃﾚﾋﾞ CM 放映 創業 0 年 引っ越し 実績 0 万 件 実績 東京 中心 大阪 名古屋 0 支店 展開 する 引越 会社
78,あっぷる,株式会社アップル コーポレートサイト｜アパマンショップFC ...,賃貸マンション、アパート、貸家の仲介・管理のことならアパマンショップFCの株式会社アップルにお任せください。東京・埼玉・横浜で賃貸マンション・アパートの仲介店舗を多店舗展開中。アップルは1人暮らし、結婚、転勤等でご家族の引越しなど、 ...,"=HYPERLINK(""http://www.apple-apaman.co.jp/"")",79,賃貸 ﾏﾝｼｮﾝ ｱﾊﾟｰﾄ 貸家 仲介 管理 こと ｱﾊﾟﾏﾝ ｼｮｯﾌﾟ FC 株式 会社 ｱｯﾌﾟﾙ 任せ ください 東京 埼玉 横浜 賃貸 ﾏﾝｼｮﾝ ｱﾊﾟｰﾄ 仲介 店舗 店舗 展開 ｱｯﾌﾟﾙ 0 暮らし 結婚 転勤 家族 引越し
79,あっぷる,英会話｜大阪・梅田と難波の英会話スクール【アップルk ...,英会話 大阪梅田と難波の英会話スクール創立30周年【アップルkランゲージ】。 初心者からビジネスまでOK1回2475円〜月謝制で英語・英会話・資格を習得！ 独自教授法トレーニングに合格した講師陣が個室レッスン。全外協加盟。 駅前の大人スクール。,"=HYPERLINK(""https://www.applek.com/"")",80,英 会話 大阪 梅田 難波 英 会話 ｽｸｰﾙ 創立 0 周年 ｱｯﾌﾟﾙ k ﾗﾝｹﾞｰｼﾞ 初心 ﾋﾞｼﾞﾈｽ OK 0 回 0 円 月謝 英語 英 会話 資格 習得 教授 法 ﾄﾚｰﾆﾝｸﾞ 合格 し 講師 陣 個室 ﾚｯｽﾝ 加盟 駅前 大人 ｽｸｰﾙ
80,あっぷる,アップル四日市ときわ店 (三重県四日市) の詳細 - 中古車 - グー ...,63 票,"=HYPERLINK(""https://www.goo-net.com/usedcar_shop/0205109/detail.html"")",81,0 票
83,あっぷる,店舗を探す - 中古車買取・中古車査定のアップル,店舗を探す |アップルの車買取・車査定サービス。無料で自動車の買取相場が分かります。車のことなら国内最大級の買取実績アップルへ！,"=HYPERLINK(""https://www.applenet.co.jp/shop/"")",84,店舗 探す ｱｯﾌﾟﾙ 車 買取 車 査定 ｻｰﾋﾞｽ 無料 自動 買取 相場 分かり 車 こと 国内 最大 買取 実績 ｱｯﾌﾟﾙ
84,あっぷる,中古車買取・中古車査定のアップル【公式】,アップルの中古車買取・中古車査定サービス。無料で自動車の査定相場が分かります。車のことなら国内最大級の買取実績アップルへ！,"=HYPERLINK(""https://www.applenet.co.jp/"")",85,ｱｯﾌﾟﾙ 中古 買取 中古 査定 ｻｰﾋﾞｽ 無料 自動 査定 相場 分かり 車 こと 国内 最大 買取 実績 ｱｯﾌﾟﾙ
85,あっぷる,あっぷるワイド - NHK,青森のホットなニュースを速くわかりやすく！県内各地にリポーターが出かけて魅力を発掘するコーナーもお届けします。気象予報士が伝える気象情報やお天気の話題も充実。「ストップ！詐欺」「お国ことばで川柳」「あっぷるコンシェルジュ」など多彩な ...,"=HYPERLINK(""https://www4.nhk.or.jp/P2933/"")",86,青森 ﾎｯﾄ ﾆｭｰｽ 速く わかり 県内 各地 ﾘﾎﾟｰﾀｰ 出かけ 魅力 発掘 する ｺｰﾅｰ 届け し 気象 予報 伝える 気象 情報 天気 話題 充実 ｽﾄｯﾌﾟ 詐欺 国 ことば 川柳 あっぷる ｺﾝｼｪﾙｼﾞｭ
86,あっぷる,あっぷる関西 グループ公式 | 西日本最大級の国産車・輸入車の ...,あっぷる関西 グループ総在庫数500台以上！西日本最大クラスの特選中古車販売店 最新のチラシと在庫情報はもちろん、各店舗の情報も掲載中！,"=HYPERLINK(""https://www.apple-car.jp/"")",87,あっぷる 関西 ｸﾞﾙｰﾌﾟ 在庫 数 0 台 以上 西 日本 最大 ｸﾗｽ 特選 中古 販売 最新 ﾁﾗｼ 在庫 情報 店舗 情報 掲載
87,あっぷる,個別教室のアップル ／宮城県仙台市,宮城・仙台の「個別教室のアップル」は、仙台、泉中央、旭ヶ丘、長町、上杉、八幡、定禅寺、榴岡に教室を持つ個別指導塾です。完全1対1授業で分からないことなくし、確実な学力向上をお手伝いいたします。,"=HYPERLINK(""https://www.apple-kobetsu.jp/"")",88,宮城 仙台 個別 教室 ｱｯﾌﾟﾙ 仙台 泉 中央 旭ヶ丘 長町 上杉 八幡 禅寺 榴 岡 教室 持つ 個別 指導 塾 0 対 0 授業 分から こと なく 学力 向上 手伝い いたし
88,あっぷる,Apple(アップル)のタブレットPC 製品一覧 - 価格.com,Apple(アップル)のタブレットPC製品一覧！たくさんの製品の中から、価格やスペック、ランキング、満足度など、さまざまな条件を指定して自分にピッタリの製品を簡単に探し出すことができます。,"=HYPERLINK(""https://kakaku.com/pc/pda/itemlist.aspx?pdf_ma=9"")",89,Apple ｱｯﾌﾟﾙ ﾀﾌﾞﾚｯﾄ PC 製品 一覧 製品 中 価格 ｽﾍﾟｯｸ ﾗﾝｷﾝｸﾞ 満足 度 条件 指定 し 自分 製品 探し出す こと でき
