,keyword,site_name,snnipet,URL,ranking,target
89,あっぷる,アップルアンドローゼス: 【Apple&Roses】薔薇のタルト ...,信州のりんご農家と共に育てた、りんごで作ったアップルタルトやアップルパイを販売しています。薔薇のタルト(アップルアンドローゼス)は、女性に人気でプレゼントにも最適! ギフトや贈答用・ご褒美におしゃれなタルトはいかがですか？,"=HYPERLINK(""http://apple-roses.com/"")",90,信州 りんご 農家 共 育て りんご 作っ ｱｯﾌﾟﾙ ﾀﾙﾄ ｱｯﾌﾟﾙ ﾊﾟｲ 販売 し い 薔薇 ﾀﾙﾄ ｱｯﾌﾟﾙ ｱﾝﾄﾞ ﾛｰｾﾞｽ 女性 人気 ﾌﾟﾚｾﾞﾝﾄ ｷﾞﾌﾄ 贈答 褒美 おしゃれ ﾀﾙﾄ
90,あっぷる,アップルワールド旅行会社専用サイト,海外も国内も、ホテル予約はアップルワールドでどうぞ。日本最大級のクチコミとホテル詳細情報でご希望のホテルを検索し、料金比較機能で最安値予約。世界12000都市・18万軒の宿が予約できるホテル予約のポータルサイトです。,"=HYPERLINK(""https://appleworld.com/agt/"")",91,海外 国内 ﾎﾃﾙ 予約 ｱｯﾌﾟﾙ ﾜｰﾙﾄﾞ 日本 最大 ｸﾁｺﾐ ﾎﾃﾙ 詳細 情報 希望 ﾎﾃﾙ 検索 し 料金 比較 機能 安値 予約 世界 0 都市 0 万 宿 予約 できる ﾎﾃﾙ 予約 ﾎﾟｰﾀﾙ ｻｲﾄ
91,あっぷる,味処あっぷる亭 - 上伊田/居酒屋 | 食べログ,味処あっぷる亭 (上伊田/居酒屋)の店舗情報は食べログでチェック！ 口コミや評価、写真など、ユーザーによるリアルな情報が満載です！地図や料理メニューなどの詳細情報も充実。,"=HYPERLINK(""https://tabelog.com/fukuoka/A4007/A400703/40016094/"")",92,味処 あっぷる 上 伊田 居酒屋 店舗 情報 食べ ﾛｸﾞ ﾁｪｯｸ 口ｺﾐ 評価 写真 ﾕｰｻﾞｰ よる ﾘｱﾙ 情報 満載 地図 料理 ﾒﾆｭｰ 詳細 情報 充実
92,あっぷる,‎「Apple Store」をApp Storeで,iOS,"=HYPERLINK(""https://apps.apple.com/jp/app/apple-store/id375380948"")",93,iOS
93,あっぷる,無料査定申込み - 中古車買取・中古車査定のアップル,車の査定なら、アップルの車買取・車査定サービス。オ2020年 オリコン顧客満足度®調査 車買取会社 総合 第1位！無料で自動車の買取相場が分かります。,"=HYPERLINK(""https://www.applenet.co.jp/satei/"")",94,車 査定 ｱｯﾌﾟﾙ 車 買取 車 査定 ｻｰﾋﾞｽ 0 年 ｵﾘｺﾝ 顧客 満足 度 調査 買取 会社 総合 0 無料 自動 買取 相場 分かり
94,あっぷる,AAPL:NASDAQ GS 株価 - アップル - Bloomberg Markets,アップル (AAPL:NASDAQ GS) の株価、株式情報、チャート、関連ニュースなど、企業概要や株価の分析をご覧いただけます。,"=HYPERLINK(""https://www.bloomberg.co.jp/quote/AAPL:US"")",95,ｱｯﾌﾟﾙ AAPL NASDAQ GS 株価 株式 情報 ﾁｬｰﾄ 関連 ﾆｭｰｽ 企業 概要 株価 分析 ご覧 いただけ
95,あっぷる,ホットアップルパイ | メニュー情報 | McDonald's Japan,たっぷりつまったアップルフィリングとサクサクのパイ生地は相性抜群。 ※中身が熱いことがありますのでやけどにご注意ください。 単品 ¥ 100.,"=HYPERLINK(""https://www.mcdonalds.co.jp/products/2110/"")",96,つまっ ｱｯﾌﾟﾙ ﾌｨﾘﾝｸﾞ ﾊﾟｲ 生地 相性 中身 熱い こと あり やけど 注意 ください 単品 0
96,あっぷる,アップル Apple Apple Pencil 第2世代 [MU8F2J/A] - ヨドバシ,アップル Apple Apple Pencil 第2世代 [MU8F2J/A]の通販ならヨドバシカメラの公式サイト「ヨドバシ.com」で！レビュー、Q&A、画像も盛り沢山。ご購入でゴールドポイント取得！今なら日本全国へ全品配達料金無料、即日・翌日お届け実施中。,"=HYPERLINK(""https://www.yodobashi.com/product/100000001004147305/"")",97,ｱｯﾌﾟﾙ Apple Apple Pencil 0 世代 MU 0 F 0 J A 通販 ﾖﾄﾞﾊﾞｼ ｶﾒﾗ 公式 ｻｲﾄ ﾖﾄﾞﾊﾞｼ com ﾚﾋﾞｭｰ Q A 画像 盛り 購入 ｺﾞｰﾙﾄﾞ ﾎﾟｲﾝﾄ 取得 今 日本 全国 全品 配達 料金 無料 即日 翌日 届け 実施
97,あっぷる,アップル Apple MK0C2J/A [Apple Pencil] 通販【全品無料配達】,アップル Apple MK0C2J/A [Apple Pencil]の通販ならヨドバシカメラの公式サイト「ヨドバシ.com」で！レビュー、Q&A、画像も盛り沢山。ご購入でゴールドポイント取得！今なら日本全国へ全品配達料金無料、即日・翌日お届け実施中。,"=HYPERLINK(""https://www.yodobashi.com/product/100000001002937870/"")",98,ｱｯﾌﾟﾙ Apple MK 0 C 0 J A Apple Pencil 通販 ﾖﾄﾞﾊﾞｼ ｶﾒﾗ 公式 ｻｲﾄ ﾖﾄﾞﾊﾞｼ com ﾚﾋﾞｭｰ Q A 画像 盛り 購入 ｺﾞｰﾙﾄﾞ ﾎﾟｲﾝﾄ 取得 今 日本 全国 全品 配達 料金 無料 即日 翌日 届け 実施
99,あっぷる,津軽のお宿 南田温泉ホテルアップルランド【公式HP】,青森県平川市にある『津軽のお宿 南田温泉ホテルアップルランド』は広大な津軽平野と岩木山を眺めるりんごづくしの温泉旅館です。東北随一の弱アルカリ性美容泉・源泉かけ流し、美人美肌の湯でおもてなしいたします。盛美園まで車で10分/田んぼアートまで ...,"=HYPERLINK(""http://www.apple-land.co.jp/"")",100,青森 県 平川 市 ある 津軽 宿 南田 温泉 ﾎﾃﾙ ｱｯﾌﾟﾙ ﾗﾝﾄﾞ 津軽 平野 岩木 山 眺める りんご 温泉 旅館 東北 随一 弱 ｱﾙｶﾘ 美容 源泉 かけ流し 美人 美肌 湯 もてなし いたし 盛 美園 車 0 分 田んぼ ｱｰﾄ
