,Unnamed: 0,keyword,site_name,URL,snippet,ranking,target
79,79,あっぷる,ほっ湯アップルからのお知らせ | イベントや季節のお知らせ,http://www.hot-apple.net/info/,4 日前 — ほっ湯アップルでは新型コロナウイルス感染拡大防止の為9月2日（木）まで休業としておりますが、感染レベル引き下げが見込まれない為、要請により下記期間まで休業延長といたします。 9月12日（日）まで 休業延長 ※9月13日（月）は ...,80,0 前 湯 ｱｯﾌﾟﾙ 新型 ｺﾛﾅ ｳｲﾙｽ 感染 拡大 防止 為 0 月 0 木 休業 し おり 感染 ﾚﾍﾞﾙ 引き下げ 見込ま 為 要請 より 下記 期間 休業 延長 いたし 0 月 0 日 休業 延長 0 月 0 月
80,80,あっぷる,アップル育児サークル - 千葉市,https://www.city.chiba.jp/chuo/hokenfukushi/kenko/applesa-kuru.html,アップル育児サークル. 新型コロナウイルス感染拡大防止のため、サークル活動を中止しております。 ご理解・ご了承の ...,81,ｱｯﾌﾟﾙ 育児 ｻｰｸﾙ 新型 ｺﾛﾅ ｳｲﾙｽ 感染 拡大 防止 ため ｻｰｸﾙ 活動 中止 し おり 理解 了承
81,81,あっぷる,【LUPICIA】アップルティー 5261 APPLE TEA Pack of 10 tea ...,https://www.lupicia.com/shop/g/g13335261/,爽やかな林檎の香りが広がる芳醇な風味のアップルティーです。林檎の果実を贅沢にトッピングし、味わいは甘く、柔らかに仕上げました。贈りものにもおすすめです。,82,林檎 香り 広がる 芳醇 風味 ｱｯﾌﾟﾙ ﾃｨｰ 林檎 果実 贅沢 ﾄｯﾋﾟﾝｸﾞ し 味わい 甘く 仕上げ 贈りもの すすめ
82,82,あっぷる,あっぷる獣医科病院 - Home | Facebook,https://m.facebook.com/%E3%81%82%E3%81%A3%E3%81%B7%E3%82%8B%E7%8D%A3%E5%8C%BB%E7%A7%91%E7%97%85%E9%99%A2-1539231722959429/,青森駅西口から徒歩10分の動物病院です。 あっぷる獣医科病院へようこそ。当院は、生命の大切さを肝に命じ、飼い主様の信頼 ... 評価: 5 · ‎14 票,83,青森 駅 西口 徒歩 0 動物 病院 あっぷる 医科 病院 よう 当院 生命 肝 命じ 飼い主 信頼 評価 0 0 票
83,83,あっぷる,商品情報［菓子パン］ | アップルパイ - 山崎製パン,https://www.yamazakipan.co.jp/product/02/applepie.html,"何層にも重なった厚いパイ生地はサクサクと歯切れがよく、中には大粒のリンゴ果肉が入ったジャムが！甘さを控えた大人の味のアップルパイは、そのままでも、温めてもおいしく召し上がっていただけます。 栄養成分表. アップルパイ. 栄養成分基準, 1個当たり.",84,何 層 重なっ 厚い ﾊﾟｲ 生地 歯切れ よく 中 大粒 ﾘﾝｺﾞ 果肉 入っ ｼﾞｬﾑ 甘 控え 大人 味 ｱｯﾌﾟﾙ ﾊﾟｲ まま 温め おいしく 召し上がっ いただけ 栄養 成分 表 ｱｯﾌﾟﾙ ﾊﾟｲ 栄養 成分 基準 0
84,84,あっぷる,AppleCLIP（アップルクリップ） | 大塚商会,https://www.otsuka-shokai.co.jp/products/appleclip/,AppleCLIP（アップルクリップ）. iTunes Podcastにて毎週金曜日夕刻に配信！ AppleCLIPは、Apple製品を楽しむ皆様へ向けたPodcast番組です。役立つ情報コーナー「iPhone Business Network（iBN）」では、Apple製品やITニュース、ビジネスに関するトーク ...,85,AppleCLIP ｱｯﾌﾟﾙ ｸﾘｯﾌﾟ iTunes Podcast 毎週 金曜 日 夕刻 配信 AppleCLIP Apple 製品 楽しむ 皆 向け Podcast 番組 役立つ 情報 ｺｰﾅｰ iPhone Business Network iBN Apple 製品 IT ﾆｭｰｽ ﾋﾞｼﾞﾈｽ 関する ﾄｰｸ
85,85,あっぷる,サンキスト 100%アップル 200ml | 飲料 | 商品紹介 - 森永乳業,https://www.morinagamilk.co.jp/products/drink/sunkist100/72.html,"「サンキスト 100%アップル 200ml」を紹介するページです。かがやく""笑顔""のために【森永乳業株式会社】",86,ｻﾝｷｽﾄ 0 ｱｯﾌﾟﾙ 0 ml 紹介 する ﾍﾟｰｼﾞ かがやく 笑顔 ため 森永 乳業 株式 会社
86,86,あっぷる,ジャングラミング | びわこ学院大学附属こども園あっぷる,http://apple-biwagaku.com/news/1924.html,びわこ学院大学附属こども園あっぷる公式サイト。滋賀県東近江市にある幼保連携型認定こども園です。いろいろな活動を通して、子どもと周囲の大人が触れ合い、人に対する愛情と信頼感、 そして人を大切にする心を育て、子どもも大人も共に学び合い、育ち ...,87,びわ 学院 大学 附属 こども あっぷる 公式 ｻｲﾄ 滋賀 県 東近江 市 ある 幼保 連携 認定 こども 活動 通し 子ども 周囲 大人 触れ合い 人 対する 愛情 信頼 感 人 する 心 育て 子ども 大人 共 学び合い 育ち
87,87,あっぷる,ホテル アップル - 八王子市 - ハピホテ,https://happyhotel.jp/hotels/540340,ホテル アップル (アップル) : 東京都 八王子市の情報 - ハッピーホテル（ハピホテ）は、日本最大級のラブホテル検索＆予約サイトです。クーポン・クチコミ・料金・部屋＆お風呂写真など多数掲載。圧倒的情報量でお客様にピッタリのホテルを探せます。,88,ﾎﾃﾙ ｱｯﾌﾟﾙ ｱｯﾌﾟﾙ 東京 都 八王子 市 情報 ﾎﾃﾙ ﾊﾋﾟﾎﾃ 日本 最大 ﾗﾌﾞ ﾎﾃﾙ 検索 予約 ｻｲﾄ ｸｰﾎﾟﾝ ｸﾁｺﾐ 料金 部屋 風呂 写真 多数 掲載 圧倒 情報 量 客 ﾎﾃﾙ 探せ
88,88,あっぷる,自家製カマンベールのアップルパイ(税込・送料別)【冷蔵商品】,https://www.a-fromage.co.jp/shop/products/detail.php?product_id=56,信州産の紅玉りんごととても相性の良いカマンベールがパイ全体に溶け込み、大変芳醇な味わいです。 りんごの産地・信州だからこそ美味しいアトリエ・ド・フロマージュの創作チーズケーキです。 自家製カマンベールのアップルパイ(税込 ...,89,信州 紅玉 りんご 相性 良い ｶﾏﾝﾍﾞｰﾙ ﾊﾟｲ 全体 溶け込み 芳醇 味わい りんご 産地 信州 美味しい ｱﾄﾘｴ ﾄﾞ ﾌﾛﾏｰｼﾞｭ 創作 ﾁｰｽﾞ ｹｰｷ 自家 ｶﾏﾝﾍﾞｰﾙ ｱｯﾌﾟﾙ ﾊﾟｲ 税込
89,89,あっぷる,出願された特許をもとに、アップルカーの機能を予想してみた,https://www.businessinsider.jp/post-228111,2021/01/21 — 過去数年間で、アップルはいくつかの自動車関連の特許を出願している。ロイターによれば、ヒュンダイとアップルは2021年までに自動車の｢ベータ｣版を製造する契約を結ぼうとしているという。アップルが最近出願した車両に関する6つの特許 ...,90,0 0 0 過去 数 年間 ｱｯﾌﾟﾙ いく 自動 関連 特許 出願 し いる ﾛｲﾀｰ よれ ﾋｭﾝﾀﾞｲ ｱｯﾌﾟﾙ 0 年 自動 版 製造 する 契約 結ぼう し いる いう ｱｯﾌﾟﾙ 最近 出願 し 車両 関する 0 特許
90,90,あっぷる,コーポあっぷるの建物情報｜北海道岩見沢市大和3条7丁目8-1,https://www.homes.co.jp/archive/b-25162851/,2021/09/08 — コーポあっぷる(岩見沢市大和3条7丁目)の建物情報。間取り図や写真、家賃・価格や、建物内に賃貸や中古マンションの空室・売出し情報があるか確認できます。【不動産アーカイブ】なら日本全国にある250万棟以上の建物から住まいを探す ...なぜ募集広告ではない参考としての建物情報を掲載しているのでしょうか？コーポあっぷるに空室があるか確認できますか？,91,0 0 0 ｺｰﾎﾟ あっぷる 岩見沢 市 大和 0 条 0 丁目 建物 情報 間取り 図 写真 家賃 価格 建物 賃貸 中古 ﾏﾝｼｮﾝ 空室 売出し 情報 ある 確認 でき 動産 ｱｰｶｲﾌﾞ 日本 全国 ある 0 万 棟 以上 建物 住まい 探す 募集 広告 ない 参考 し 建物 情報 掲載 し いる ｺｰﾎﾟ あっぷる 空室 ある 確認 でき
91,91,あっぷる,アップルジャパン株式会社 - 企業情報センター - ZDNet Japan,https://japan.zdnet.com/company/20012099/,アップルは、モバイルOSの新バージョン「iOS 15」と「iPadOS 15」を米国時間9月20日（日本時間21日）にリリースすることを明らかにした。 2021-09-15. 「iOS」「macOS」などにセキュリティ更新--悪用された可能性がある脆弱性を修正. 2021-09-14.本社所在地： 163-1480; 東京都 新宿区西新宿3-...,92,ｱｯﾌﾟﾙ ﾓﾊﾞｲﾙ OS ﾊﾞｰｼﾞｮﾝ iOS 0 iPadOS 0 米国 時間 0 月 0 日本 時間 0 ﾘﾘｰｽ する こと し 0 0 0 iOS macOS ｾｷｭﾘﾃｨ 更新 悪用 さ ある 脆弱 修正 0 0 0 本社 所在 地 0 0 東京 都 新宿 区 西新宿 0
92,92,あっぷる,個別指導アップ・る｜文武両道プロジェクト推進塾,https://up-dekiru555.com/,滋賀県に本社を構える『個別指導アップ・る』では、性格やタイプに合わせた指導法でやる気と成績をUPさせます！塾に通う事が厳しいお子様にはタブレット授業でフォローも！教室も数拠点ございますので、お気軽にお問い合わせください。,93,滋賀 県 本社 構える 個別 指導 ｱｯﾌﾟ 性格 ﾀｲﾌﾟ 合わせ 指導 やる気 成績 UP さ 塾 通う 事 厳しい 子 ﾀﾌﾞﾚｯﾄ 授業 ﾌｫﾛｰ 教室 数 拠点 ござい 問い合わせ ください
93,93,あっぷる,アップル、iPhoneの広告制限を21年初頭に開始 - JBpress,https://jbpress.ismedia.jp/articles/-/63226,2020/12/10 — 米アップルが2021年初頭にスマートフォン「iPhone」やタブレット端末「iPad」などのOS（基本ソフト）でプライバシー保護を強化するとロイターや米CNBCが12月8日に報じた。(1/2),94,0 0 0 米 ｱｯﾌﾟﾙ 0 年 初頭 ﾌｫﾝ iPhone ﾀﾌﾞﾚｯﾄ 端末 iPad OS 基本 ｿﾌﾄ ﾌﾟﾗｲﾊﾞｼｰ 保護 強化 する ﾛｲﾀｰ 米 CNBC 0 月 0 報じ 0 0
94,94,あっぷる,あっぷる - 早川・身延・南部町×喫茶店 - ぐるなび,https://r.gnavi.co.jp/p4fc7dnb0000/,あっぷる（早川・身延・南部町/喫茶店）の口コミや情報、地図・☎電話番号などを【ぐるなび】がご紹介。早川・身延・南部町周辺のカフェ・スイーツ情報も掲載。,95,あっぷる 早川 身延 南部 町 喫茶 口ｺﾐ 情報 地図 電話 番号 ぐるなび 紹介 早川 身延 南部 町 周辺 ｶﾌｪ ｽｲｰﾂ 情報 掲載
95,95,あっぷる,あっぷるのブログ,https://www.apple-blog.net/,あっぷるのブログでは生活を豊かにする ガジェットを紹介しています。 ブログを見る. apple. 愛知県在住の学生パソコンやガジェットを趣味で集めてます！ PCゲームも結構プレイ(Apex LegendsやMinecraftなど) デザイン、プログラミングも勉強中.,96,あっぷる ﾌﾞﾛｸﾞ 生活 する ｶﾞｼﾞｪｯﾄ 紹介 し い ﾌﾞﾛｸﾞ 見る apple 愛知 県 在住 学生 ﾊﾟｿｺﾝ ｶﾞｼﾞｪｯﾄ 趣味 集め PC ｹﾞｰﾑ ﾌﾟﾚｲ Apex Legends Minecraft ﾃﾞｻﾞｲﾝ ﾌﾟﾛｸﾞﾗﾐﾝｸﾞ 勉強
96,96,あっぷる,ヨドバシカメラのApple Shop（アップルショップ）へようこそ,https://www.yodobashi.com/store/197600/,トップ; >; ヨドバシカメラのApple Shop（アップルショップ）へようこそ. ヨドバシカメラのApple Shopへようこそ. アクセサリ15％off. 新製品特集（随時更新）. Apple Watch Series 7はこの秋に発売。ご予約受付の開始はこちらのページよりご案内いたし ...,97,ﾄｯﾌﾟ ﾖﾄﾞﾊﾞｼ ｶﾒﾗ Apple Shop ｱｯﾌﾟﾙ ｼｮｯﾌﾟ よう ﾖﾄﾞﾊﾞｼ ｶﾒﾗ Apple Shop よう ｱｸｾｻﾘ 0 % off 製品 特集 随時 更新 Apple Watch Series 0 秋 発売 予約 受付 開始 ﾍﾟｰｼﾞ 案内 いたし
97,97,あっぷる,アップルハウス,http://www.applehouse.com/,アップルハウスは日本国産・天然素材にこだわった婦人服ブランドです。フリーサイズ・エイジレスでどなたにも心地良く着ていただける服をつくっています。姉妹ブランド「Fleur de pomme」では麻素材のこだわり商品を展開中。,98,ｱｯﾌﾟﾙ ﾊｳｽ 日本 国産 天然 素材 こだわっ 婦人 服 ﾌﾞﾗﾝﾄﾞ ﾌﾘｰ ｻｲｽﾞ ｴｲｼﾞ ﾚｽ 心地良く 着 いただける 服 つくっ い 姉妹 ﾌﾞﾗﾝﾄﾞ Fleur de pomme 麻 素材 こだわり 商品 展開
98,98,あっぷる,スタジオアップル - 福岡県八女市・久留米市 写真スタジオ ...,https://studio-apple.net/,ニューボーン・お宮参り・百日祝い · 今月のチラシ · 2021キッズモデルご紹介！ スタジオアップルの新作ブランド衣裳. 新着情報. 2021.08.27 お知らせ キッズモデル2021を掲載しました♪ · 2021.07.21 お知らせ チラシ情報を更新しました♪ ...,99,ﾆｭｰ ﾎﾞｰﾝ 宮参り 百 日 祝い 今月 ﾁﾗｼ 0 ｷｯｽﾞ ﾓﾃﾞﾙ 紹介 ｽﾀｼﾞｵ ｱｯﾌﾟﾙ 新作 ﾌﾞﾗﾝﾄﾞ 衣裳 新着 情報 0 0 0 知らせ ｷｯｽﾞ ﾓﾃﾞﾙ 0 掲載 し 0 0 0 知ら ﾁﾗｼ 情報 更新 し
