,Unnamed: 0,keyword,site_name,URL,snippet,ranking,target
38,38,あっぷる,「アップル銀行」の誕生は確実視される？ 鍵を握るiPhoneの ...,https://www.sbbit.jp/article/fj/66125,2021/08/18 — ... 世界最先端11社を分析することで、2025年の銀行の姿を読み解く“未来予測書”、そんな山本康正氏の著書『銀行を淘汰する破壊的企業』では、「銀行を破壊する11社」のひとつ、Apple（アップル）の思惑・戦略とは何かが予測されています。創業年／創業者： 1976年／スティーブ・ジョブズ,39,0 0 0 世界 先端 0 社 分析 する こと 0 年 銀行 姿 読み解く 未来 予測 山本 康正 著書 銀行 淘汰 する 破壊 企業 銀行 破壊 する 0 社 ひと Apple ｱｯﾌﾟﾙ 思惑 戦略 予測 さ い 創業 年 創業 0 年 ｽﾃｨｰﾌﾞ ｼﾞｮﾌﾞｽﾞ
39,39,あっぷる,個別教室のアップル ／宮城県仙台市,https://www.apple-kobetsu.jp/,宮城・仙台の「個別教室のアップル」は、仙台、泉中央、旭ヶ丘、長町、上杉、八幡、定禅寺、榴岡に教室を持つ個別指導塾です。完全1対1授業で分からないことなくし、確実な学力向上をお手伝いいたします。,40,宮城 仙台 個別 教室 ｱｯﾌﾟﾙ 仙台 泉 中央 旭ヶ丘 長町 上杉 八幡 禅寺 榴 岡 教室 持つ 個別 指導 塾 0 対 0 授業 分から こと なく 学力 向上 手伝い いたし
40,40,あっぷる,【公式】代官山Candy apple - ダイカンヤマ キャンディー ...,https://candy-apple.shop/,本格スイーツりんご飴専門店カフェ「代官山Candy apple」の公式ウェブサイト。お祭りの屋台で食べるあの懐かしい味『りんご飴』の良さを最大に引き出して魅力あふれる『りんご飴』をお届けりんご・飴・作り方すべてにこだわっています。,41,本格 ｽｲｰﾂ りんご 飴 専門 ｶﾌｪ 代官山 Candy apple 公式 ｳｪﾌﾞｻｲﾄ 祭り 屋台 食べる 懐かしい 味 りんご 飴 良 最大 引き出し 魅力 あふれる りんご 飴 届け りんご 飴 作り すべて こだわっ い
41,41,あっぷる,ホットアップルパイ | メニュー情報 | McDonald's Japan,https://www.mcdonalds.co.jp/products/2110/,たっぷりつまったアップルフィリングとサクサクのパイ生地は相性抜群。 ※中身が熱いことがありますのでやけどにご注意ください。 単品 ¥ 100.,42,つまっ ｱｯﾌﾟﾙ ﾌｨﾘﾝｸﾞ ﾊﾟｲ 生地 相性 中身 熱い こと あり やけど 注意 ください 単品 0
42,42,あっぷる,蔵王温泉 ペンション あっぷる,http://www.apple-bgl.com/,蔵王温泉のペンションあっぷる。露天風呂があります。ワインは常時800本、チーズフォンデゥも楽しめます。約400坪の英国風ガーデン、野原のようなイメージの庭もあります。,43,蔵王 温泉 ﾍﾟﾝｼｮﾝ あっぷる 露天 風呂 あり ﾜｲﾝ 常時 0 ﾁｰｽﾞ ﾌｫﾝﾃﾞｩ 楽しめ 0 坪 英国 ｶﾞｰﾃﾞﾝ 野原 ｲﾒｰｼﾞ 庭 あり
43,43,あっぷる,焼きたてカスタードアップルパイ専門店 RINGO,https://ringo-applepie.com/,サクサクのパイ、後入れでたっぷりはいったカスタードクリーム、ゴロっとしたリンゴが特徴。手のひらサイズのグローブ型で食べやすい大きさ。,44,ﾊﾟｲ 後入れ はいっ ｶｽﾀｰﾄﾞ ｸﾘｰﾑ ｺﾞﾛ し ﾘﾝｺﾞ 特徴 手のひら ｻｲｽﾞ ｸﾞﾛｰﾌﾞ 食べ 大き
44,44,あっぷる,島田市の賃貸・売買ならアップルランド株式会社,https://www.apple-land.jp/,静岡県島田市の不動産・保険のことならアップルランド株式会社におまかせ！ 賃貸（アパート・駐車場）・売買（土地・中古住宅）・相続相談など地域密着の当社に、是非ご相談ください！,45,静岡 県 島田 市 動産 保険 こと ｱｯﾌﾟﾙ ﾗﾝﾄﾞ 株式 会社 まかせ 賃貸 ｱﾊﾟｰﾄ 駐車 売買 土地 中古 住宅 相続 相談 地域 密着 当社 相談 ください
45,45,あっぷる,認知症対応型通所介護事業所 あっぷるの庭 - ネットワーク調剤,https://www.networktyouzai.com/kaigo/kaigo-apple-niwa.php,だからこそあっぷるの庭では、 気兼ねなくリラックスして頂きたいと考えています。 スタッフが全員「私服」なのも、同じ理由から。 利用者さまの性格や症状、状態を把握するスタッフが、 あたたかく対応いたします。 看護師も介護福祉士も、職種は異なり ...,46,あっぷる 庭 気兼ね なく ﾘﾗｯｸｽ し 頂き 考え い ｽﾀｯﾌ 全員 私服 理由 利用 性格 症状 状態 把握 する ｽﾀｯﾌ あたたかく 対応 いたし 看護 介護 福祉 職種 異なり
46,46,あっぷる,コープあっぷるタウン店｜＜公式＞安全安心なお買い物で健康 ...,https://www.okinawa.coop/shops/each/appletown.html,コープあっぷるタウン 2003年12月に那覇新都心にオープンしました。コープおきなわでは初めての複合のお店でコープ以外にテナントさんも沢山あります。コープの中では一番大きいお店で特に生鮮品の品揃えに特徴があります。スーパー以外でもお食事や ...営業時間： あさ9時～よる10時駐車場： 380台テナント案内： ---------------------- 1階 -----------------...ATM： 施設内ＡＴＭ（琉球銀行）; 平日：朝９時から...,47,ｺｰﾌﾟ あっぷる ﾀｳﾝ 0 年 0 月 那覇 都心 ｵｰﾌﾟﾝ し ｺｰﾌﾟ おきなわ 複合 店 ｺｰﾌﾟ 以外 ﾃﾅﾝﾄ あり ｺｰﾌﾟ 中 大きい 店 生鮮 品揃え 特徴 あり ｽｰﾊﾟｰ 以外 食事 営業 時間 あさ 0 時 よる 0 時 駐車 0 台 ﾃﾅﾝﾄ 案内 0 階 ATM 施設 ATM 琉球 銀行 平日 朝 0 時
47,47,あっぷる,【公式】AppleTown | 月刊誌アップルタウン,https://apa-appletown.com/,世界の情報を暮らしに活かす情報発信マガジン.,48,世界 情報 暮らし 活かす 情報 発信 ﾏｶﾞｼﾞﾝ
48,48,あっぷる,FMアップル－エフエムとよひら－,http://765fm.com/,令和3年9月15日午後3時50分頃、札幌市清田区平岡6条1丁目付近の路上で、下校中の女子児童が男に「一緒に帰ろう」と声を掛けられる事案が発生しました。男の特徴は、年齢60歳代くらい、160センチメートルくらい、中肉、上衣グレー色ウインド ...,49,令和 0 年 0 月 0 午後 0 時 0 分 頃 札幌 市 清田 区 平岡 0 条 0 丁目 付近 路上 下校 女子 児童 男 一緒 帰ろう 声 掛け 事案 発生 し 男 特徴 年齢 0 代 0 ｾﾝﾁﾒｰﾄﾙ 中肉 上衣 ｸﾞﾚｰ 色 ｳｲﾝﾄﾞ
49,49,あっぷる,アップルハウス - 東根市,https://applehouse.cc/,アップルハウス有限会社 山形県東根市 注文住宅建築 不動産.,50,ｱｯﾌﾟﾙ ﾊｳｽ 有限 会社 山形 県 東根 市 注文 住宅 建築 動産
50,50,あっぷる,介護福祉のあっぷるへようこそ！ - ウェルライフグループ,https://www.well-life.co.jp/apple/,ウェルライフグループのあっぷるでは、福祉用具の販売をはじめ、福祉用具のレンタル（レンタルサポート）、ケアプランの作成、訪問看護（江戸川区葛西）や高齢者・障害者用住宅リフォーム、デイサービス（江東区亀戸）など、介護福祉に必要な様々は商品や ...,51,ｳｪﾙ ﾗｲﾌ ｸﾞﾙｰﾌﾟ あっぷる 福祉 具 販売 はじめ 福祉 具 ﾚﾝﾀﾙ ﾚﾝﾀﾙ ｻﾎﾟｰﾄ ｹｱ ﾌﾟﾗﾝ 作成 訪問 看護 江戸川 区 葛西 高齢 障害 住宅 ﾘﾌｫｰﾑ ﾃﾞｲ ｻｰﾋﾞｽ 江東 区 亀戸 介護 福祉 必要 商品
51,51,あっぷる,あっぷるぐりむグループ,https://appleivy.co.jp/,株式会社あっぷるアイビー. ［あっぷるぐりむグループ］イタリアンレストラン ピッツェリア／焼肉のバーンズ／あっぷるぐりむ／やきとり居酒屋きらび本店（長野県・新潟県・富山県）. © 2021 あっぷるぐりむグループ ...,52,株式 会社 あっぷる ｱｲﾋﾞｰ ｸﾞﾙｰﾌﾟ ｲﾀﾘｱﾝ ﾚｽﾄﾗﾝ ﾋﾟｯﾂｪﾘｱ 焼肉 ﾊﾞｰﾝｽﾞ あっぷる やきとり 居酒屋 本店 長野 県 新潟 県 富山 県 0 あっぷる ｸﾞﾙｰﾌﾟ
52,52,あっぷる,株式会社アップルケアネット,https://www.applecarenet.jp/,アップルケアネット｜アップル薬局は、地域の皆様との信頼関係を大切にし、「命と健康」そして「りんごのような笑顔」をトータルにサポートする機能性調剤薬局をめざし、着実に歩みを進めていきます。,53,ｱｯﾌﾟﾙｹｱﾈｯﾄ ｱｯﾌﾟﾙ 薬局 地域 皆 信頼 関係 し 命 健康 りんご 笑顔 ﾄｰﾀﾙ ｻﾎﾟｰﾄ する 機能 調剤 薬局 めざし 歩み 進め いき
53,53,あっぷる,テキカカアップルソーダ (330ml) 3本 - もりやま園オンライン ...,https://www.moriyamaen.com/SHOP/S-tekikaka-3.html,ですが、意外なことに搾汁すると、りんごの香りがしかっり感じられる甘すぎない爽やかな味の果汁になります。 摘果りんご100％でつくったテキカカアップルソーダは、甘さ控えめでありながらポリフェノール含有量は ...,54,こと 搾汁 する りんご 香り しかっ 感じ 甘 すぎ 味 果汁 なり 摘果 りんご 0 % つくっ ﾃｷｶｶｱｯﾌﾟﾙｿｰﾀﾞ 甘 あり ﾎﾟﾘﾌｪﾉｰﾙ 含有 量
54,54,あっぷる,FMアップルウェーブ | 弘前市の地域情報を発信する ...,http://www.applewave.co.jp/,ねぷた、桜まつりで有名な弘前市のコミュニティFM放送局FMアップルウェーブです。地域に密着し、地域の防災のためにやさしい日本語をはじめとして様々な情報を発信していきます。,55,ねぷた 桜まつり 弘前 市 ｺﾐｭﾆﾃｨ FM 放送 局 FM ｱｯﾌﾟﾙ ｳｪｰﾌﾞ 地域 密着 し 地域 防災 ため やさしい 日本 語 はじめ し 情報 発信 し いき
55,55,あっぷる,ぴんくあっぷる: ボタンの通販-かわいいボタンとパーツ専門店,https://pinkapple.jp/,かわいい手芸ボタン、キャンディハーツ風のボタンや雪の結晶、ニコちゃん、パトカーのボタンなど、入園準備にぴったりのとびきりキュートなボタンがたくさん♪デコパーツ、ヘアゴムやジビッツ土台もあります.,56,かわいい 手芸 ﾎﾞﾀﾝ ｷｬﾝﾃﾞｨ ﾊｰﾂ ﾎﾞﾀﾝ 雪 結晶 ﾆｺ ﾊﾟﾄｶｰ ﾎﾞﾀﾝ 入園 準備 とびきり ﾎﾞﾀﾝ ﾃﾞｺ ﾊﾟｰﾂ ﾍｱ ｺﾞﾑ ｼﾞﾋﾞｯﾂ 土台 あり
56,56,あっぷる,稲沢市のアップル製品取扱店 検索 - モバ探,https://mobatan.com/apple/aichi/city/inazawa/,稲沢市（愛知県）のアップル製品取扱店を(2件)掲載しています。【モバ探】アップル製品取扱店検索では全国のアップル製品が購入できる店舗をエリア別、お店の種類別（ストア・ショップ・正規サービスプロバイダなど）やレビュー（口コミ・評判）などから ...,57,稲沢 市 愛知 県 ｱｯﾌﾟﾙ 製品 取扱 0 件 掲載 し い ｱｯﾌﾟﾙ 製品 取扱 検索 全国 ｱｯﾌﾟﾙ 製品 購入 できる 店舗 ｴﾘｱ 別 店 種類 別 ｽﾄｱ ｼｮｯﾌﾟ 正規 ｻｰﾋﾞｽ ﾌﾟﾛﾊﾞｲﾀﾞ ﾚﾋﾞｭｰ 口ｺﾐ 評判
57,57,あっぷる,アップルパレス青森 -,https://apple-palace.com/,アップルパレス青森には、今日もまごころが実っています。,58,ｱｯﾌﾟﾙ ﾊﾟﾚｽ 青森 今日 まごころ 実っ い
58,58,あっぷる,不動産のアドバイザー 株式会社アップル。,https://chitose-apple.cbiz.co.jp/,恵庭・千歳の不動産の事なら、株式会社アップルへお気軽にご相談ください。,59,恵庭 千歳 動産 事 株式 会社 ｱｯﾌﾟﾙ 相談 ください
59,59,あっぷる,アップル、トヨタと交渉中のうわさ。2024年まで - Engadget,https://japanese.engadget.com/apple-talk-with-toyota-applecar-063006229.html,2021/09/02 — 2024年までにアップルカーを量産すべく、アップルが日本のトヨタ自動車と交渉中との噂話が報じられています。,60,0 0 0 0 年 ｱｯﾌﾟﾙ ｶｰ 量産 す ｱｯﾌﾟﾙ 日本 ﾄﾖﾀ 自動 交渉 噂話 報じ い
60,60,あっぷる,道の駅なみおか アップルヒル,http://www.applehill.co.jp/,道の駅「なみおか」アップルヒルのサイトです。施設紹介のほか、青森りんごをはじめとした青森の特産品、アップルヒルオリジナル商品などの販売もしています。,61,道 駅 ｱｯﾌﾟﾙ ﾋﾙ ｻｲﾄ 施設 紹介 ほか 青森 りんご はじめ し 青森 特産 ｱｯﾌﾟﾙ ﾋﾙ ｵﾘｼﾞﾅﾙ 商品 販売 し い
61,61,あっぷる,アップルパイクッカー - お菓子道具 | 鉄器の及源鋳造株式会社,https://shop.oigen.jp/?pid=156641235,アップルパイクッカー. おうちのガスコンロで「アップルパイ」がつくれる、ユニークでかわいらしい南部鉄器「アップルパイクッカー」。「”りんご”のデザートを鉄器で提供したい…」青森県弘前市のイタリアン「ダ・サスィーノ」の笹森シェフとシェフ監修 ...,62,ｱｯﾌﾟﾙ ﾊﾟｲ ｸｯｶｰ うち ｶﾞｽ ｺﾝﾛ ｱｯﾌﾟﾙ ﾊﾟｲ つくれる かわいらしい 南部 鉄器 ｱｯﾌﾟﾙ ﾊﾟｲ ｸｯｶｰ りんご ﾃﾞｻﾞｰﾄ 鉄器 提供 し 青森 県 弘前 市 ｲﾀﾘｱﾝ ﾀﾞ･ｻｽｨｰﾉ 笹森 ｼｪﾌ ｼｪﾌ 監修
62,62,あっぷる,タイヤショップ アップルクラブへようこそ。,https://www.net-club.co.jp/apple-club/,apple-clubへようこそ。当店はインターネットショップですが、乗用車・SUV・トラック・ライトバンなどのタイヤを取り扱っております。ご注文後は岐阜市内での店舗に来店いただき、お値打ち名工賃にてタイヤ交換も可能です。ぜひご利用ください。,63,apple club よう 当店 ｲﾝﾀｰﾈｯﾄ ｼｮｯﾌﾟ 乗用 SUV ﾄﾗｯｸ ﾗｲﾄ ﾊﾞﾝ ﾀｲﾔ 取り扱っ おり 注文 岐阜 市 店舗 来店 いただき 値打ち 工賃 ﾀｲﾔ 交換 利用 ください
63,63,あっぷる,あっぷる アーカイブ - 川崎市 - セレモニアグループ,https://www.ceremonia.co.jp/cate_news/cate-apple/,カテゴリ：あっぷる. 2021/05/10 あっぷる. つばき便り5月号掲載のお知らせ！ 2021/04/07 あっぷる. つばき便り4月号掲載のお知らせ！ 2021/03/04 あっぷる. つばき便り3月号掲載のお知らせ！ 2021/02/04 あっぷる. つばき便り2月号掲載のお知らせ！,64,ｶﾃｺﾞﾘ あっぷる 0 0 0 あっぷる つばき 便り 0 月 号 掲載 知らせ 0 0 0 あっぷる つばき 便り 0 月 号 掲載 知らせ 0 0 0 あっぷる つばき 便り 0 月 号 掲載 知らせ 0 0 0 あっぷる つばき 便り 0 月 号 掲載 知らせ
64,64,あっぷる,アップルミント - Amazon.co.jp,https://www.amazon.co.jp/%E3%82%A2%E3%83%83%E3%83%97%E3%83%AB%E3%83%9F%E3%83%B3%E3%83%88/s?k=%E3%82%A2%E3%83%83%E3%83%97%E3%83%AB%E3%83%9F%E3%83%B3%E3%83%88,"ハーブ苗 アップルミント 2個セット【おうちで簡単！育てやすい10.5cmポットハーブ苗シリーズ】自社農場から新鮮苗直送!!【品種で選べるハーブ苗/即出荷】. 5つ星のうち3.0 2 · ￥2,980￥2,980. ￥5,000購入すると、￥200割引. 明日中9/19までにお届け.",65,ﾊｰﾌﾞ 苗 ｱｯﾌﾟﾙ ﾐﾝﾄ 0 ｾｯﾄ うち 育て 0 0 cm ﾎﾟｯﾄ ﾊｰﾌﾞ 苗 ｼﾘｰｽﾞ 自社 農場 苗 直送 品種 選べる ﾊｰﾌﾞ 苗 出荷 0 星 うち 0 0 0 0 0 0 0 0 0 購入 する 0 割引 明日 0 0 届け
65,65,あっぷる,【修理予約】iPhone・Mac修理｜アップル正規修理サービス,https://www.kitamura.jp/service/apple/info/,アップル製品の修理はカメラのキタムラへ。アップル社のトレーニングを受けた技術者が、アップル純正部品を使用して修理を行います。お客様のあらゆるアップルデバイスを安心してお任せください。ご来店の際は待ち時間の少なくなるWeb予約がお勧めです。,66,ｱｯﾌﾟﾙ 製品 修理 ｶﾒﾗ ｷﾀﾑﾗ ｱｯﾌﾟﾙ 社 ﾄﾚｰﾆﾝｸﾞ 受け 技術 ｱｯﾌﾟﾙ 純正 部品 使用 し 修理 行い 客 ｱｯﾌﾟﾙ ﾃﾞﾊﾞｲｽ 安心 し 任せ ください 来店 際 待ち 時間 少なく なる Web 予約 勧め
66,66,あっぷる,アップル稲沢店 | 車買取と言えば - クルル,https://qululu.jp/apple/,車買取と言えば、アップル！ 稲沢市にある、地域密着の車買取専門店。,67,車 買取 言え ｱｯﾌﾟﾙ 稲沢 市 ある 地域 密着 車 買取 専門
67,67,あっぷる,全ての記事 - キッズルームアップル,https://www.apple-kids.com/blog,天気が良い日は変わらず外で遊んでいます。 水あそびの次は、虫や葉っぱを探したり、鉄棒にぶら下がったり。 中でも、ブロックだけでなく、走り回ったりみんな元気いっぱいです！！ 18 0. いいね！されていない記事. キッズルームアップル はなぞの.,68,天気 良い 日 変わら 外 遊ん い 水あそび 次 虫 葉っぱ 探し 鉄棒 ぶら下がっ 中 ﾌﾞﾛｯｸ なく 走り回っ みんな 元気 いっぱい 0 0 いい さ い 記事 ｷｯｽﾞﾙｰﾑｱｯﾌﾟﾙ はなぞの
68,68,あっぷる,ファインオンラインショップ / HURRY UPPLE ハリーアップル,https://www.fine-kagaku.co.jp/products/detail/506,HURRY UPPLE ハリーアップル. 商品番号 r-100661. JANコード. 世界中で話題の成分“NMN”と、素晴らしいパワーを秘めたスイスのリンゴ“ウトビラー・スパトラウバー”を先端技術で培養したこだわりの美容成分をWで詰め込んだサプリメントです。,69,HURRY UPPLE ﾊﾘｰ ｱｯﾌﾟﾙ 商品 番号 r 0 JAN ｺｰﾄﾞ 世界 話題 成分 NMN 素晴らしい ﾊﾟﾜｰ 秘め ｽｲｽ ﾘﾝｺﾞ ｳﾄﾋﾞﾗｰ･ｽﾊﾟﾄﾗｳﾊﾞｰ 先端 技術 培養 し こだわり 美容 成分 W 詰め込ん ｻﾌﾟﾘﾒﾝﾄ
69,69,あっぷる,アップル Apple ノートパソコン 通販 | ビックカメラ.com,https://www.biccamera.com/bc/category/001/100/009/005/?entr_nm=%83A%83b%83v%83%8B%81%40Apple,「アップル Apple ノートパソコン」の通販ならビックカメラ.com。人気商品はレビューやランキングをチェック。安心の長期保証サービス、店舗在庫をネット上で確認、お近くの店舗で受取り申し込みもできます。,70,ｱｯﾌﾟﾙ Apple ﾉｰﾄ ﾊﾟｿｺﾝ 通販 ﾋﾞｯｸ ｶﾒﾗ com 人気 商品 ﾚﾋﾞｭｰ ﾗﾝｷﾝｸﾞ ﾁｪｯｸ 安心 長期 保証 ｻｰﾋﾞｽ 店舗 在庫 ﾈｯﾄ 確認 近く 店舗 受取り 申し込み でき
70,70,あっぷる,ビッグアップル.秋葉原店 - P-WORLD,https://www.p-world.co.jp/tokyo/big-apple.htm,6 日前 — 店舗情報. 住所: 東京都千代田区外神田1-16-1 トゥモロ-ビル1F～4F; アクセス: 秋葉原・万世橋署の隣; 営業時間: 10:00 ～ 22:40; パチンコ: 185台：[4] [500円/400玉]; パチスロ: 663台：[1000円/46枚] [10] [5]; 店内環境: Wi-Fi、携帯 ...,71,0 前 店舗 情報 住所 東京 都 千代田 区 外神田 0 0 0 ﾄｩ ﾓﾛ ﾋﾞﾙ 0 F 0 F ｱｸｾｽ 秋葉原 万世 隣 営業 時間 0 0 0 0 ﾊﾟﾁﾝｺ 0 台 0 0 円 0 玉 ﾊﾟﾁｽﾛ 0 台 0 円 0 0 0 店内 環境 Wi Fi 携帯
71,71,あっぷる,キッズルームあっぷる【地域子育て支援拠点事業】 - 余市町,https://www.town.yoichi.hokkaido.jp/kurashi/kurashinojouhou/ninnsin-syussan-kosodate/kidsroom_apple.html,新型コロナウイルス感染症対策の為のお願い. 新型コロナウィルス感染症対策の為、あっぷるをご利用される方は、. 下記の事項にご理解いただきます ...,72,新型 ｺﾛﾅ ｳｲﾙｽ 感染 対策 為 願い 新型 ｺﾛﾅ ｳｨﾙｽ 感染 対策 為 あっぷる 利用 さ 方 下記 事項 理解 いただき
72,72,あっぷる,あっぷる(岡崎/カフェ・スイーツ) | ホットペッパーグルメ,https://www.hotpepper.jp/strJ000408579/,あっぷる（岡崎/カフェ・スイーツ/カフェ）の店舗情報・予約なら、お得なクーポン満載【ホットペッパーグルメ】！あっぷるの地図、メニュー、口コミ、写真などグルメ情報満載です！,73,あっぷる 岡崎 ｶﾌｪ ｽｲｰﾂ ｶﾌｪ 店舗 情報 予約 得 ｸｰﾎﾟﾝ 満載 ﾎｯﾄ ﾍﾟｯﾊﾟｰ ｸﾞﾙﾒ あっぷる 地図 ﾒﾆｭｰ 口ｺﾐ 写真 ｸﾞﾙﾒ 情報 満載
73,73,あっぷる,はやい・安い・安心の全国チェーン「アップル車検」,http://www.apl21.com/,自動車総合メンテナンスの全国チェーンアップル車検 オンラインで安心・簡単に車検価格見積＆予約が行えます。安い・早い・安心の車検専門店.,74,自動 総合 ﾒﾝﾃﾅﾝｽ 全国 ﾁｪｰﾝ ｱｯﾌﾟﾙ 車検 ｵﾝ ﾗｲﾝ 安心 車検 価格 見積 予約 行え 安い 早い 安心 車検 専門
74,74,あっぷる,弘前ライブニュース applestream(アップルストリーム)｜無料 ...,https://applestream.jp/,弘前FMラジオ局アップルウェーブが提供する無料インターネットニュース動画情報サイト『applestream(アップルストリーム)』。ライブ配信は、アップルストリームと同時にyoutubeでも配信しています！ チャンネル登録していただくと、アップしたニュースや ...,75,弘前 FM ﾗｼﾞｵ 局 ｱｯﾌﾟﾙ ｳｪｰﾌﾞ 提供 する 無料 ｲﾝﾀｰﾈｯﾄ ﾆｭｰｽ 動画 情報 ｻｲﾄ applestream ｱｯﾌﾟﾙ ｽﾄﾘｰﾑ ﾗｲﾌﾞ 配信 ｱｯﾌﾟﾙ ｽﾄﾘｰﾑ 同時 youtube 配信 し い ﾁｬﾝﾈﾙ 登録 し いただく ｱｯﾌﾟ し ﾆｭｰｽ
75,75,あっぷる,アップル医療機器株式会社 / TOPページ,http://www.apple-medical.co.jp/,"医療装具・テーピングサポーター・各種固定バンド・固定帯等を取り扱っています. 0 合計 ¥ 0. 現在カート内に商品はございません。 全ての商品, 腰, ひざ, 下肢全般, 手・ひじ, 使い捨て, 保温用サポーター, その他.",76,医療 装具 ﾃｰﾋﾟﾝｸﾞ ｻﾎﾟｰﾀｰ 各種 固定 ﾊﾞﾝﾄﾞ 固定 取り扱っ い 0 合計 0 現在 ｶｰﾄ 商品 ござい 全て 商品 腰 ひざ 下肢 全般 ひじ 使い捨て 保温 ｻﾎﾟｰﾀｰ 他
76,76,あっぷる,あっぷる調剤薬局 長池店 | 豊橋市 | 一般社団法人 愛知県薬剤師会,https://www.apha.jp/pharmacy_search/area_toyohashi/entry-9751.html/tpl/pharmacy_search/entry1.html,"薬局名, あっぷる調剤薬局 長池店. 所在地, 豊橋市下地町長池75. 電話番号, 0532-58-9333. FAX番号, 0532-58-9366. 営業時間. 定休日. 保険薬局（処方せん応需薬局）, ○. 在宅医療受入薬局. 公認スポーツファーマシスト在籍.薬局名： あっぷる調剤薬局 長池店FAX番号： 0532-58-9366",77,薬局 名 あっぷる 調剤 薬局 長池 所在 地 豊橋 市 下地 町長 0 電話 番号 0 0 0 FAX 番号 0 0 0 営業 時間 定休 日 保険 薬局 処方 せん 応需 薬局 在宅 医療 受入 薬局 公認 ｽﾎﾟｰﾂ ﾌｧｰﾏ ｼｽﾄ 在籍 薬局 名 あっぷる 調剤 薬局 長池 FAX 番号 0 0 0
77,77,あっぷる,アップルの求人 - 愛知県 名古屋市 中川区 | Indeed (インディード),https://jp.indeed.com/%E3%82%A2%E3%83%83%E3%83%97%E3%83%AB%E9%96%A2%E9%80%A3%E3%81%AE%E6%B1%82%E4%BA%BA%E6%84%9B%E7%9F%A5%E7%9C%8C-%E5%90%8D%E5%8F%A4%E5%B1%8B%E5%B8%82-%E4%B8%AD%E5%B7%9D%E5%8C%BA,Indeed.com で愛知県 名古屋市 中川区のアップルの107件の検索結果: 買取スタッフ、バイヤー、営業などの求人を見る。,78,Indeed com 愛知 県 名古屋 市 中川 区 ｱｯﾌﾟﾙ 0 件 検索 結果 買取 ｽﾀｯﾌ ﾊﾞｲﾔｰ 営業 求人 見る
78,78,あっぷる,事業所の詳細 | あっぷるエイド | 大阪府 - 介護サービス情報 ...,https://www.kaigokensaku.mhlw.go.jp/27/index.php?action_kouhyou_detail_001_kihon=true&JigyosyoCd=2772303331-00&ServiceCd=110,"事業所の名称、所在地及び電話番号その他の連絡先. 事業所の名称, (ふりがな), あっぷるえいど. あっぷるエイド. 事業所の所在地, 〒545-0011, 市区町村コード, 大阪市阿倍野区. （都道府県から番地まで）, 大阪府大阪市阿倍野区昭和町2-17-26.介護サービスの種類： 訪問介護",79,事業 名称 所在 地 電話 番号 他 連絡 先 事業 名称 ふりがな あっぷる いど あっぷる ｴｲﾄﾞ 事業 所在 地 0 0 市 区 町 村 ｺｰﾄﾞ 大阪 市 阿倍野 区 都 道 府 県 番地 大阪 府 大阪 市 阿倍野 区 昭和町 0 0 0 介護 ｻｰﾋﾞｽ 種類 訪問 介護
