keyword,site_name,snnipet,URL,ranking
ファッション,WEAR: ファッションコーディネート,WEAR（ウェア）は日本最大級のファッションコーディネートサイトです。モデルや俳優、ショップスタッフの着こなし1000万枚以上の中からコーデを探せます。気にいったアイテムはそのまま購入も！,"=HYPERLINK(""https://wear.jp/"")",1
ファッション,人気のファッションコーディネート - WEAR,キャッシュ,"=HYPERLINK(""https://wear.jp/coordinate/"")",2
ファッション,ファッションまとめ（レディース） - ZOZOTOWN,人気キュレーションメディアの最新ファッション情報（レディース）を集めました！今話題のファッションやトレンド情報をご覧いただけます。ZOZOTOWNは8444ブランドのアイテムを公式に取扱うファッション通販サイトです。,"=HYPERLINK(""https://zozo.jp/fashionnews/?sex=women"")",3
ファッション,ファッション通販ZOZOTOWN,ZOZOTOWNは8441ブランドのアイテムを公式に取扱うファッション通販サイトです。「ツケ払い」ならお支払は2ヶ月後！即日配送（一部地域）で最短翌日お届け。今なら割引クーポンを対象ショップ限定でご利用いただけます。秋冬アイテムぞくぞく入荷！,"=HYPERLINK(""https://zozo.jp/"")",4
ファッション,ファッション - Wikipedia,ファッション（英: fashion、英語発音: [ˈfæʃən] ファシャン。仏: mode、フランス語発音: [mɔd] モッド）とは、ある時点において広く行われているスタイルや風習のことである。特に、人々の間で流行している服装を指すが、装いに関係する装身具、美容（ ...,"=HYPERLINK(""https://ja.wikipedia.org/wiki/%E3%83%95%E3%82%A1%E3%83%83%E3%82%B7%E3%83%A7%E3%83%B3"")",5
ファッション,ファッション通販SHOPLIST（ショップリスト ...,ファッション通販SHOPLIST（ショップリスト） レディースからメンズ・キッズまで、多様なジャンルのファストファッションアイテムがまとめて買えるショッピングサイト。,"=HYPERLINK(""https://shop-list.com/"")",6
ファッション,ファッション通販 FASHION WALKER,人気ブランドのアイテムが続々入荷中!!ファッションウォーカーは2200以上の人気ブランドを公式に取り扱うファッション通販サイトです。即日出荷・サイズ交換・返品可.,"=HYPERLINK(""https://fashionwalker.com/"")",7
ファッション,レディースファッションの通販｜ベルメゾンネット,【5000円（税込）以上送料無料】レディースファッションの通販ならベルメゾン。人気のレディースファッションを豊富に取り揃え。ベルメゾンのレディースファッションはおしゃれでサイズ多数！コート、ワンピース、パンツ、スカート、セール商品など品 ...,"=HYPERLINK(""https://www.bellemaison.jp/ep/srvlt/EPFB00/EPFB0002/dMidCatLstShow?BELN_SHOP_KBN=100&DAI_CATEGORY_ID=1"")",8
ファッション,GRL グレイル 公式 | レディースファッション通販のグレイル ...,流行のアイテムが何でも手に入る日本最大級のファストファッション通販サイト。GRL グレイルはレディースファッション洋服通販サイトです。,"=HYPERLINK(""https://www.grail.bz/"")",9
ファッション,ニュース(2) - ファッションプレス,ファッションプレスは、最新ファッションニュースや新作コレクション、ファッションショーのレポート等をスピーディに配信[2ページ目]。ファッション以外にもライフスタイルやビューティ、アート等のニュースも掲載しています。,"=HYPERLINK(""https://www.fashion-press.net/news/?page=2"")",10
ファッション,ファッション通販 d fashion,類似ページ,"=HYPERLINK(""https://fashion.dmkt-sp.jp/"")",11
ファッション,人気のレディースファッションコーディネート - WEAR,キャッシュ,"=HYPERLINK(""https://wear.jp/women-coordinate/"")",12
ファッション,35歳からのプチプラを品良く着こなしたいファッションブログ,ご覧いただきありがとうございます！ 35歳からの大人向けプチプラmixコーデを載せています。 UNIQLOやGUなどのプチプラをミックスしながら品良く見えるコーデを目指しています。 小学生ママのイベントファッションも載せてます。 身長160cmの標準体型です ...,"=HYPERLINK(""https://ameblo.jp/kurimama2013/"")",13
ファッション,関連ニュースまとめ - ファッションプレス,ファッションに関するトピックをまとめて紹介。ファッション以外にも、ファッションを中心にブランド、グルメ、音楽、映画、アート、カルチャーなどライフスタイルに関する最新ニュースや取材レポートなどをスピーディに配信しています。,"=HYPERLINK(""https://www.fashion-press.net/news/search/fashion"")",14
ファッション,ファッションプレス: ファッションブランド・デザイナー情報,ファッションブランドを中心に映画、アート、音楽、コスメ、グルメなどを紹介する日本最大級のライフスタイルメディア「ファッションプレス」。おでかけスポットなどの情報も掲載しています。,"=HYPERLINK(""https://www.fashion-press.net/"")",15
ファッション,人気レディースファッション通販の神戸レタス【公式サイト】,安くて可愛い人気のレディースファッションなら神戸レタスにお任せください。トップスやボトム、ワンピース、アウター、シューズなど、豊富なアイテムを取り揃えております。通販サイトの他、実店舗でもお買い求めいただけます。【神戸レタス】,"=HYPERLINK(""https://www.lettuce.co.jp/"")",16
ファッション,レディースファッション通販SHOPLIST（ショップリスト）,ファッション通販SHOPLIST（ショップリスト）レディースの最新アイテムを安くまとめ買いしよう。お得なセールやイベント毎日開催！最短で翌日発送。ファストファッションから有名ブランドまで豊富な品揃え。,"=HYPERLINK(""https://shop-list.com/women/"")",17
ファッション,【楽天市場】レディースファッション |インターネット通販 ...,レディースファッションの通販なら楽天市場。流行の新作レディースファッションなどが大集合！ワンピ、スカート、ニット、ジーンズ、デニムなどサイズ別にも品数豊富に取り揃え。口コミ・ランキング・各種特集ページから簡単にお選びいただけます。,"=HYPERLINK(""https://www.rakuten.co.jp/category/ladiesfashion/"")",18
ファッション,20代・30代のレディースファッション通販・通販 サイト ...,20代・30代・40代の女性におすすめな大人レディースカジュアルファッション通販サイト！トレンドファッションアイテムが目白押し！,"=HYPERLINK(""https://titivate.jp/"")",19
ファッション,coca コカ 公式サイト 大人のためのファストファッション通販,大人のためのレディースファッション通販coca(コカ)の公式通販サイト。ちょっとおしゃれな日常着をテーマに、ベーシック＆トレンドなアイテムが《1000円台》から！3980円以上で送料無料。実店舗でのお買い物も可能。,"=HYPERLINK(""https://www.cocacoca.jp/"")",20
ファッション,メンズファッション通販 d fashion - dマーケット,キャッシュ,"=HYPERLINK(""https://fashion.dmkt-sp.jp/top/index/pt_0-tp_0"")",21
ファッション,レディースファッション通販 MAGASEEK(マガシーク),MAGASEEK(マガシーク)は人気ブランドや雑誌掲載アイテムを公式に取扱う国内最大級のファッション通販サイトです。トレンドアイテムや定番アイテムなど、幅広いレディースアイテムをご購入できます。お得なクーポン、人気ショップのアイテムは勿論、人気の ...,"=HYPERLINK(""https://www.magaseek.com/"")",22
ファッション,20代・30代・40代女性のレディースファッション 通販,ニッセン通販サイト。レディースファッションのページです。20代・30代・40代女性の通勤服からドレス、カジュアル・フォーマル服まで、秋冬コーデや今どきファッションも豊富！,"=HYPERLINK(""https://www.nissen.co.jp/s/ladies/"")",23
ファッション,大人のための高感度ファッション通販 タカシマヤ ...,"【5000円以上で送料無料】 タカシマヤファッションスクエアは30代,40代のレディースを中心に、人気ブランドのアイテムを公式に取り扱う、大人のためのファッション通販サイトです。セレクトショップの商品をはじめ、定番からトレンドアイテムまで購入でき ...","=HYPERLINK(""https://www.t-fashion.jp/"")",24
ファッション,ファッション通販 Rakuten Fashion(楽天ファッション／旧 ...,Rakuten Fashion(楽天ファッション)は人気ブランドを取り扱うファッション通販サイトです。新作アイテムも続々入荷中！3980円（税込）以上のお買い物で送料無料！,"=HYPERLINK(""https://brandavenue.rakuten.co.jp/"")",25
ファッション,商品検索 -ファッション通販 FASHION WALKER,人気ブランドのアイテムが続々入荷中!!ファッションウォーカーは2200以上の人気ブランドを公式に取り扱うファッション通販サイトです。即日出荷・サイズ交換・返品可.,"=HYPERLINK(""https://fashionwalker.com/search/"")",26
ファッション,Honeys,Honeys（ハニーズ）の公式通販サイト。ベーシックからトレンドまで幅広いファッションアイテムをプチプラで販売。大人の女性からティーンまで年齢層も幅広く対応。オフィスカジュアル、デート、普段着など今欲しいアイテムが見つかります。,"=HYPERLINK(""https://www.honeys-onlineshop.com/shop/default.aspx"")",27
ファッション,ファッション通販 | ワールド オンラインストア | WORLD ...,キャッシュ,"=HYPERLINK(""https://store.world.co.jp/"")",28
ファッション,レディースファッション | Amazon.co.jp,レディースファッションならアマゾン。人気のレディースファッションをお手頃な価格帯で幅広く取り揃えています。Amazonが配送する商品は送料無料・返品無料です。（一部を除く）,"=HYPERLINK(""https://www.amazon.co.jp/%E3%83%AC%E3%83%87%E3%82%A3%E3%83%BC%E3%82%B9%E3%83%95%E3%82%A1%E3%83%83%E3%82%B7%E3%83%A7%E3%83%B3/b?ie=UTF8&node=2230006051"")",29
ファッション,ファッション通販fifth(フィフス),流行のファッションアイテムを通販でお探しなら、ハイビジュアル・低価格で洋服、靴、アクセを提供するfifth(フィフス)毎月100型新作アイテム登場！安井レイさんやソンイさんのコーデアイテムもプチプラで販売中！,"=HYPERLINK(""https://5-fifth.com/"")",30
ファッション,アマゾンファッション 通販 | Amazon,アマゾンファッションでは、人気のレディース、メンズファッションアイテムをお手頃な価格帯で幅広く取り揃えています。Amazonが配送する商品は送料無料・返品無料です。（一部を除く）,"=HYPERLINK(""https://www.amazon.co.jp/%E3%83%95%E3%82%A1%E3%83%83%E3%82%B7%E3%83%A7%E3%83%B3/b?ie=UTF8&node=2229202051"")",31
ファッション,人気ファッションランキング｜フェリシモ,フェリシモのファッションブランドの人気コレクションをランキングでご紹介します。,"=HYPERLINK(""https://www.felissimo.co.jp/contents/fashionranking/"")",32
ファッション,ファッション 記事一覧 | WWDJAPAN,ファッション / 全て. 全て; ニュース · コラム・ インタビュー · スナップ · VIDEOS · PODCAST · ファッション · コレクション · ライフ · ウオッチ& ジュエリー · アイウエア · バッグ& シューズ. 10秒で読む.,"=HYPERLINK(""https://www.wwdjapan.com/category/fashion"")",33
ファッション,【ニッセン】ファッション通販 2021秋,ニッセンの通販オンラインショップは、ファッション、インナー、インテリア、美容グッズなど、幅広い品揃えを豊富なサイズで取り揃えています。コーディネートやプチプライスも充実。,"=HYPERLINK(""https://www.nissen.co.jp/"")",34
ファッション,FASHIONSNAP.COM [ファッションスナップ・ドットコム],ファッションに関連する事象を中心にビューティーやビジネス、アート、カルチャー、スポーツなど様々なトピックを取り上げる情報サイト。ファッションニュースの提供や、ストリートスナップ、最新コレクション、日曜日22時占い、ポッドキャスト、 ...,"=HYPERLINK(""https://www.fashionsnap.com/"")",35
ファッション,MEN | ファッション通販 Rakuten Fashion(楽天 ... - 楽天市場,アウターコレクション開催中！Rakuten Fashion(旧楽天ブランドアベニュー)は人気ブランドを取り扱うファッション通販サイトです。新作アイテムも続々入荷中！3980円（税込）以上のお買い物で送料無料！,"=HYPERLINK(""https://brandavenue.rakuten.co.jp/men/?l-id=brn_head_sex"")",36
ファッション,"ファッション,コスメ通販DHOLIC",おしゃれなファッション洋服通販サイトdholic。メンズからレディースまで品揃え豊富。,"=HYPERLINK(""https://m.dholic.co.jp/"")",37
ファッション,ファッション のおすすめ人気通販｜Creema(クリーマ),ファッションを探せます。ハンドメイド、クラフト、手作り手芸品の通販・販売・購入ならCreema。301097点の一点ものならではのかわいい・おしゃれ・ユニークなおすすめのアイテムから自分だけのお気に入り作品をどうぞ。,"=HYPERLINK(""https://www.creema.jp/listing/8"")",38
ファッション,カテゴリ一覧 -ファッション通販 FASHION WALKER,カテゴリ一覧. スニーカー. レディースファッション. メンズファッション. ガールズ. ボーイズ. コスメ・香水・化粧品. レディースファッション. トップス. スカート. パンツ. ワンピース・ドレス. ジャケット・アウター. オールインワン・セットアップ ...,"=HYPERLINK(""https://fashionwalker.com/contents/category/"")",39
ファッション,ファッション（読み）ふぁっしょん（英語表記） - コトバンク,フランス語のファソンfaçonとなり、さらに英語のファッションfashionとなった。今日、本来の英語でのファッションには多様な意味がある。第一義は「流行」であり、「はやりの型 ...,"=HYPERLINK(""https://kotobank.jp/word/%E3%83%95%E3%82%A1%E3%83%83%E3%82%B7%E3%83%A7%E3%83%B3-122310"")",40
ファッション,ファッションアイテムの人気ランキング - Rakuten Fashion,ファッションアイテムの人気ランキングです！楽天ファッション(旧楽天ブランドアベニュー)で人気のファッションアイテムをチェックできます。,"=HYPERLINK(""https://brandavenue.rakuten.co.jp/ranking/"")",41
ファッション,ファッションまとめ - ZOZOTOWN,人気キュレーションメディアの最新ファッション情報を集めました！今話題のファッションやトレンド情報をご覧いただけます。ZOZOTOWNは8444ブランドのアイテムを公式に取扱うファッション通販サイトです。,"=HYPERLINK(""https://zozo.jp/fashionnews/"")",42
ファッション,ファッションアイテム人気ランキング - ZOZOTOWN,すべて; トップス; ジャケット/アウター; パンツ; オールインワン・サロペット; スカート; ワンピース/ドレス; フォーマルスーツ/小物; バッグ; シューズ; ファッション雑貨; 財布/小物; 腕時計; ヘアアクセサリー; アクセサリー; アンダーウェア ...,"=HYPERLINK(""https://zozo.jp/ranking/all-sales-women.html"")",43
ファッション,ファッション 通販 - Yahoo!ショッピング,Yahoo!ショッピング | ファッションのランキングや口コミも豊富なネット通販。更にお得なPayPay残高も！スマホアプリも充実で毎日どこからでも気になる商品をその場でお求めいただけます。,"=HYPERLINK(""https://shopping.yahoo.co.jp/category/13457/recommend"")",44
ファッション,ファッションの意味や定義 Weblio辞書,(1)人々の間で流行している服装や装飾等のこと。Weblio国語辞典では「ファッション」の意味や使い方、用例、類似表現などを解説しています。,"=HYPERLINK(""https://www.weblio.jp/content/%E3%83%95%E3%82%A1%E3%83%83%E3%82%B7%E3%83%A7%E3%83%B3"")",45
ファッション,ファッション‼︎ | 文春オンライン,『ダルちゃん』（小学館）や『ZUCCA×ZUCA（ヅッカヅカ）』（講談社）のはるな檸檬さんの最新作。魑魅魍魎ファッション業界を舞台に「見せかけの人たち」を描くヒューマンホラー。「週刊文春W…,"=HYPERLINK(""https://bunshun.jp/category/fashion"")",46
ファッション,秋の大人おしゃれはコレ！注目ファッションアイテム6選で ...,また、近年多くのファッションブランドがサスティナブルな取り組みを行っており、有害な化学物質を使用しない自然素材やリサイクル素材、アニマルフリー素材など、地球環境に優しいアイテムを多数打ち出しています。 2021-22年秋冬コレクションのランウェイ ...,"=HYPERLINK(""https://news.yahoo.co.jp/articles/aed55caa14e7fa29bb41b0e4a5150d990dcaaf4f"")",47
ファッション,ONWARD CROSSET | ファッション通販サイト[オンワード ...,オンワードグループ公式ファッション通販サイトのONWARD CROSSET。大人気ブランド(23区、組曲、自由区、ICB、any SiSなど)の多彩なアイテムを紹介しているショッピングサイトです！毎日更新！旬なアイテムを要チェック！,"=HYPERLINK(""https://crosset.onward.co.jp/"")",48
ファッション,ファッション 新作 - フェリシモコレクション,ファッション 新作を紹介しています。ファッション・雑貨の定期便通販ならフェリシモコレクション。,"=HYPERLINK(""https://www.felissimo.co.jp/collect/wk59541/"")",49
ファッション,ファッション通販サイトのSTRIPE CLUB（ストライプクラブ）,ファッション通販サイトのSTRIPE CLUBは、レディースファッションからメンズ・キッズまで幅広く取り揃えたファッション通販サイトです。ファッション通販サイトのストライプクラブでは、TV・CMや雑誌でお馴染みのearth music&ecologyやE hyphen world ...,"=HYPERLINK(""https://stripe-club.com/"")",50
ファッション,レディースファッションの商品一覧 - QVCジャパン,ファッション（レディースファッション）のカテゴリから、ファッションウェアをご紹介。コート、ジャケット、ワンピース、チュニック、カーディガン、パンツ、スカートなど様々なアイテムをラインナップ。人気ブランドの新作はシーズン毎に登場。,"=HYPERLINK(""https://qvc.jp/catalog/cList.html?baseRo=cat2_17&searchType=categoryList"")",51
ファッション,ファッション | JALショッピング,キャッシュ,"=HYPERLINK(""https://www.shop.jal.co.jp/c/001/"")",52
ファッション,メンズ - 海外ファッション通販【BUYMA】,【BUYMA】メンズファッション｜メンズファッションを探す。 バイマは誰もが『パーソナルショッパー』になることで誕生した史上初の『お買い物代行コミュニティ』です。,"=HYPERLINK(""https://www.buyma.com/mens/"")",53
ファッション,世界を買える 海外ブランド・ファッション通販【BUYMA】,【BUYMA】世界を買える 海外ブランド・ファッション通販「BUYMA(バイマ)」。世界各国のパーソナルショッパー(出品者)から、世界中の商品を購入できるマーケットプレイスです。,"=HYPERLINK(""https://www.buyma.com/"")",54
ファッション,Felissimo Fashion News - フェリシモ,フェリシモファッションの最旬情報やSALE情報をご紹介します。,"=HYPERLINK(""https://www.felissimo.co.jp/fashion/"")",55
ファッション,ファッション | 価格比較、通販,価格.comファッションは全国の通販サイトの販売価格情報をはじめ、ランキング別やブランド別など、さまざまな視点から商品を比較・検討できます！,"=HYPERLINK(""https://kakaku.com/fashion/"")",56
ファッション,長濱ねると考える、東京ファッションとSDGs 「大切なのは ...,2021年8月30日（月）～9月4日（土）の期間にて開催された楽天 ファッションウィーク 東京 2022春夏（Rakuten Fashion Week Tokyo 2022 S/S）に、SDGsレポ.,"=HYPERLINK(""https://news.yahoo.co.jp/articles/442bcae0a44716176bcdd9d39fe7eba5059278de"")",57
ファッション,レディースファッション通販 - ベルーナ,レディースファッションの通販ならベルーナ。人気のレディースファッションがお手頃価格でサイズ豊富。割引クーポンやセールなどお得なキャンペーンも随時開催中！更に交換送料無料サービスで安心。ミセスファッション通販サイトはベルーナ。,"=HYPERLINK(""https://belluna.jp/01/010101/c/10000000/l_cate/"")",58
ファッション,ファッション | イオンの公式通販 - イオンスタイルオンライン,イオンのレディース・メンズ ファッションのネットEC通販。カジュアル、ビジネス、トップス、カットソー、シャツ、ボトムス、インナー、大きいサイズ、スーツなど豊富な品揃え。店舗受取りなら送料無料。WAON POINTがつかえる・たまる。,"=HYPERLINK(""https://aeonretail.com/shop/stylefashion/"")",59
ファッション,メンズファッション - シャツ、ジーンズの古着 - ヤフオク!,メンズファッションならヤフオク! 春夏秋冬、お得に最新コーディネートを揃えられるのも、圧倒的な商品数のネットオークションで新品、古着、ビンテージ、アウトレット品、訳あり品を最安値価格で落札できるから！ 送料無料、手数料無料の商品も ...,"=HYPERLINK(""https://auctions.yahoo.co.jp/list2/23176-category.html"")",60
ファッション,ファッション 通販 - ディノス,ディノス(dinos）オンラインショップ、こちらは【ファッション】のカテゴリで、通販カタログやTVショッピングで紹介されている人気のファッションを多数取り揃えています。ディノスなら代引手数料無料！初めてのお買い物でもれなく1000円クーポン ...,"=HYPERLINK(""https://www.dinos.co.jp/c2/002003/"")",61
ファッション,ファッションセール 通販 - ディノス,ディノス(dinos）オンラインセールショップ、【ファッションセール】のカテゴリです。通販カタログやTVショッピングで人気のファッションを多数ご紹介しています。ディノスなら代引手数料無料☆初めてのお買い物でもれなく1000円クーポンプレゼント！,"=HYPERLINK(""https://www.dinos.co.jp/c2/003003003/"")",62
ファッション,MEN | ファッション通販 Rakuten Fashion(楽天ファッション ...,アウターコレクション開催中！Rakuten Fashion(旧楽天ブランドアベニュー)は人気ブランドを取り扱うファッション通販サイトです。新作アイテムも続々入荷中！3980円（税込）以上のお買い物で送料無料！,"=HYPERLINK(""https://brandavenue.rakuten.co.jp/ba/men/"")",63
ファッション,アウター特集 | ファッション通販 Rakuten Fashion(楽天 ...,ブルゾンやマウンテンパーカー、デニムジャケット、ダウンなど、秋冬に欲しい人気ブランドのアウターを特集！／税込3980円以上購入で送料無料／楽天ポイントが使えて貯まる！／Rakuten Fashion(楽天ファッション),"=HYPERLINK(""https://brandavenue.rakuten.co.jp/contents/outer/"")",64
ファッション,KIDS | ファッション通販 Rakuten Fashion(楽天ファッション ...,アウターコレクション開催中！Rakuten Fashion(旧楽天ブランドアベニュー)は人気ブランドを取り扱うファッション通販サイトです。新作アイテムも続々入荷中！3980円（税込）以上のお買い物で送料無料！,"=HYPERLINK(""https://brandavenue.rakuten.co.jp/kids/?l-id=brn_head_sex"")",65
