keyword,site_name,snnipet,URL,ranking
ファッション,ファッション | 25ans(ヴァンサンカン),女性ファッション誌『25ans』公式サイトの「ファッション」コーナーです。最旬トレンド、華やかスタイリング、厳選ブランドバッグ＆シューズや他では見られないラグジュアリーなハイジュエリーなど、毎日チェックしてほしいとっておきの最新ファッション ...,"=HYPERLINK(""https://www.25ans.jp/fashion/"")",66
ファッション,"ファッション,コスメ通販DHOLIC",おしゃれなファッション洋服通販サイトdholic。メンズからレディースまで品揃え豊富。,"=HYPERLINK(""https://www.dholic.co.jp/"")",67
ファッション,LOHACO - ファッション 通販 - ロハコ,ファッション の通販ならLOHACO（ロハコ）で！LOHACO発送の商品は、最短翌日お届け。PayPayが使える、貯まる。アスクル個人向け日用品ショッピングサイトです。,"=HYPERLINK(""https://lohaco.yahoo.co.jp/category/58463/"")",68
ファッション,ファッションのプロジェクト一覧｜マクアケ - Makuake,アタラシイものや体験の応援購入サービス、Makuake（マクアケ）のファッションのプロジェクトです。デザイン作成、服制作などで資金調達によって実現したい実行者の想いを支援しましょう。応援するとプレミアムなモノやサービスのお返しがあります！,"=HYPERLINK(""https://www.makuake.com/discover/categories/fashion/"")",69
ファッション,Newsニュース - ファッションプレス,ファッションプレスは、最新ファッションニュースや新作コレクション、ファッションショーのレポート等をスピーディに配信。ファッション以外にもライフスタイルやビューティ、アート等のニュースも掲載しています。,"=HYPERLINK(""https://www.fashion-press.net/news/"")",70
ファッション,レディースファッション - ヤフオク!,レディースファッション、ファッションならヤフオク!。圧倒的な商品数のネットオークションで の中古品、新品、古着、アウトレット品、訳あり品を最安値価格で落札して購入しよう！ 送料無料、手数料無料の商品もあります。不用品の処分には出品、買取が ...,"=HYPERLINK(""https://auctions.yahoo.co.jp/list2/23288-category.html"")",71
ファッション,ブランド別の中古品・新品・古着 - ファッション - ヤフオク!,ファッション、ブランド別ならヤフオク!。圧倒的な商品数のネットオークション・フリマで新品、未使用品、古着、中古品、アウトレット品、訳あり品を最安値価格で落札して購入しよう！ 送料無料、手数料無料の商品もあります。不用品の処分には出品、買取 ...,"=HYPERLINK(""https://auctions.yahoo.co.jp/list2/23172-category.html"")",72
ファッション,“ラブロマンスの女王“ ソン・ヘギョの華麗なるファッション遍歴,さらに今年2月には「フェンディ」の韓国アンバサダーにも抜擢するなど、20年以上トップ女優として活躍し続けるソン・ヘギョの歴代ファッションをチェック。 【写真】ヒョンビンもソン・ジュンギも虜に！ 魔性女優ソン・ヘギョの華麗なる美容遍歴 ...,"=HYPERLINK(""https://news.yahoo.co.jp/articles/c08117c3027cef807b478b08a55a8b0cbf085c04"")",73
ファッション,カテゴリ一覧 | ファッション通販 Rakuten Fashion(楽天 ...,Rakuten Fashionで購入できるアイテムのブランド一覧です。Rakuten Fashionはさまざまな人気ブランドを公式に取り扱うファッション通販サイトです。,"=HYPERLINK(""https://brandavenue.rakuten.co.jp/categorylist/"")",74
ファッション,WOMEN | ファッション通販 Rakuten Fashion(楽天 ...,アウターコレクション開催中！Rakuten Fashion(旧楽天ブランドアベニュー)は人気ブランドを取り扱うファッション通販サイトです。新作アイテムも続々入荷中！3980円（税込）以上のお買い物で送料無料！,"=HYPERLINK(""https://brandavenue.rakuten.co.jp/ladies/?l-id=brn_head_sex"")",75
ファッション,レディースファッション 通販 - Yahoo!ショッピング,ファッション. コート、アウター. ジャケット. トップス. ボトムス、パンツ. ワンピース、チュニック. オールインワン、セットアップ · ジャージ、スウェット. シューズ. バッグ. 財布、帽子、ファッション小物. 下着、靴下、部屋着. スーツ、フォーマル.,"=HYPERLINK(""https://shopping.yahoo.co.jp/category/13457/2494/recommend"")",76
ファッション,メンズファッション 通販 - Yahoo!ショッピング,ファッション. コート、アウター. ジャケット. トップス. ボトムス、パンツ. つなぎ、オールインワン · ジャージ、スウェット. シューズ. バッグ. 財布、帽子、ファッション小物. 下着、靴下、部屋着. ワイシャツ · ネクタイ. スーツ、フォーマル.,"=HYPERLINK(""https://shopping.yahoo.co.jp/category/13457/2495/recommend"")",77
ファッション,ファッション | My Nintendo Store（マイニンテンドーストア）,任天堂の公式オンラインストア。ファッションのページ。バリエーション豊富な商品をご用意しています。,"=HYPERLINK(""https://store-jp.nintendo.com/list/goods/fashion/"")",78
ファッション,【WWDJAPAN】最新ファッション＆ビューティ情報,国内・海外の最新ファッション＆ビューティ・トレンドをはじめ、業界ニュースをいち早くお届け。最新コレクションやスナップ、キャリア情報まで、全てを網羅！,"=HYPERLINK(""https://www.wwdjapan.com/"")",79
ファッション,ベイクルーズのファッション通販 - BAYCREW'S STORE,類似ページ,"=HYPERLINK(""https://baycrews.jp/"")",80
ファッション,阪急百貨店公式通販 Hankyu FASHION,【阪急百貨店公式通販サイト】レディースのTOPページです。HANKYU FASHIONは、阪急百貨店で取り扱う人気ブランドのレディースファッションをご購入いただける通販サイトです。阪急阪神百貨店のカードが使えてお得にお買い物が可能！,"=HYPERLINK(""https://web.hh-online.jp/fashion/"")",81
ファッション,ウィメンズコレクション一覧 - ファッションプレス,ウィメンズコレクションをまとめて紹介。ファッションプレスでは、 ウィメンズコレクション以外にも、国内外の人気ブランドの最新コレクションを掲載・配信しています。,"=HYPERLINK(""https://www.fashion-press.net/collections/search/womens"")",82
ファッション,レディースファッション通販｜RUNWAY channel ...,レディースファッション通販サイトRUNWAY channel【ランウェイチャンネル】。dazzlin(ダズリン)、EMODA(エモダ)、MERCURYDUO(マーキュリーデュオ)、MURUA(ムルーア)、Ungrid(アングリッド)等の公式ファッション通販ならではの豊富な品揃え！,"=HYPERLINK(""https://runway-webstore.com/"")",83
ファッション,ファッション- 通販・テレビショッピングのショップチャンネル,ファッション情報はこちら。人気のブランドはもちろん、注目のファッションアイテムを多数ご案内します。,"=HYPERLINK(""https://www.shopch.jp/ap/fashion"")",84
ファッション,ファッション | PLAZA ONLINE STORE - プラザオンライン ...,ファッション. さらに絞りこむ. キャップ/ハット · バッグ · ポーチ · アスレチックウェア · Tシャツ/スウェット/シャツ · スカート ...,"=HYPERLINK(""https://www.plazastyle.com/ec/srDispCategoryTreeLink/doSearchCategory/11030000000/04-05/2/1"")",85
ファッション,ファッションセンターしまむら,ファッションセンターしまむら公式ウェブサイト。日常普段着 -デイリーファッション- を便利なロケーションと快適な売場、しかも気軽に買物が出来るお安い価格で提供します。,"=HYPERLINK(""https://www.shimamura.gr.jp/shimamura/"")",86
ファッション,秋冬コーデの参考にも！ ファッションが魅力的な,そこで今回は、おしゃれなキャラクターをピックアップしました！ マンネリ化しやすいオフィススタイルからカジュアルスタイルまでご紹介。秋冬に向けて、ファッションに彩りをプラスしてみてはいかがでしょうか。,"=HYPERLINK(""https://news.yahoo.co.jp/articles/9b1d94861a43152601953c78860badf705702bf6"")",87
ファッション,Fashion - ファッション - VOGUE,ファッション誌『VOGUE JAPAN』の公式サイト。世界のファッションやコレクションをはじめ、ファッションモデルやビューティ、ジュエリーなど、ファッショントレンド、コーディネートをご紹介。海外セレブやモデルのスナップ写真も掲載。,"=HYPERLINK(""https://www.vogue.co.jp/fashion"")",88
ファッション,"アマゾン: Amazon | 本, ファッション, 家電から食品まで","Amazon.co.jp 公式サイト。アマゾンで本, 日用品, ファッション, 食品, ベビー用品, カー用品ほか一億種の商品をいつでもお安く。通常配送無料(一部を除く)","=HYPERLINK(""https://www.amazon.co.jp/"")",89
ファッション,カテゴリから探す 「ファッション」 | ショップガイド - 光が丘 ...,都営地下鉄大江戸線「光が丘駅」直結、光が丘IMA「ファッション」のショップガイドです。,"=HYPERLINK(""https://www.ima-hikarigaoka.jp/shopguide/?category=fashion"")",90
ファッション,アウトレットファッション通販 『BRANDELI』,アウター; トップス; ワンピース; スカート; パンツ; スポーツウェア; レッグウェア; インナー; シューズ; バッグ; ファッション小物; アクセサリー; 水着; ライフスタイルグッズ; 福袋. レディース; メンズ; キッズ; 大きいサイズ. カテゴリをもっと見る ...,"=HYPERLINK(""https://www.brandeli.com/"")",91
ファッション,今週のファッションチェック＞鷲見玲奈 カシュクールワンピ ...,大型ファッションイベント「第33回 マイナビ 東京ガールズコレクション 2021 AUTUMN/WINTER」に登場した鷲見玲奈さん ... かのん）さん、鈴木愛理さん、中条あやみさん、Nikiさん、藤井サチさん、愛花（えりか）さんらが華やかなファッションで登場した。,"=HYPERLINK(""https://news.yahoo.co.jp/articles/1eea067efb9ca63616096758b8ec7f9433f5d6ab"")",92
ファッション,＜今週のファッションチェック＞藤井サチ ViViモデルが美脚 ...,1週間の女性有名人のファッションを紹介する「今週のファッションチェック」。今回（8月31日～9月6日）は、藤井サチさん、“めるる”こと生見愛瑠（ぬくみ・める）さん、三吉彩花さん、香音（かのん）さん.,"=HYPERLINK(""https://news.yahoo.co.jp/articles/635ee3c4e18e766a3ad1ea9fece77cf85f9eb699"")",93
ファッション,ファッション通販のhaco! | ハコ！毎日のお洋服と明日の ...,ファッション通販のhaco!（ハコ）は、わたしたちの毎日が、そして明日が、昨日よりちょっとびっくりできる、そんなお洋服や雑貨、プロジェクトがたっぷりつまったツーハンサイトです。,"=HYPERLINK(""https://www.haco.jp/"")",94
ファッション,Amazonファッションタイムセール祭りでビジネスバッグが ...,Amazonは9月13日（月）23:59までファッションタイムセール祭りを開催中です。,"=HYPERLINK(""https://japanese.engadget.com/amazon-sale-044840322.html"")",95
ファッション,Amazon ファッションタイムセール祭り - アマゾン,Amazonファッションタイムセール祭りとはAmazonが開催する計63時間のビッグセール。定番ファッションからトレンドまで、ヘアケア用品からスキンケア、コスメまで、お得な価格で人気商品を数多く取り揃え。さらに数億種類の商品を対象としたポイントアップ ...,"=HYPERLINK(""https://www.amazon.co.jp/b?ie=UTF8&node=8514009051"")",96
ファッション,レディースファッション通販 Re:EDIT‐リエディ,レディースファッション通販 Re:EDIT‐リエディのファッション通販サイト。強く、気品高く、輝く女性に寄り添うサステナブルかつエシカルなトレンドファッションアイテムが購入できる20代・30代・40代へ向けたファッション通販サイトです。,"=HYPERLINK(""https://reedit.jp/"")",97
ファッション,ファッション イン ジャパン 1945-2020 —流行と社会 ...,国立新美術館、島根県立石見美術館、読売...,"=HYPERLINK(""https://fij2020.jp/"")",98
