,Unnamed: 0,site_name,URL,snippet,target
36,36,ペット情報総合サイトPETPET,https://www.petpet.ne.jp/,ペット情報総合サイト「PETPET」。全国動物病院検索、その他ペット同伴可能飲食店やトリミングサロン、ペットショップ検索、ペットと泊まれる宿検索など。動物図鑑も充実。ペットの事なら「PETPET」。,ﾍﾟｯﾄ 情報 総合 ｻｲﾄ PETPET 全国 動物 病院 検索 他 ﾍﾟｯﾄ 同伴 飲食 ﾄﾘﾐﾝｸﾞ ｻﾛﾝ ﾍﾟｯﾄ ｼｮｯﾌﾟ 検索 ﾍﾟｯﾄ 泊まれる 宿 検索 動物 図鑑 充実 ﾍﾟｯﾄ 事 PETPET
37,37,ペット（各種相談の件数や傾向） - 国民生活センター,http://www.kokusen.go.jp/soudan_topics/data/pet.html,ペットショップで購入したウサギが、先天性の病気だった。書面には「生体のため保証はありません」と書かれていたが、解約できないのか。 生後2カ月の犬を購入 ...,ﾍﾟｯﾄ ｼｮｯﾌﾟ 購入 し ｳｻｷﾞ 先天 病気 書面 生体 ため 保証 あり 書か い 解約 でき 生後 0 ｶ月 犬 購入
38,38,ペット保険シェアNo.1の【アニコム損保】公式サイト,https://www.anicom-sompo.co.jp/,ペット保険シェア10年連続NO.1の「アニコム損保」の公式サイト。選ばれている理由は、圧倒的な保険の使いやすさ！全国6400以上の動物病院の窓口での精算や、LINEでの保険金請求が可能です。犬・猫はもちろん、鳥・うさぎ・フェレットもご契約頂けます。,ﾍﾟｯﾄ 保険 ｼｪｱ 0 年 連続 NO 0 ｱﾆｺﾑ 損保 公式 ｻｲﾄ 選ば いる 理由 圧倒 保険 使い 全国 0 以上 動物 病院 窓口 精算 LINE 保険 請求 犬 猫 鳥 うさぎ ﾌｪﾚｯﾄ 契約 頂け
39,39,ペット・花・ガーデニング・DIYの通販 | dポイントでお得にお ...,https://shopping.dmkt-sp.jp/genre/pet/?genre_code=14,ペット・花・ガーデニング・DIYに関する通販ならdショッピング。 ワンちゃんから猫ちゃん熱帯魚まで様々な種類のペットに対応した商品や花、ガーデニング用品、DIY用品など豊富な商品を取り扱っています。dポイントたまる＆つかえる！,ﾍﾟｯﾄ 花 ｶﾞｰﾃﾞﾆﾝｸﾞ DIY 関する 通販 d ｼｮｯﾋﾟﾝｸﾞ ﾜﾝ 猫 熱帯 種類 ﾍﾟｯﾄ 対応 し 商品 花 ｶﾞｰﾃﾞﾆﾝｸﾞ DIY 商品 取り扱っ い d ﾎﾟｲﾝﾄ たまる つかえる
40,40,18周年 e-net shop Pet館～ペット館,https://www.rakuten.ne.jp/gold/dog-kan/,ペットシーツ・猫砂を送料無料で格安販売！業務用にもオススメ！犬猫フード・グッズ専門店 Pet館.,ﾍﾟｯﾄ ｼｰﾂ 猫砂 送料 無料 販売 業務 ｽｽﾒ 犬猫 ﾌｰﾄﾞ ｸﾞｯｽﾞ 専門 Pet
41,41,【セール】 PET PARADISE（ペットパラダイス）,https://shop.creativeyoko.co.jp/items?gc=1.4&bc=503&ptc=1.2.4,【セール】送料無料！PET PARADISE（ペットパラダイス） KIDS&OTHERS マザーガーデン＆ペットパラダイス。クリエイティブヨーコが運営する雑貨とペット用品の通販サイト。かわいいおもちゃ・雑貨・ペット用品がかんたんに見つかります。,ｾｰﾙ 送料 無料 PET PARADISE ﾍﾟｯﾄ ﾊﾟﾗﾀﾞｲｽ KIDS OTHERS ﾏｻﾞｰ ｶﾞｰﾃﾞﾝ ﾍﾟｯﾄ ﾊﾟﾗﾀﾞｲｽ ﾖｰｺ 運営 する 雑貨 ﾍﾟｯﾄ 通販 ｻｲﾄ かわいい おもちゃ 雑貨 ﾍﾟｯﾄ 見つかり
42,42,ドッグフード・キャットフード・ペットフードのペットライン,https://www.petline.co.jp/,ペットライン株式会社は、国内に研究開発センターと製造工場を持ち、愛犬・愛猫の健康を第一に考えた安心・安全なドッグフード・キャットフードをお届けするペットフードメーカーです。,ﾍﾟｯﾄ ﾗｲﾝ 株式 会社 国内 研究 開発 ｾﾝﾀｰ 製造 工場 持ち 愛犬 愛猫 健康 一 考え 安心 安全 ﾄﾞｯｸﾞﾌｰﾄﾞ･ｷｬｯﾄﾌｰﾄﾞ 届け する ﾍﾟｯﾄ ﾌｰﾄﾞ ﾒｰｶｰ
43,43,ペット｜ホームセンター通販 - カインズ,https://www.cainz.com/pet/,ワンちゃんとの暮らし. 犬と暮らす毎日を、もっと心地よく快適に。 ペットシーツやドッグフードなど、暮らしに欠かせないアイテムはもちろん、ワンちゃんにとって心地よさを追求したペットベットや、機能とデザインにこだわったペットウェアなど豊富な ...,暮らし 犬 暮らす 毎日 心地よく 快適 ﾍﾟｯﾄ ｼｰﾂ ﾄﾞｯｸﾞ ﾌｰﾄﾞ 暮らし 欠かせ ｱｲﾃﾑ ﾜﾝ とっ 心地よ 追求 し ﾍﾟｯﾄ ﾍﾞｯﾄ 機能 ﾃﾞｻﾞｲﾝ こだわっ ﾍﾟｯﾄ ｳｪｱ
44,44,ひだかペットクリニック｜知立市・刈谷市の動物病院,https://www.hidaka-pet-clinic.com/,知立市・刈谷市・豊田市・安城市の動物病院なら、ひだかペットクリニックへ。犬・猫の診療を中心に、各種診療にも対応しております。年間300件もの手術実績を持つ質の高い診療から、専用のお部屋を完備しているトリミングまで、ペットのお悩みに幅広く ...,知立 市 刈谷 市 豊田 市 安城 市 動物 病院 ひだ ﾍﾟｯﾄ ｸﾘﾆｯｸ 犬 猫 診療 中心 各種 診療 対応 し おり 年間 0 件 手術 実績 持つ 質 高い 診療 専用 部屋 完備 し いる ﾄﾘﾐﾝｸﾞ ﾍﾟｯﾄ 悩み 幅広く
45,45,ペットの輸出入：動物検疫所 - 農林水産省,https://www.maff.go.jp/aqs/animal/index.html,ペットの輸出入. 動物検疫は、動物の病気の侵入を防止するため世界各国で行われている検疫制度です。,ﾍﾟｯﾄ 輸出入 動物 検疫 動物 病気 侵入 防止 する ため 世界 各国 行わ いる 検疫 制度
46,46,ペット用品 その他通販 | ニトリネット【公式】,https://www.nitori-net.jp/ec/cat/Pet/PetOther/1/,"ペット2WAYトンネル(Nウォームi-nスター). 1,490円（税込）. 吸湿発熱であたたかい。 ペット用クッション(GY). 2,990円（税込）. 犬・猫の関節などの凸部分にかかる負担をサポートします。シニア犬・猫にもおすすめ. 食器スタンド 高さ調整.",ﾍﾟｯﾄ 0 WAY ﾄﾝﾈﾙ N ｳｫｰﾑ i n ｽﾀｰ 0 0 円 税込 吸湿 発熱 あたたかい ﾍﾟｯﾄ ｸｯｼｮﾝ GY 0 0 円 税込 犬 猫 関節 凸 部分 かかる 負担 ｻﾎﾟｰﾄ し ｼﾆｱ 猫 すすめ 食器 ｽﾀﾝﾄﾞ 高 調整
47,47,【公式】月々730円からのペット保険｜楽天ペット保険,https://www.rakuten-ssi.co.jp/,【月々730円からのペット保険！】楽天少額短期保険の公式サイト。楽天ペット保険「ずっといっしょ[もっと]」は保険料で楽天ポイントも貯まります。電話やネットでいつでも気軽に獣医師に相談できます。,月々 0 円 ﾍﾟｯﾄ 保険 楽天 少額 短期 保険 公式 ｻｲﾄ 楽天 ﾍﾟｯﾄ 保険 いっしょ 保険 楽天 ﾎﾟｲﾝﾄ 貯まり 電話 ﾈｯﾄ 医師 相談 でき
48,48,アース・ペット株式会社,https://www.earth-pet.co.jp/,アース・ペット株式会社は、ペットと人の快適な暮らしのお手伝いをします。ペットのノミ・害虫予防の他に愛犬のしつけ、猫のおしっこグッズ、バランス栄養ドリンク、犬猫用シャンプー、消臭剤、猫砂、水、おやつ等の各種ペット用品を開発、提供をしており ...,ｱｰｽ ﾍﾟｯﾄ 株式 会社 ﾍﾟｯﾄ 人 快適 暮らし 手伝い し ﾍﾟｯﾄ ﾉﾐ 害虫 予防 他 愛犬 しつけ 猫 おしっこ ｸﾞｯｽﾞ ﾊﾞﾗﾝｽ 栄養 ﾄﾞﾘﾝｸ 犬猫 ｼｬﾝﾌﾟｰ 消臭 猫砂 水 おやつ 各種 ﾍﾟｯﾄ 開発 提供 し おり
49,49,株式会社 ザ・ペット｜人と人、人とペットの幸せ創りを ...,https://the-pet.co.jp/,関西・関東を中心に展開するペット用品卸会社。株式会社ザ・ペット THE PET.,関西 関東 中心 展開 する ﾍﾟｯﾄ 卸 会社 株式 会社 ｻﾞ ﾍﾟｯﾄ THE PET
50,50,ペットエコ｜横浜·世田谷·多摩·仙台｜ペットの総合専門店,https://www.peteco.jp/,横浜、世田谷、多摩、仙台にあるペットの総合専門店、ペットエコです。大型店舗各店の最新情報が満載、話題集中充実のOnline Shop。ワンちゃん、ネコちゃん、小鳥、ウサギやハムスター、熱帯魚、金魚、川魚、水草、昆虫 、爬虫類、あらゆるペットにお応え ...,横浜 世田谷 多摩 仙台 ある ﾍﾟｯﾄ 総合 専門 ﾍﾟｯﾄ ｴｺ 大型 店舗 各店 最新 情報 満載 話題 集中 充実 Online Shop ﾜﾝ ﾈｺ 小鳥 ｳｻｷﾞ ﾊﾑｽﾀｰ 熱帯 金魚 川魚 水草 昆虫 爬虫 ﾍﾟｯﾄ 応え
51,51,ペット用品・ペットフード｜商品情報｜アイリスオーヤマ,https://www.irisohyama.co.jp/products/pet-supplies-pet-food,ペットシーツ／猫砂／サークル・ケージ・キャリー／犬舎／トイレ／フード などのペット関連用品はこちら.,ﾍﾟｯﾄ ｼｰﾂ 猫砂 ｻｰｸﾙ ｹｰｼﾞ ｷｬﾘｰ 犬舎 ﾄｲﾚ ﾌｰﾄﾞ ﾍﾟｯﾄ 関連
52,52,機内ペット同伴が可能に スターフライヤー、国内初 - 産経 ...,https://www.sankei.com/article/20210916-WIL65YN2EBJYPNWENFZ44EOYMA/,1 日前 — ペット同伴可のフライトは海外で広がりつつあるが、国内線では通常、手荷物として貨物室で運ぶ。検証フライトは羽田―北九州線で1日1往復し、ペット持ち込み時の課題や、周囲の乗客の反応を確認する。,0 前 ﾍﾟｯﾄ 同伴 可 ﾌﾗｲﾄ 海外 広がり ある 国内 通常 手 荷物 し 貨物 運ぶ 検証 ﾌﾗｲﾄ 羽田 北九州 0 0 往復 し ﾍﾟｯﾄ 持ち込み 時 課題 周囲 乗客 反応 確認 する
53,53,with pet - パナソニック ホームズ - Panasonic,https://homes.panasonic.com/common/with-pet/,パナソニック ホームズ（パナホーム）の、「ペットとの快適な暮らし」を紹介するサイト「with pet」。人にもペットにも心地よい家をご紹介いたします。,ﾊﾟﾅｿﾆｯｸ ﾎｰﾑｽﾞ ﾊﾟﾅ ﾎｰﾑ ﾍﾟｯﾄ 快適 暮らし 紹介 する ｻｲﾄ with pet 人 ﾍﾟｯﾄ 心地よい 家 紹介 いたし
54,54,PETSELECT ペットセレクト：大切なペットへ、ベビー品質の ...,https://petselect.jp/,コンセプト. ペットゲート・ペットサークルを選ぶなら. Pet Select. 安全はもちろんのことペットには快適な、オーナーに ...,ｺﾝｾﾌﾟﾄ ﾍﾟｯﾄ ｹﾞｰﾄ ﾍﾟｯﾄ ｻｰｸﾙ 選ぶ Pet Select 安全 こと ﾍﾟｯﾄ 快適 ｵｰﾅｰ
55,55,ペット家族動物病院,https://www.pet-kazoku-clinic.net/,ペット家族動物病院はご家族にとっての安心と信頼の獣医療の提供を大切にしています。,ﾍﾟｯﾄ 家族 動物 病院 家族 とっ 安心 信頼 医療 提供 し い
56,56,日本ペット共済,https://petlife.or.jp/,犬、ネコのペット共済は日本ペット共済にお任せ下さい。,犬 ﾈｺ ﾍﾟｯﾄ 共済 日本 ﾍﾟｯﾄ 共済 任せ 下さい
57,57,みんなのブリーダー - 優良ブリーダー直販の子犬販売サイト,https://www.min-breeder.com/,【成約数19万件突破】全国の優良ブリーダーから、かわいい子犬を安心価格で購入できる子犬販売サイトです。1ヶ月間の無料ペット保険・取引保証があるので安心！成約特典には、プレミアムフード・5000円分クーポンなどの充実した内容をご用意。,成約 数 0 万 件 突破 全国 ﾌﾞﾘｰﾀﾞｰ かわいい 子犬 安心 価格 購入 できる 子犬 販売 ｻｲﾄ 0 ヶ月 無料 ﾍﾟｯﾄ 保険 取引 保証 ある 安心 成約 特典 ﾌﾟﾚﾐｱﾑ ﾌｰﾄﾞ 0 円 分 ｸｰﾎﾟﾝ 充実 し 内容 用意
58,58,株式会社ジャパンペットコミュニケーションズ | 安心で幸せな ...,https://jpc-co.jp/,私たちはペットオーナーが安心して幸せに暮らしていくお手伝いを、ぺットショップや動物病院、トリミング、ペットホテル、安心安全なペットフードなどを通して、目に見える形にしてお届けします。,ﾍﾟｯﾄ ｵｰﾅｰ 安心 し 幸せ 暮らし いく 手伝い ｯﾄｼｮｯﾌﾟ 動物 病院 ﾄﾘﾐﾝｸﾞ ﾍﾟｯﾄ ﾎﾃﾙ 安心 安全 ﾍﾟｯﾄ ﾌｰﾄﾞ 通し 目 見える 形 し 届け し
59,59,日本ペットシッターサービス,https://www.pet-ss.com/,北海道から九州・沖縄まで全国チェーンで展開しているペットシッターサービスです。ペットシッター向け賠償責任保険に加入している身元の確実なペットシッターのみ登録されているので安心してご利用いただけます。無料でお近くのペットシッターをご紹介 ...,北海道 九州 沖縄 全国 ﾁｪｰﾝ 展開 し いる ﾍﾟｯﾄ ｼｯﾀｰ ｻｰﾋﾞｽ ﾍﾟｯﾄ ｼｯﾀｰ 賠償 責任 保険 加入 し いる 身元 ﾍﾟｯﾄ ｼｯﾀｰ 登録 さ いる 安心 し 利用 いただけ 無料 近く ﾍﾟｯﾄ ｼｯﾀｰ 紹介
60,60,大阪市内ペットシッター・旅行中のお世話、ペット介護の代行 ...,http://www.pet-miyakojima.com/,大阪市内を中心、ペットシッター「都島ナースケアセンター」では、旅行中のペットのお世話や、ペット介護、しつけ等を代行をしております。,大阪 市内 中心 ﾍﾟｯﾄ ｼｯﾀｰ 都島 ﾅｰｽ ｹｱ ｾﾝﾀｰ 旅行 ﾍﾟｯﾄ 世話 ﾍﾟｯﾄ 介護 しつけ 代行 し おり
61,61,ペットことならZOO オールペット界をリードする最高の ...,https://zoojapan.com/,ZOOは東京都内、新大久保・四谷・恵比寿・五反田・六本木・新宿・渋谷に店舗を構え、犬・猫・小動物・鳥・猛禽類・魚・爬虫類・両生類・昆虫、幅広いジャンルの動物のペット美容・ペットホテル・ペットシッター・しつけ・ペットセレモニーもお任せ！,ZOO 東京 都内 大久保 四谷 恵比寿 五反田 六本木 新宿 渋谷 店舗 構え 犬 猫 動物 鳥 猛禽 魚 爬虫 両生 昆虫 幅広い ｼﾞｬﾝﾙ 動物 ﾍﾟｯﾄ 美容 ﾍﾟｯﾄ ﾎﾃﾙ ﾍﾟｯﾄ ｼｯﾀｰ しつけ ﾍﾟｯﾄ ｾﾚﾓﾆｰ 任せ
62,62,機内ペット同伴サービス（仮称）の検証フライト実施,https://travel.watch.impress.co.jp/docs/news/1351707.html,24 時間前 — 空港内および機内ではペットはケージから出せず、また餌を与えることも不可。 対象便. 10月1日： SFJ76便（北九州09時00分発～羽田10時35分着 ...,0 時間 前 空港 機内 ﾍﾟｯﾄ ｹｰｼﾞ 出せ 餌 与える こと 不可 対象 便 0 月 0 SFJ 0 便 北九州 0 時 0 羽田 0 時 0 分 着
63,63,ペット手帳 | あなたとペットに安心の毎日を,https://pet-techo.com/,ペット手帳は動物病院の先生や専門家と一緒にあなたとペットに安心の毎日をお届けするスマホサービスです。ワンちゃん、ネコちゃんの成長や季節に合わせた今週のコラム、お手入れ・しつけ動画、健康記録、ペットQ&A、今日のおともだちなど多彩な機能や ...,ﾍﾟｯﾄ 手帳 動物 病院 先生 専門 一緒 ﾍﾟｯﾄ 安心 毎日 届け する ｽﾏﾎｻｰﾋﾞｽ ﾜﾝ ﾈｺ 成長 季節 合わせ 今週 ｺﾗﾑ 手入れ しつけ 動画 健康 記録 ﾍﾟｯﾄ Q A 今日 ともだち 機能
64,64,ペットイベント みんな大好き!!ペット王国（ペット ... - 大阪市,https://pet-oukoku.jp/,みんな大好き!!ペット王国は京セラドーム大阪で毎年ゴールデンウィーク（GW）に開催されるペットイベントです。犬、猫、小動物、爬虫類、昆虫、観賞魚、鳥などがドームに大集合。今年もペット王国に行こう！,みんな ﾍﾟｯﾄ 王国 京ｾﾗ ﾄﾞｰﾑ 大阪 毎年 ｺﾞｰﾙﾃﾞﾝ ｳｨｰｸ GW 開催 さ ﾍﾟｯﾄ ｲﾍﾞﾝﾄ 犬 猫 動物 爬虫 昆虫 観賞 鳥 ﾄﾞｰﾑ 集合 今年 ﾍﾟｯﾄ 王国 行こう
65,65,ペットの防災（クルマに関する注意喚起） - JAF,https://jaf.or.jp/common/attention/pet,ペットと一緒に避難するには、災害に対する普段からの備えが必要です。ペット用フードや水などの備蓄はもちろん、住まいの自治体の取り決めをあらかじめ確認し、家族で対処方法を話し合っておきましょう。避難所では、他の避難者に迷惑をかけない配慮も ...,ﾍﾟｯﾄ 一緒 避難 する 災害 対する 普段 備え 必要 ﾍﾟｯﾄ ﾌｰﾄﾞ 水 備蓄 住まい 自治 体 取り決め 確認 し 家族 対処 方法 話し合っ おき 避難 他 避難 迷惑 かけ 配慮
66,66,大阪府大阪市平野区のペットショップ/ペット用品 - NAVITIME,https://www.navitime.co.jp/category/0508001/27126/,大阪府大阪市平野区のペットショップ/ペット用品をご紹介。ひごペットフレンドリー 瓜破店やペットハウスONEワンイオン長吉店などの住所や地図、電話番号や営業時間、サービス内容など詳細情報もご確認頂けます。地域やカテゴリを絞って検索も可能です。,大阪 府 大阪 市 平野 区 ﾍﾟｯﾄ ｼｮｯﾌﾟ ﾍﾟｯﾄ 紹介 ひご ﾍﾟｯﾄ 瓜破 ﾍﾟｯﾄ ﾊｳｽ ONE ﾜﾝ ｲｵﾝ 長吉 住所 地図 電話 番号 営業 時間 ｻｰﾋﾞｽ 内容 詳細 情報 確認 頂け 地域 ｶﾃｺﾞﾘ 絞っ 検索
67,67,PETボトルリサイクル推進協議会,https://www.petbottle-rec.gr.jp/,PETボトルリサイクル推奨マーク認定基準における基準配合率の説明修正に伴い、申請書・申請書記入例を更新しました。 2021年04月27日. 統計データ「PETボトルの再商品 ...,PET ﾎﾞﾄﾙ ﾘｻｲｸﾙ 推奨 ﾏｰｸ 認定 基準 おけ 基準 配合 率 説明 修正 伴い 申請 申請 記入 例 更新 し 0 年 0 月 0 統計 ﾃﾞｰﾀ PET ﾎﾞﾄﾙ 商品
68,68,スターフライヤー「ペット同伴サービス」が注目される理由。,https://tabiris.com/archives/starflyer-pet/,10 時間前 — 中堅航空会社のスターフライヤーが、国内の定期便にペットを持ち込めるサービスの導入を検討すると発表しました。導入を目指して検証フライトを行います。 広告 検証フライトを実施 スターフライヤーは、国内の定期便にペットを持ち込 […],0 時間 前 中堅 航空 会社 ｽﾀｰ ﾌﾗｲﾔｰ 国内 定期 便 ﾍﾟｯﾄ 持ち込める ｻｰﾋﾞｽ 導入 検討 する 発表 し 導入 目指し 検証 ﾌﾗｲﾄ 行い 広告 検証 ﾌﾗｲﾄ 実施 ｽﾀｰ ﾌﾗｲﾔｰ 国内 定期 便 ﾍﾟｯﾄ 持ち
69,69,PET-CTとは - 国立国際医療研究センター病院,http://www.hosp.ncgm.go.jp/s037/010/010/pet.html,PETでは全身のがんなどを一度に調べることが出来る. PETとは、positron emission tomography （陽電子放出断層撮影） の略で、放射能を含む薬剤を用いる、核医学検査 ...,PET 全身 がん 一 度 調べる こと 出来る PET positron emission tomography 陽 電子 放出 断層 撮影 略 放射 能 含む 薬剤 用いる 核 医学 検査
70,70,スターフライヤー 客室にペット持ち込めるサービス導入へ,https://www3.nhk.or.jp/news/html/20210916/k10013262011000.html,1 日前 — 北九州市に本社がある航空会社「スターフライヤー」は、新型コロナウイルスの影響で搭乗率が落ち込む中、新たな利用客の獲得をねらって、来年にも客室にペットを持ち込めるサービスを導入する方針を固めました。実現すれば国内の定期便 ...,0 前 北九州 市 本社 ある 航空 会社 ｽﾀｰ ﾌﾗｲﾔｰ 新型 ｺﾛﾅ ｳｲﾙｽ 影響 搭乗 率 落ち込む 中 利用 客 獲得 ねらっ 来年 客室 ﾍﾟｯﾄ 持ち込める ｻｰﾋﾞｽ 導入 する 方針 固め 実現 すれ 国内 定期 便
71,71,ペットスタイル 大国町店 - 大阪市浪速区 - EPARKペットライフ,https://petlife.asia/salon/6501/,EPARKペットライフ掲載中のペットスタイル 大国町店(大阪府大阪市浪速区)の写真・施術料金・口コミ・予約受入状況を紹介。簡単に電話/Web予約可能施設情報です。 評価: 5 · ‎2 件のレビュー,EPARK ﾍﾟｯﾄ ﾗｲﾌ 掲載 ﾍﾟｯﾄ ｽﾀｲﾙ 大国 町 大阪 府 大阪 市 浪速 区 写真 施術 料金 口ｺﾐ 予約 受入 状況 紹介 電話 Web 予約 施設 情報 評価 0 0 件 ﾚﾋﾞｭｰ
72,72,愛知県一宮市の動物病院 きそがわペットクリニック,https://www.kisogawa-pc.com/,一宮市の動物病院きそがわペットクリニックのご案内.,一宮 市 動物 病院 がわ ﾍﾟｯﾄ ｸﾘﾆｯｸ 案内
73,73,ペット保険(犬・猫)のペット＆ファミリー損保【公式】 | T&D ...,https://www.petfamilyins.co.jp/,ペット保険のペット＆ファミリー損保(T＆D保険グループ)公式サイト。犬・猫のペット保険「げんきナンバーわん」「げんきナンバーわんスリム」を展開。家族であるペットに安心をお届け。,ﾍﾟｯﾄ 保険 ﾍﾟｯﾄ ﾌｧﾐﾘｰ 損保 T D 保険 ｸﾞﾙｰﾌﾟ 公式 ｻｲﾄ 犬 猫 ﾍﾟｯﾄ 保険 げんき ﾅﾝﾊﾞｰ わん げんき ﾅﾝﾊﾞｰ わん 展開 家族 ある ﾍﾟｯﾄ 安心 届け
74,74,ミミクリーペット｜スペシャルサイト｜タカラトミーアーツ,https://www.takaratomy-arts.co.jp/specials/mimicry/,話しかけるとノリノリのアクションと共にあなたのコトバを何でもマネしておしゃべりするぬいぐるみ『ミミクリーペット』の公式サイトです。,話しかける ｱｸｼｮﾝ 共 ｺﾄﾊﾞ ﾏﾈ し しゃべり する ぬいぐるみ ﾐﾐｸﾘｰ ﾍﾟｯﾄ 公式 ｻｲﾄ
75,75,業界初、初回ケガ全額補償のペット保険はイーペット少額短期 ...,https://www.e-pet.co.jp/,イーペット少額短期保険株式会社のe-ペット70は、業界初の初回ケガ全額補償！安心・充実補償のペット保険です。,ｲｰ ﾍﾟｯﾄ 少額 短期 保険 株式 会社 e ﾍﾟｯﾄ 0 業界 初 初回 ｹｶﾞ 全額 補償 安心 充実 補償 ﾍﾟｯﾄ 保険
76,76,トリミング ペットホテルのPET-SPA｜西武ペットケア,http://www.pet-spa.co.jp/,株式会社西武ペットケアの運営するトリミングサロン PET-SPA（ペットスパ）。東京、神奈川、埼玉などの首都圏を中心に店舗を展開しています。トリミングやペットホテルなどのケアに加えて、トリマーと獣医師の連携によって、ペットの健康維持もサポート ...,株式 会社 西武 ﾍﾟｯﾄ ｹｱ 運営 する ﾄﾘﾐﾝｸﾞ ｻﾛﾝ PET SPA ﾍﾟｯﾄ ｽﾊﾟ 東京 神奈川 埼玉 首都 中心 店舗 展開 し い ﾄﾘﾐﾝｸﾞ ﾍﾟｯﾄ ﾎﾃﾙ ｹｱ 加え ﾄﾘﾏｰ 医師 連携 よっ ﾍﾟｯﾄ 健康 維持 ｻﾎﾟｰﾄ
77,77,ペット総合通販サイトPETEMOオンラインストア「しあわせも ...,https://shop.petemo.jp/,イオンペットが運営するペット専門の総合通販サイト。ごはんやトイレ用品、アパレルなど、ペットライフに必要なものが揃います。ペットに関する幅広いサービスを通じて、お客さまとペットとの幸せなライフスタイルをサポートします。,ｲｵﾝ ﾍﾟｯﾄ 運営 する ﾍﾟｯﾄ 専門 総合 通販 ｻｲﾄ ごはん ﾄｲﾚ ｱﾊﾟﾚﾙ ﾍﾟｯﾄ ﾗｲﾌ 必要 もの 揃い ﾍﾟｯﾄ 関する 幅広い ｻｰﾋﾞｽ 通じ 客 ﾍﾟｯﾄ 幸せ ﾗｲﾌｽﾀｲﾙ ｻﾎﾟｰﾄ し
78,78,Life with Pet ～ペットと人の健やかな毎日のために～ |エラン ...,https://jp.mypetandi.com/,バイエル薬品が提供、犬・猫の病気予防、健康管理のための情報発信サイト。ノミ・マダニ・フィラリア・回虫・条虫などの寄生虫駆除・予防対策、細菌感染症の情報などをご覧いただけます。,ﾊﾞｲｴﾙ 薬品 提供 犬 猫 病気 予防 健康 管理 ため 情報 発信 ｻｲﾄ ﾉﾐ ﾏﾀﾞﾆ ﾌｨﾗﾘｱ 回虫 条虫 寄生 駆除 予防 対策 細菌 感染 情報 ご覧 いただけ
