,Unnamed: 0,site_name,URL,snippet,target
0,0,ペット - Wikipedia,https://ja.wikipedia.org/wiki/%E3%83%9A%E3%83%83%E3%83%88,ペットは、人の心を和ませたり楽しませてくれる、といった理由で飼われる動物である。人はペットとの様々なやり取りを楽しんだり、その姿や鳴き声などを鑑賞したりする。 ペットは生命をもった ...‎Category:ペット · ‎ペットロス症候群 · ‎ペット・ロック · ‎ペット供養,ﾍﾟｯﾄ 人 心 和ま 楽しま くれる いっ 理由 飼わ 動物 ある 人 ﾍﾟｯﾄ やり取り 楽しん 姿 鳴き声 鑑賞 し する ﾍﾟｯﾄ 生命 もっ Category ﾍﾟｯﾄ ﾍﾟｯﾄ ﾛｽ 症候 群 ﾍﾟｯﾄ ﾛｯｸ ﾍﾟｯﾄ 供養
1,1,人気ランキング | ペットショップのコジマ,https://pets-kojima.com/ranking/,子犬や子猫などのペットの販売専門店ペットショップコジマオフィシャルサイト。人気のダックスフント、チワワ、トイ・プードルなどの犬、アメリカンショートヘア、スコティッシュフォールド、アビシニアンなどの猫、ハムスター、ウサギなどの小動物を紹介 ...‎ハーフ・MIX犬の子犬たち · ‎柴犬 · ‎トイ・プードル · ‎ビション・フリーゼ,子犬 子猫 ﾍﾟｯﾄ 販売 専門 ﾍﾟｯﾄｼｮｯﾌﾟｺｼﾞﾏｵﾌｨｼｬﾙｻｲﾄ 人気 ﾀﾞｯｸｽﾌﾝﾄ ﾁﾜﾜ ﾄｲ ﾌﾟｰﾄﾞﾙ 犬 ｱﾒﾘｶﾝ ｼｮｰﾄ ﾍｱ ｽｺﾃｨｯｼｭﾌｫｰﾙﾄﾞ ｱﾋﾞｼﾆｱﾝ 猫 ﾊﾑｽﾀｰ ｳｻｷﾞ 動物 紹介 ﾊｰﾌ MIX 犬 子犬 柴犬 ﾄｲ ﾌﾟｰﾄﾞﾙ ﾋﾞｼｮﾝ ﾌﾘｰ
2,2,人気ランキング | ペットショップのコジマ,https://pets-kojima.com/ranking/,子犬や子猫などのペットの販売専門店ペットショップコジマオフィシャルサイト。人気のダックスフント、チワワ、トイ・プードルなどの犬、アメリカンショートヘア、スコティッシュフォールド、アビシニアンなどの猫、ハムスター、ウサギなどの小動物を紹介 ...‎ハーフ・MIX犬の子犬たち · ‎柴犬 · ‎トイ・プードル · ‎ビション・フリーゼ,子犬 子猫 ﾍﾟｯﾄ 販売 専門 ﾍﾟｯﾄｼｮｯﾌﾟｺｼﾞﾏｵﾌｨｼｬﾙｻｲﾄ 人気 ﾀﾞｯｸｽﾌﾝﾄ ﾁﾜﾜ ﾄｲ ﾌﾟｰﾄﾞﾙ 犬 ｱﾒﾘｶﾝ ｼｮｰﾄ ﾍｱ ｽｺﾃｨｯｼｭﾌｫｰﾙﾄﾞ ｱﾋﾞｼﾆｱﾝ 猫 ﾊﾑｽﾀｰ ｳｻｷﾞ 動物 紹介 ﾊｰﾌ MIX 犬 子犬 柴犬 ﾄｲ ﾌﾟｰﾄﾞﾙ ﾋﾞｼｮﾝ ﾌﾘｰ
3,3,ペットショップのコジマ,https://pets-kojima.com/,子犬や子猫などのペットの販売専門店、ペットショップのコジマです。東京都内をはじめ、全国にペットショップを展開しています。ペットと人との素敵なライフスタイル創りをお手伝いします。,子犬 子猫 ﾍﾟｯﾄ 販売 専門 ﾍﾟｯﾄ ｼｮｯﾌﾟ ｺｼﾞﾏ 東京 都内 はじめ 全国 ﾍﾟｯﾄ ｼｮｯﾌﾟ 展開 し い ﾍﾟｯﾄ 人 ﾗｲﾌｽﾀｲﾙ 創り 手伝い し
4,4,ペットの里親募集情報 :: ペットのおうち【月間利用者150万人 ...,https://www.pet-home.jp/,「ペットのおうち」は全国のペット里親募集情報サイトです。飼い主が止むを得ず手放さないといけないペットや保護活動者が保護しているペットなどの里親募集情報が全国から届きます。里親になりたいと考えている方と飼い主を探すペットの出会いの場 ...,ﾍﾟｯﾄ うち 全国 ﾍﾟｯﾄ 里親 募集 情報 ｻｲﾄ 飼い主 止む 得 手放さ いけ ﾍﾟｯﾄ 保護 活動 保護 し いる ﾍﾟｯﾄ 里親 募集 情報 全国 届き 里親 なり 考え いる 方 飼い主 探す ﾍﾟｯﾄ 出会い 場
5,5,ペットショップ「Coo＆RIKU」｜全国に200店舗以上,https://www.pet-coo.com/,一人でも多くの方にワンちゃんネコちゃんと暮らす幸せを」をモットーに、全国に店舗を展開するペットショップ「Coo＆RIKU」のホームページです。ワンちゃんネコちゃんの画像・動画を多数公開中。出産情報・生命保障制度・各店舗情報もご覧いただけます。,一人 多く 方 ﾜﾝ ﾈｺ 暮らす 幸せ ﾓｯﾄｰ 全国 店舗 展開 する ﾍﾟｯﾄ ｼｮｯﾌﾟ Coo RIKU ﾎｰﾑ ﾍﾟｰｼﾞ ﾜﾝ ﾈｺ 画像 動画 多数 公開 出産 情報 生命 保障 制度 店舗 情報 ご覧 いただけ
6,6,ペットについて（総合） - 大阪市,https://www.city.osaka.lg.jp/kenko/page/0000007325.html,ペットについて（総合）. 2020年12月2日. ページ番号：7325. あなたのペットは他人に迷惑をかけていませんか？ルールとマナーを守り、動物の適正な管理を心がけましょう。 犬の登録 · 狂犬病予防注射 · 愛犬の登録と狂犬病予防注射 · 飼い犬が死んだ ...,ﾍﾟｯﾄ つい 総合 0 年 0 月 0 ﾍﾟｰｼﾞ 番号 0 ﾍﾟｯﾄ 他人 迷惑 かけ い ﾙｰﾙ ﾏﾅｰ 守り 動物 管理 心がけ 犬 登録 狂犬 予防 注射 愛犬 登録 狂犬 予防 注射 飼い犬 死ん
7,7,ペットについて（総合） - 大阪市,https://www.city.osaka.lg.jp/kenko/page/0000007325.html,ペットについて（総合）. 2020年12月2日. ページ番号：7325. あなたのペットは他人に迷惑をかけていませんか？ルールとマナーを守り、動物の適正な管理を心がけましょう。 犬の登録 · 狂犬病予防注射 · 愛犬の登録と狂犬病予防注射 · 飼い犬が死んだ ...,ﾍﾟｯﾄ つい 総合 0 年 0 月 0 ﾍﾟｰｼﾞ 番号 0 ﾍﾟｯﾄ 他人 迷惑 かけ い ﾙｰﾙ ﾏﾅｰ 守り 動物 管理 心がけ 犬 登録 狂犬 予防 注射 愛犬 登録 狂犬 予防 注射 飼い犬 死ん
8,8,子犬・子猫専門ペットショップはPetPlus（ペットプラス）,https://www.ahb.jpn.com/,PetPlus（ペットプラス）のホームページへようこそ。全国でペットショップを運営している株式会社AHBの子犬・子猫の販売サイトです。毎日新着のワンちゃん・ネコちゃんを掲載しています.,PetPlus ﾍﾟｯﾄ ﾌﾟﾗｽ ﾎｰﾑ ﾍﾟｰｼﾞ よう 全国 ﾍﾟｯﾄ ｼｮｯﾌﾟ 運営 し いる 株式 会社 AHB 子犬 子猫 販売 ｻｲﾄ 毎日 新着 ﾜﾝ ﾈｺ 掲載 し い
9,9,ペット検索 - 犬の家&猫の里,https://dognoie.com/pet/,"トップ; ペット検索. よく見られている子. こだわり検索. ペットの種類で絞り込む. すべて ワンちゃん ネコちゃん. さらにこだわって検索. 店舗名. こだわらない, 豊川インター店, 愛知刈谷店, 春日井本店, MEGAドン・キホーテ東海名和店, イオン小牧店 ...",ﾄｯﾌﾟ ﾍﾟｯﾄ 検索 見 いる 子 こだわり 検索 ﾍﾟｯﾄ 種類 絞り込む すべて ﾜﾝ ﾈｺ こだわっ 検索 店舗 名 こだわら 豊川 ｲﾝﾀｰ 愛知 刈谷 春日井 本店 MEGA ﾄﾞﾝ ｷﾎｰﾃ 東海 名和 ｲｵﾝ 小牧
10,10,ペット宿ドットコム,https://petyado.com/,ペット宿ドットコム公式ホームページ。ペットと泊まれる宿・犬と泊まれる宿・犬と宿泊できるペット宿を紹介しているpet宿.com ペット宿.com（ペット宿ドットコム）。温泉旅館・ペンション・ホテルなどを紹介するペットと旅行するための総合情報サイトです ...,ﾍﾟｯﾄ 宿 ﾄﾞｯﾄ ｺﾑ 公式 ﾎｰﾑ ﾍﾟｰｼﾞ ﾍﾟｯﾄ 泊まれる 宿 犬 泊まれる 宿 犬 宿泊 できる ﾍﾟｯﾄ 宿 紹介 し いる pet 宿 com ﾍﾟｯﾄ 宿 com ﾍﾟｯﾄ 宿 ﾄﾞｯﾄ ｺﾑ 温泉 旅館 ﾍﾟﾝｼｮﾝ ﾎﾃﾙ 紹介 する ﾍﾟｯﾄ 旅行 する ため 総合 情報 ｻｲﾄ
11,11,TVアニメ・舞台「pet」公式サイト,https://pet-anime.com/,三宅乱丈『ペット リマスター・エディション』（ビームコミックス／KADOKAWA刊）がアニメ化＆舞台化。アニメはTOKYO MX 毎週月曜22:00～BS11、AT-Xほかにて 2020年1月6日(月)より好評放送中 Amazon Prime Video にて日本・海外独占配信！,三宅 乱 丈 ﾍﾟｯﾄ ﾘﾏｽﾀｰ ｴﾃﾞｨｼｮﾝ ﾋﾞｰﾑ ｺﾐｯｸｽ KADOKAWA ｱﾆﾒ 舞台 ｱﾆﾒ TOKYO MX 毎週 月曜 0 0 BS 0 AT X ほか 0 年 0 月 0 月 好評 放送 Amazon Prime Video 日本 海外 独占 配信
12,12,「ペット」の検索結果 - 【楽天市場】ジャンルトップ一覧 ...,https://search.rakuten.co.jp/search/mall/%E3%83%9A%E3%83%83%E3%83%88/,楽天市場-「ペット」3763556件 人気の商品を価格比較・ランキング･レビュー・口コミで検討できます。ご購入でポイント取得がお得。セール商品・送料無料商品も多数。「あす楽」なら翌日お届けも可能です。,楽天 市場 ﾍﾟｯﾄ 0 件 人気 商品 価格 比較 ﾗﾝｷﾝｸﾞ ﾚﾋﾞｭｰ 口ｺﾐ 検討 でき 購入 ﾎﾟｲﾝﾄ 取得 得 ｾｰﾙ 商品 送料 無料 商品 多数 あす 楽 翌日 届け
13,13,大阪会場・HOME | Pet博,http://www.pethaku.com/osaka/,1994年に大阪で始まった国内最大級のペットとペット関連用品の総合イベント。毎年かわいいペット、珍しいペットの展示や、ペットフード・関連グッズ・関連サービスなど多くの企業の出展ブースとともに、ペットファンが楽しめるイベントやコーナーも多数 ...会 場： インテックス大阪4号館; 大阪市住之江区南...入 場 料（ 予 定 ）-->： 【 大 人（中学生以上） 】 前売...会 期： 2021年9月18日（土）～20日（月・祝）; 10：...お 問 合 せ： Pet博運営事務局 〒540-8519 大阪...,0 年 大阪 始まっ 国内 最大 ﾍﾟｯﾄ ﾍﾟｯﾄ 関連 総合 ｲﾍﾞﾝﾄ 毎年 かわいい ﾍﾟｯﾄ 珍しい ﾍﾟｯﾄ 展示 ﾍﾟｯﾄ ﾌｰﾄﾞ 関連 ｸﾞｯｽﾞ 関連 ｻｰﾋﾞｽ 多く 企業 出展 ﾌﾞｰｽ とも ﾍﾟｯﾄ ﾌｧﾝ 楽しめる ｲﾍﾞﾝﾄ ｺｰﾅｰ 多数 会 ｲﾝ ﾃｯｸｽ 大阪 0 号 大阪 市 住之江 区 南 入 人 中学 以上 前売 会 期 0 年 0 月 0 土 0 月 祝 0 問 Pet 運営 事務 局 0 0 大阪
14,14,ペットショップのワンラブ 写真と動画でご紹介,https://www.pet-onelove.com/,子犬や子猫などのペットの販売専門店。ペットショップディーラーワンラブグループは、全国1都1道2府36県で160店舗を展開する信頼と安心の総合ペットショップ。常時5000頭以上の可愛い子犬達や、子猫達が皆様のご来店をお待ち致しております。店舗： お選びください愛知県――全部 ├ 星崎店 ├ ...毛質： お選びくださいスムース【短毛】スムースコー...価格帯： お選びください セールの子 ～5万円未満 ...表示順： お選びください 安い順 生後順 新着順,子犬 子猫 ﾍﾟｯﾄ 販売 専門 ﾍﾟｯﾄｼｮｯﾌﾟﾃﾞｨｰﾗｰﾜﾝﾗﾌﾞｸﾞﾙｰﾌﾟ 全国 0 都 0 道 0 府 0 県 0 店舗 展開 する 信頼 安心 総合 ﾍﾟｯﾄ ｼｮｯﾌﾟ 常時 0 以上 可愛い 子犬 子猫 皆 来店 待ち 致し おり 店舗 選び ください 愛知 県 全部 星崎 毛質 選び ください 短毛 価格 選び ください ｾｰﾙ 子 0 万 円 未満 表示 順 選び ください 安い 順 生後 順 着順
15,15,ペットワールド アミーゴ,https://amigo-pet.co.jp/,ペット専門店アミーゴオフィシャルサイト。わんちゃん、ねこちゃんを中心に、小動物、鳥、爬虫類、昆虫、熱帯魚まで扱う総合ペットショップ。ペットフード、ペット用品の販売、トリミング、ペットホテルも充実。全国展開中（中国、四国、関西、東海、 ...,ﾍﾟｯﾄ 専門 ｱﾐｰｺﾞ ｻｲﾄ ねこ 中心 動物 鳥 爬虫 昆虫 熱帯 扱う 総合 ﾍﾟｯﾄ ｼｮｯﾌﾟ ﾍﾟｯﾄ ﾌｰﾄﾞ ﾍﾟｯﾄ 販売 ﾄﾘﾐﾝｸﾞ ﾍﾟｯﾄ ﾎﾃﾙ 充実 全国 展開 中国 四国 関西 東海
16,16,ペット・動物 | 東大阪市,http://www.city.higashiosaka.lg.jp/category/14-9-0-0-0.html,ペット・動物. 飼い犬・飼い猫・メジロなどに関すること ... 用リーフレット) [2021年3月30日]; 放し飼いは絶対にダメ！(啓発用リーフレット) [2021年3月30日]; 登録と狂犬病予防注射・災害からペットを守るために(啓発用リーフレット) [2021年3月30日] ...,ﾍﾟｯﾄ 動物 飼い犬 飼い猫 ﾒｼﾞﾛ 関する こと 用 ﾘｰﾌﾚｯﾄ 0 年 0 月 0 放し飼い 絶対 ﾀﾞﾒ 啓発 ﾘｰﾌﾚｯﾄ 0 年 0 月 0 登録 狂犬 予防 注射 災害 ﾍﾟｯﾄ 守る ため 啓発 ﾘｰﾌﾚｯﾄ 0 年 0 月 0
17,17,ペットショップ ケン & ワン | 大阪府堺市を中心に全国に展開 ...,http://www.ken-one.net/,ペットショップ「ケン＆ワン」は大阪府堺市を中心に全国に展開し地域No.1を目指しています。かわいいワンちゃんやネコちゃんを多数取り揃えておりますので、ぜひ会いに来て下さい。,ﾍﾟｯﾄ ｼｮｯﾌﾟ ｹﾝ ﾜﾝ 大阪 府 堺 市 中心 全国 展開 し 地域 No 0 目指し い かわいい ﾜﾝ ﾈｺ 多数 取り揃え おり 会い 来 下さい
18,18,ペット : 作品情報 - 映画.com,https://eiga.com/movie/82613/,2016/08/11 — ペットの作品情報。上映スケジュール、映画レビュー、予告動画。「ミニオンズ」のイルミネーション・エンターテインメントとユニバーサル・スタジオがタッグを組んだ長編アニメーションで... 評価: 3.3 · ‎200 件のレビュー,0 0 0 ﾍﾟｯﾄ 作品 情報 上映 ｽｹｼﾞｭｰﾙ 映画 ﾚﾋﾞｭｰ 予告 動画 ﾐﾆ ｵﾝｽﾞ ｲﾙﾐﾈｰｼｮﾝ ｴﾝﾀｰﾃｲﾝﾒﾝﾄ ｽﾀｼﾞｵ ﾀｯｸﾞ 組ん 長編 ｱﾆﾒｰｼｮﾝ 評価 0 0 0 件 ﾚﾋﾞｭｰ
19,19,ペット用品の通販サイト ペピイ（PEPPY）,https://www.peppynet.com/,ペット用品の通販サイト ペピイ（PEPPY）公式HP【スマホ対応】。ドッグフード・キャットフードをはじめとしたペット用品通販やペットのお役立ち情報、ペットの施設検索など、ペットの総合情報サイトです。,ﾍﾟｯﾄ 通販 ｻｲﾄ ﾍﾟﾋﾟｲ PEPPY 公式 HP ｽﾏﾎ 対応 ﾄﾞｯｸﾞﾌｰﾄﾞ･ｷｬｯﾄﾌｰﾄﾞ はじめ し ﾍﾟｯﾄ 通販 ﾍﾟｯﾄ 役立ち 情報 ﾍﾟｯﾄ 施設 検索 ﾍﾟｯﾄ 総合 情報 ｻｲﾄ
20,20,【公式】埼玉のペット火葬・葬儀・納骨なら武蔵野ペット霊園,https://www.musashinopetreien.com/,武蔵野ペット霊園公式ホームページ。埼玉のペット火葬・葬儀・納骨・供養。小動物～大型犬まで対応した1975年創業の伝統あるペット霊園。他所にて火葬されたご遺骨もお預かり（納骨のみも可）。ペット霊園についてご不明なことは何なりとご相談ください。,武蔵野 ﾍﾟｯﾄ 霊園 公式 ﾎｰﾑ ﾍﾟｰｼﾞ 埼玉 ﾍﾟｯﾄ 火葬 葬儀 納骨 供養 動物 大型 対応 し 0 年 創業 伝統 ある ﾍﾟｯﾄ 霊園 他所 火葬 さ 遺骨 預かり 納骨 可 ﾍﾟｯﾄ 霊園 つい 不明 こと 相談 ください
21,21,ペットフード ペット用品 | Amazon | アマゾン,https://www.amazon.co.jp/%E3%83%9A%E3%83%83%E3%83%88%E3%83%95%E3%83%BC%E3%83%89-%E3%83%9A%E3%83%83%E3%83%88%E7%94%A8%E5%93%81/b?ie=UTF8&node=2127212051,ペットフード・ペット用品ならAmazon.co.jp。ドッグフード、キャットフード、猫砂、ペットシートなどの重たい、かさばるものもご自宅までお届け。ケージ、首輪なども豊富。配送料無料(一部除く)。,ﾍﾟｯﾄ ﾌｰﾄﾞ ﾍﾟｯﾄ Amazon co jp ﾄﾞｯｸﾞ ﾌｰﾄﾞ ｷｬｯﾄ ﾌｰﾄﾞ 猫砂 ﾍﾟｯﾄ ｼｰﾄ 重たい かさばる もの 自宅 届け ｹｰｼﾞ 首輪 配送 無料 一部 除く
22,22,イオンペット [AEON PET],https://www.aeonpet.com/,イオンペットは、動物と人間の幸せな共生社会の実現を目指します。ペットフード、ペット用品の販売のほか、トリミングサロン、ペットホテル、動物病院、しつけ教室他、ライフハウスなどを運営しております。,ｲｵﾝ ﾍﾟｯﾄ 動物 人間 幸せ 共生 社会 実現 目指し ﾍﾟｯﾄ ﾌｰﾄﾞ ﾍﾟｯﾄ 販売 ほか ﾄﾘﾐﾝｸﾞ ｻﾛﾝ ﾍﾟｯﾄ ﾎﾃﾙ 動物 病院 しつけ 教室 他 ﾗｲﾌ ﾊｳｽ 運営 し おり
23,23,ペット情報｜総合ペットショップ[PET FOREST] - ペット ...,http://www.petforest.co.jp/pet/,宇都宮インターパーク店とてもおしとやかな性格の白柴ちゃんがやって参りました♡. 詳細を見る. MIX犬 ミックス犬（トイプードル×チワワ）. 宇都宮インターパーク店お父さんがトイプードルでお母さんがチワワのミックス犬です♪.,宇都宮 ｲﾝﾀｰ ﾊﾟｰｸ 性格 白 柴 やっ 参り 詳細 見る MIX ﾐｯｸｽ ﾄｲ ﾌﾟｰﾄﾞﾙ ﾁﾜﾜ 宇都宮 ｲﾝﾀｰ ﾊﾟｰｸ 父 ﾄｲ ﾌﾟｰﾄﾞﾙ 母 ﾁﾜﾜ ﾐｯｸｽ
24,24,ペット - Y!きっず図鑑,https://kids.yahoo.co.jp/zukan/pet/,Yahoo!きっず図鑑の「ペット図鑑」だよ。犬や猫、金魚やハムスターなど、かわいいペットたちの特徴や飼い方を調べてみよう！ Yahoo!きっず図鑑は無料で使えるマルチメディア図鑑です。,Yahoo きっ 図鑑 ﾍﾟｯﾄ 図鑑 犬 猫 金魚 ﾊﾑｽﾀｰ かわいい ﾍﾟｯﾄ 特徴 飼い 調べ みよう Yahoo きっ 図鑑 無料 使える ﾏﾙﾁﾒﾃﾞｨｱ 図鑑
25,25,ペット - Y!きっず図鑑,https://kids.yahoo.co.jp/zukan/pet/,Yahoo!きっず図鑑の「ペット図鑑」だよ。犬や猫、金魚やハムスターなど、かわいいペットたちの特徴や飼い方を調べてみよう！ Yahoo!きっず図鑑は無料で使えるマルチメディア図鑑です。,Yahoo きっ 図鑑 ﾍﾟｯﾄ 図鑑 犬 猫 金魚 ﾊﾑｽﾀｰ かわいい ﾍﾟｯﾄ 特徴 飼い 調べ みよう Yahoo きっ 図鑑 無料 使える ﾏﾙﾁﾒﾃﾞｨｱ 図鑑
26,26,ペット | 通販・価格比較・製品情報,https://kakaku.com/pet/,ペットを買うなら、まずは価格.comペットをチェック！ 全国の通販サイトの販売価格情報をはじめ、スペック検索、クチコミ情報、ランキングなど、さまざまな視点から商品を比較・検討できます！,ﾍﾟｯﾄ 買う 価格 com ﾍﾟｯﾄ ﾁｪｯｸ 全国 通販 ｻｲﾄ 販売 価格 情報 はじめ ｽﾍﾟｯｸ 検索 ｸﾁｺﾐ 情報 ﾗﾝｷﾝｸﾞ 視点 商品 比較 検討 でき
27,27,ペットショップ P's-first  ペットを最優先に考えます,https://pfirst.jp/,ペットショップ P's-first（ペッツファースト／ピーズファースト)は子犬子猫専門ペットショップです。様々な種類の子犬や子猫達からお気に入りのペットを見つけてください。,ﾍﾟｯﾄ ｼｮｯﾌﾟ P s first ﾍﾟｯﾂﾌｧｰｽﾄ ﾋﾟｰｽﾞ ﾌｧｰｽﾄ 子犬 子猫 専門 ﾍﾟｯﾄ ｼｮｯﾌﾟ 種類 子犬 子猫 気 入り ﾍﾟｯﾄ 見つけ ください
28,28,ペットと泊まれる宿 - じゃらんnet,https://www.jalan.net/pet/,愛犬・ペットと一緒に泊まれる宿特集。わんちゃんに嬉しいサービスも充実！おすすめのお遊びスポットや、一緒に旅行する時のノウハウも紹介。大切なペットと泊まれる好みの宿を見つけてさっそく出かけましょ！,愛犬 ﾍﾟｯﾄ 一緒 泊まれる 宿 特集 嬉しい ｻｰﾋﾞｽ 充実 すすめ 遊び ｽﾎﾟｯﾄ 一緒 旅行 する 時 ﾉｳﾊｳ 紹介 ﾍﾟｯﾄ 泊まれる 好み 宿 見つけ 出かけ
29,29,ペット用品の通販 - アイリスプラザ,https://www.irisplaza.co.jp/index.php?KB=KAISO&CID=6,アイリスオーヤマの公式通販サイト【アイリスプラザ】の園芸ペット専門店・ペット一覧ページです。お客様のライフスタイルに合わせた各種園芸ペット専門店・ペットを多数ご紹介しております！標準順1ページ目6.,ｱｲﾘｽ ｵｰﾔﾏ 公式 通販 ｻｲﾄ ｱｲﾘｽ ﾌﾟﾗｻﾞ 園芸 ﾍﾟｯﾄ 専門 ﾍﾟｯﾄ 一覧 ﾍﾟｰｼﾞ 客 ﾗｲﾌｽﾀｲﾙ 合わせ 各種 園芸 ﾍﾟｯﾄ 専門 ﾍﾟｯﾄ 多数 紹介 し おり 標準 順 0 ﾍﾟｰｼﾞ 0
30,30,環境省_飼い主の方やこれからペットを飼う方へ [動物の愛護と ...,https://www.env.go.jp/nature/dobutsu/aigo/pickup/owner.html,ペットを飼う前に、ほんとうに飼い続けられるか、家族みんなで話し合いましょう。 そして、飼うことを決めたら、どこから手に入れるかよく考えましょう。方法としては、ペットショップやブリーダーから購入する ...,ﾍﾟｯﾄ 飼う 前 ほんとう 飼い 続け 家族 みんな 話し合い 飼う こと 決め 手 入れる 考え 方法 し ﾍﾟｯﾄ ｼｮｯﾌﾟ ﾌﾞﾘｰﾀﾞｰ 購入 する
31,31,ホーム＆キッチン・ペット 通販【全品無料配達】 - ヨドバシ,https://www.yodobashi.com/category/162842/,ホーム＆キッチン・ペットの通販ならヨドバシカメラの公式サイト「ヨドバシ.com」で！キッチン用品・食器やペットフード・ペット用品など人気の商品を多数取り揃えています。ご購入でゴールドポイント取得！今なら日本全国へ全品配達料金無料、即日・翌日 ...,ﾎｰﾑ ｷｯﾁﾝ ﾍﾟｯﾄ 通販 ﾖﾄﾞﾊﾞｼ ｶﾒﾗ 公式 ｻｲﾄ ﾖﾄﾞﾊﾞｼ com ｷｯﾁﾝ 食器 ﾍﾟｯﾄ ﾌｰﾄﾞ ﾍﾟｯﾄ 人気 商品 多数 取り揃え い 購入 ｺﾞｰﾙﾄﾞ ﾎﾟｲﾝﾄ 取得 今 日本 全国 全品 配達 料金 無料 即日 翌日
32,32,犬・猫のペット保険ならアイペット損保【23個のNo.1受賞】,https://www.ipet-ins.com/,ペット保険のアイペット損保公式サイト。全国すべての動物病院で利用可能。日々の通院から高額になりがちな手術まで充実補償。新規加入は12歳11か月まで。年齢が不明な場合は獣医師による推定年齢で加入OK！高年齢層の保険料が一律だから保険料を抑えられ ...・ペット保険のポイント： ・ペット保険申込書の記入例・重要事項説明書： ・返信用封筒,ﾍﾟｯﾄ 保険 ｱｲ ﾍﾟｯﾄ 損保 公式 ｻｲﾄ 全国 すべて 動物 病院 利用 日々 通院 高額 なり 手術 充実 補償 加入 0 0 か月 年齢 不明 場合 医師 よる 推定 年齢 加入 OK 年齢 層 保険 一律 保険 抑え ﾍﾟｯﾄ 保険 ﾎﾟｲﾝﾄ ﾍﾟｯﾄ 保険 申込 記入 例 事項 説明 返信 封筒
33,33,ペット大好き！｜ペット大好き！,https://www.petoffice.co.jp/,ワールドペットニュース. 配達員が荷物を届けた家の猫を盗む. 2021.09.17. 配達員が荷物を届けた家の猫を盗む · 首に心臓をもつ子ヤギ。小さな命を守る夫妻との温かい. 2021.09.15. 首に心臓をもつ子ヤギ。小さな命を守る夫妻との温かい絆.,ﾜｰﾙﾄﾞ ﾍﾟｯﾄ ﾆｭｰｽ 配達 荷物 届け 家 猫 盗む 0 0 0 配達 荷物 届け 家 猫 盗む 首 心臓 もつ 子ﾔｷﾞ 命 守る 夫妻 温かい 0 0 0 首 心臓 もつ 子ﾔｷﾞ 命 守る 夫妻 温かい 絆
34,34,『ペット2』2019.12.4[Wed] リリース - NBCユニバーサル ...,https://www.nbcuni.co.jp/movie/sp/pets2/,『ペット2』2019.12.4[Wed] リリース. 商品ページ · HOME. 『ペット2』2019.12.4[Wed] リリース. ご購入はこちら. amazon; HMV ONLINE; セブンネットショッピング; 楽天ブックス; TSUTAYA. NBCユニバーサル アジア. 141K subscribers.2019/12/04 · アップロード元: NBCユニバーサル アジア,ﾍﾟｯﾄ 0 0 0 0 Wed ﾘﾘｰｽ 商品 ﾍﾟｰｼﾞ HOME ﾍﾟｯﾄ 0 0 0 0 Wed ﾘﾘｰｽ 購入 amazon HMV ONLINE ｾﾌﾞﾝ ﾈｯﾄ ｼｮｯﾋﾟﾝｸﾞ 楽天 ﾌﾞｯｸｽ TSUTAYA NBC ｱｼﾞｱ 0 K subscribers 0 0 0 ｱｯﾌﾟﾛｰﾄﾞ 元 NBC ｱｼﾞｱ
35,35,保険料かんたんお見積り - ペット保険 | SBIいきいき少額短期保険,https://www.i-sedai.com/pet/apply/estimate.html,SBIいきいき少額短期保険の「ペット保険」保険料をかんたんお見積り！SBIいきいき少額短期保険「ペット保険」の保険料は業界最安水準、11歳11か月までお申し込み可能です。小型犬・3歳・プラン50ライトなら月々たったの650円！さらにWEB割引なら保険料は ...,SBI 少額 短期 保険 ﾍﾟｯﾄ 保険 保険 見積り 少額 短期 保険 ﾍﾟｯﾄ 保険 保険 業界 最安 水準 0 0 か月 申し込み 小型 0 ﾌﾟﾗﾝ 0 ﾗｲﾄ 月々 0 円 WEB 割引 保険
