,Unnamed: 0,site_name,URL,snippet,target
79,79,近畿一円 ペットショップ ひごペットフレンドリー 大阪、兵庫 ...,https://www.higopet.com/sp/,龍魚祭り. 金魚祭り. 街のPayPay祭. フロアブログ告知. トリミングブログ告知. ペットホテル早割企画. 奈良パワーシティ店9月度イベント. 前へ; 次へ. 新着ペット; ペット検索; 人気のペット. いぬ; ねこ; アクア; 小動物・鳥; は虫類・両生類・昆虫 ...; マルチーズ： ; ミックス; スムース・チワワ： ; トイ・プードル; ミニチュア・ダックスフンド・ロングヘアー： ; ヨーク...; イタリアン・グレーハウンド： ; ウェルシュ・コーギー...,龍 祭り 金魚 祭り 街 PayPay 祭 ﾌﾛｱ ﾌﾞﾛｸﾞ 告知 ﾄﾘﾐﾝｸﾞ ﾌﾞﾛｸﾞ 告知 ﾍﾟｯﾄ ﾎﾃﾙ 早 企画 奈良 ﾊﾟﾜｰ ｼﾃｨ 0 月 度 ｲﾍﾞﾝﾄ 前 次 新着 ﾍﾟｯﾄ ﾍﾟｯﾄ 検索 人気 ﾍﾟｯﾄ いぬ ねこ ｱｸｱ 動物 鳥 は虫 両生 昆虫 ﾏﾙﾁｰｽﾞ ﾐｯｸｽ ﾁﾜﾜ ﾄｲ ﾌﾟｰﾄﾞﾙ ﾐﾆﾁｭｱ ﾀﾞｯｸｽﾌﾝﾄﾞ ﾛﾝｸﾞﾍｱ ﾖｰｸ ｲﾀﾘｱﾝ ｸﾞﾚｰﾊｳﾝﾄﾞ ｳｪﾙｼｭ ｺｰｷﾞｰ
80,80,プレゼントペット（PRESENT PETS） - タカラトミー,https://www.takaratomy.co.jp/products/presentpets/,あなたに会うために、かわいいペットが自分で箱から出てきちゃう！？箱から出てくるあまえんぼ「プレゼントペット（PRESENT PETS）」が新登場♪ フワフワなわんことの素敵な出会いが待ってるよ！お世話やゲームも！,会う ため かわいい ﾍﾟｯﾄ 自分 箱 出 き 箱 出 くる ﾌﾟﾚｾﾞﾝﾄ ﾍﾟｯﾄ PRESENT PETS 登場 なわ こと 出会い 待っ 世話 ｹﾞｰﾑ
81,81,アニムペットクリニック | 文京区・豊島区・千代田区 | 年中 ...,https://www.anim-pc.com/,文京区白山の犬猫の総合動物病院。ペットの健康管理はもちろん、病気の治療にもご家族の参加が必要です。私たちがそのお手伝いをするとき、ご家族との信頼関係が大切だと感じています。そのためにも納得していただける説明、インフォームドコンセントを ...,文京 区 白山 犬猫 総合 動物 病院 ﾍﾟｯﾄ 健康 管理 病気 治療 家族 参加 必要 手伝い する とき 家族 信頼 関係 感じ い ため 納得 し いただける 説明 ｲﾝﾌｫｰﾑﾄﾞ ｺﾝｾﾝﾄ
82,82,いなばペットフード株式会社,https://www.inaba-petfood.co.jp/,いなばペットフード株式会社 | ドッグフード/キャットフード（代表商品：チャオ＜CIAO＞）を販売するペットフードメーカーです。犬用、猫用のペットフード（缶詰、健康食品、レトルトパウチなど）のご紹介.,いなば ﾍﾟｯﾄ ﾌｰﾄﾞ 株式 会社 ﾄﾞｯｸﾞﾌｰﾄﾞ ｷｬｯﾄ ﾌｰﾄﾞ 代表 商品 ﾁｬｵ CIAO 販売 する ﾍﾟｯﾄ ﾌｰﾄﾞ ﾒｰｶｰ 犬 猫 ﾍﾟｯﾄ ﾌｰﾄﾞ 缶詰 健康 食品 ﾚﾄﾙﾄ ﾊﾟｳﾁ 紹介
83,83,ペットアドバンス,https://petsadvance.jp/,ペットアドバンスは、ペットと人とのより良い共生をテーマにコトを提案する、ピカコーポレイションの新ブランドです。犬や猫などのペット用品やペット業界の方々に安心で安全な製品を提供してまいります。,ﾍﾟｯﾄ ｱﾄﾞﾊﾞﾝｽ ﾍﾟｯﾄ 人 良い 共生 ﾃｰﾏ ｺﾄ 提案 する ｺｰﾎﾟﾚｲｼｮﾝ ﾌﾞﾗﾝﾄﾞ 犬 猫 ﾍﾟｯﾄ ﾍﾟｯﾄ 方々 安心 安全 製品 提供 し まいり
84,84,PET DESIGN natural care,https://petdesign.jp/,PET LIST最新のワンちゃん ねこちゃん. 一覧を見る · アリオ上尾店 ... PET DESIGN 春日井店. 愛知県春日井市東野町3丁目3番7号. トリミング; ペットホテル; グッズ販売. お店のブログ · のFacebookページを表示する; のInstagram公式アカウントページを ...,PET LIST 最新 ﾜﾝ ねこ 一覧 見る ｱﾘｵ 上尾 PET DESIGN 春日井 愛知 県 春日井 市 東野 町 0 丁目 0 番 0 号 ﾄﾘﾐﾝｸﾞ ﾍﾟｯﾄ ﾎﾃﾙ ｸﾞｯｽﾞ 販売 店 ﾌﾞﾛｸﾞ Facebook ﾍﾟｰｼﾞ 表示 する Instagram 公式 ｱｶｳﾝﾄ ﾍﾟｰｼﾞ
85,85,DCMカーマのペット情報館,https://www.dcm-hc.co.jp/kahma/petshop/,DCMカーマのペットショップ. DCMカーマサイトへ · DCM · HOME · 店舗情報 · キャンペーン・イベント情報 · イチオシ商品 · 動物病院. カワイイペット達がいっぱい！DCMカーマのペット情報館. 犬 · 猫 · アクア・小動物 · 各種サービスメニュー ...,DCM ｶｰﾏ ﾍﾟｯﾄ ｼｮｯﾌﾟ DCM ｶｰﾏ ｻｲﾄ DCM HOME 店舗 情報 ｷｬﾝﾍﾟｰﾝ ｲﾍﾞﾝﾄ 情報 ｲﾁｵｼ 商品 動物 病院 ｶﾜｲｲ ﾍﾟｯﾄ いっぱい DCM ｶｰﾏ ﾍﾟｯﾄ 情報 犬 猫 ｱｸｱ 動物 各種 ｻｰﾋﾞｽ ﾒﾆｭｰ
86,86,一般社団法人日本ペット用品工業会,http://www.jppma.or.jp/,HOME · 団体概要 · 事業内容 · 会員企業・賛助会員企業 · 消費者様向けQ&A · 会員ページ · お問い合わせ · JP · EN. 2021適合品証; ペット用品産業実態調査について; ペット用品取扱士検定試験 ...,HOME 団体 概要 事業 内容 会員 企業 賛助 会員 企業 消費 Q A 会員 ﾍﾟｰｼﾞ 問い合わせ JP EN 0 適合 ﾍﾟｯﾄ 産業 実態 調査 つい ﾍﾟｯﾄ 取扱 検定 試験
87,87,西武グループ ペットスマイルプロジェクト  SEIBU GROUP,https://www.seibuholdings.co.jp/pet-smile/,西武グループでは、ペットと楽しめるひとときを大切にするため、「ペットと一緒」がもっと楽しくなるペットスマイルプロジェクトを展開してまいります。,西武 ｸﾞﾙｰﾌﾟ ﾍﾟｯﾄ 楽しめる ひととき する ため ﾍﾟｯﾄ 一緒 楽しく なる ﾍﾟｯﾄ ｽﾏｲﾙ ﾌﾟﾛｼﾞｪｸﾄ 展開 し まいり
88,88,みんなのペット健康専門店 - 安心・安全にこだわった ...,https://www.min-petkenko.com/,すべてのワンちゃん・ネコちゃんが健康でいられるように、安心・安全にこだわったロイヤルカナンなどのドッグフード・キャットフード・ペット用品の通販ショップです。,すべて ﾜﾝ ﾈｺ 健康 い 安心 安全 こだわっ ﾛｲﾔﾙ ｶﾅﾝ ﾄﾞｯｸﾞﾌｰﾄﾞ･ｷｬｯﾄﾌｰﾄﾞ･ﾍﾟｯﾄ 通販 ｼｮｯﾌﾟ
89,89,日本ペットランド,http://www.pet-land.co.jp/,京都ペット葬儀社・滋賀ペット葬儀社の日本ペットランド京都・滋賀のペット葬儀、琵琶湖動物霊園、草津・栗東セレモニーホール、心塔ペット火葬、ペット納骨、ペット霊園、ペット供養のことなら日本ペットランドまで。,京都 ﾍﾟｯﾄ 葬儀 社 滋賀 ﾍﾟｯﾄ 葬儀 社 日本 ﾍﾟｯﾄ ﾗﾝﾄﾞ 京都 滋賀 ﾍﾟｯﾄ 葬儀 琵琶 動物 霊園 草津 栗東 ｾﾚﾓﾆｰ ﾎｰﾙ 塔 ﾍﾟｯﾄ 火葬 ﾍﾟｯﾄ 納骨 ﾍﾟｯﾄ 霊園 ﾍﾟｯﾄ 供養 こと 日本 ﾍﾟｯﾄ ﾗﾝﾄﾞ
90,90,【法蓮ペットクリニック】奈良市法蓮町の動物病院,http://www.horen-pet.com/,【法蓮ペットクリニック】奈良市法蓮町の動物病院｜奈良市｜木津川市｜奈良市法蓮町の動物病院。法蓮ペットクリニックはホームドクターとしてみなさまの大切なペットをケアします。木津川市からも近く。トリミング・ペットホテル併設。,法蓮 ﾍﾟｯﾄ ｸﾘﾆｯｸ 奈良 市 法 蓮町 動物 病院 奈良 市 木津 川 市 奈良 市 法 蓮町 動物 病院 法蓮 ﾍﾟｯﾄ ｸﾘﾆｯｸ ﾎｰﾑ ﾄﾞｸﾀｰ し みな ﾍﾟｯﾄ ｹｱ し 木津 川 市 近く ﾄﾘﾐﾝｸﾞ ﾍﾟｯﾄ ﾎﾃﾙ 併設
91,91,ペット家族 公式サイト | ペットショップ・動物病院・ペット ...,https://www.pet-kazoku.net/,ペットショップや動物病院、ペットホテルも併設！動物たちが楽しく過ごすための環境を整えたペット家族の総合サイト。,ﾍﾟｯﾄ ｼｮｯﾌﾟ 動物 病院 ﾍﾟｯﾄ ﾎﾃﾙ 併設 動物 楽しく 過ごす ため 環境 整え ﾍﾟｯﾄ 家族 総合 ｻｲﾄ
92,92,ペットフード - FAMIC - 独立行政法人農林水産消費安全技術 ...,http://www.famic.go.jp/ffis/pet/,"ペットフードの製造・輸入業者の皆様（製造・輸入業者届出関係）, 各地方農政局・支局等 詳細はこちら ... ペットフード安全法に関するQ＆A(農林水産省); 愛がん動物用飼料の安全性の確保に関する法律（ペットフード安全法）に関する事業者 ...ペットの飼い主の皆様： 各地方環境事務所 詳細は...",ﾍﾟｯﾄ ﾌｰﾄﾞ 製造 輸入 皆 製造 輸入 届出 関係 地方 農政 局 支局 詳細 ﾍﾟｯﾄ ﾌｰﾄﾞ 安全 法 関する Q A 農林 水産 愛がん 動物 飼料 安全 確保 関する 法律 ﾍﾟｯﾄ ﾌｰﾄﾞ 安全 法 関する 事業 ﾍﾟｯﾄ 飼い主 皆 地方 環境 事務 詳細
93,93,ペットゴー（petgo）＜公式＞｜犬猫の療法食、医薬品 ...,https://www.petgo.jp/,ペットゴーは食事療法食、総合栄養食、動物用医薬品、サプリメントなどを取り扱うペットヘルスケア通販サイトです。ハッピーペットライフ・ハッピーワールドのスローガンのもと、ペットのQOL向上に貢献していきます。,ﾍﾟｯﾄ ｺﾞｰ 食事 療法 食 総合 栄養 食 動物 医薬 ｻﾌﾟﾘﾒﾝﾄ 取り扱う ﾍﾟｯﾄ ﾍﾙｽｹｱ 通販 ｻｲﾄ ﾍﾟｯﾄ ﾗｲﾌ ﾜｰﾙﾄﾞ ｽﾛｰｶﾞﾝ もと ﾍﾟｯﾄ QOL 向上 貢献 し いき
94,94,クラブアイペット,https://www.ipetclub.jp/connect/,クラブアイペットは、ペットとのライフスタイルやお得なクーポン情報を「ごほうび」としてお届けするWEBマガジンです。,ｸﾗﾌﾞ ｱｲ ﾍﾟｯﾄ ﾍﾟｯﾄ ﾗｲﾌｽﾀｲﾙ 得 ｸｰﾎﾟﾝ 情報 ほうび し 届け する WEB ﾏｶﾞｼﾞﾝ
95,95,横浜市の動物病院｜洋光台ペットクリニック,https://www.youkoudai-pet.com/,神奈川県横浜市磯子区。洋光台駅から徒歩5分の動物病院。動物と飼い主がもっとも良い関係でいられるような治療を目指しています。トリミング・ペットホテル・避妊手術・去勢手術・ワクチン・予防接種対応。診察対象は犬・猫・ウサギ・ハムスター・ ...,神奈川 県 横浜 市 磯子 区 洋 光台 駅 徒歩 0 動物 病院 動物 飼い主 良い 関係 い 治療 目指し い ﾄﾘﾐﾝｸﾞ ﾍﾟｯﾄ ﾎﾃﾙ 避妊 手術 去勢 手術 ﾜｸﾁﾝ 予防 接種 対応 診察 対象 犬 猫 ｳｻｷﾞ ﾊﾑｽﾀｰ
96,96,犬・猫のペット保険ならFPC｜お手頃な保険料・充実の補償内容,https://www.fpc-pet.co.jp/,ペット保険を提供する株式会社FPC公式サイト。犬・猫の通院・入院・手術を手厚く補償し、充実の補償内容とお手頃な保険料で評価されています。全国の動物病院対応でネット申込、資料請求も可能。,ﾍﾟｯﾄ 保険 提供 する 株式 会社 FPC 公式 ｻｲﾄ 犬 猫 通院 入院 手術 手厚く 補償 し 充実 補償 内容 保険 評価 さ い 全国 動物 病院 対応 ﾈｯﾄ 申込 資料 請求
97,97,沖縄の動物病院なら【牧港ペットクリニック】,https://makiminatopet-clinic.jp/,沖縄県浦添市にある牧港ペットクリニックです。大切なパートナーの・幸せに寄り添う動物病院を目指します！,沖縄 県 浦添 市 ある 牧 ﾍﾟｯﾄ ｸﾘﾆｯｸ ﾊﾟｰﾄﾅｰ 幸せ 寄り添う 動物 病院 目指し
98,98,ペットの専門店コジマ通信販売オンライン - PET-SHOP.JP,https://pet-shop.jp/kojima/,ペットの専門店コジマが提供する犬・猫・小動物・鳥類などの、ペットフードやペット用品を専門に販売するショッピングサイトです。,ﾍﾟｯﾄ 専門 ｺｼﾞﾏ 提供 する 犬 猫 動物 鳥類 ﾍﾟｯﾄ ﾌｰﾄﾞ ﾍﾟｯﾄ 専門 販売 する ｼｮｯﾋﾟﾝｸﾞ ｻｲﾄ
