,keyword,site_name,URL,snippet,ranking,target
44,ペット,大阪会場・HOME | Pet博,http://www.pethaku.com/osaka/,1994年に大阪で始まった国内最大級のペットとペット関連用品の総合イベント。毎年かわいいペット、珍しいペットの展示や、ペットフード・関連グッズ・関連サービスなど ...会 期： 2021年9月18日（土）～20日（月・祝）; 10：...入 場 料（ 予 定 ）-->： 【 大 人（中学生以上） 】 前売...会 場： インテックス大阪4号館; 大阪市住之江区南...お 問 合 せ： Pet博運営事務局 〒540-8519 大阪...,45,0 年 大阪 始まっ 国内 最大 ﾍﾟｯﾄ ﾍﾟｯﾄ 関連 総合 ｲﾍﾞﾝﾄ 毎年 かわいい ﾍﾟｯﾄ 珍しい ﾍﾟｯﾄ 展示 ﾍﾟｯﾄ ﾌｰﾄﾞ 関連 ｸﾞｯｽﾞ 関連 ｻｰﾋﾞｽ 会 期 0 年 0 月 0 土 0 月 祝 0 入 人 中学 以上 前売 会 ｲﾝ ﾃｯｸｽ 大阪 0 号 大阪 市 住之江 区 南 問 Pet 運営 事務 局 0 0 大阪
45,ペット,ペットエコ｜横浜·世田谷·多摩·仙台｜ペットの総合専門店,https://www.peteco.jp/,横浜、世田谷、多摩、仙台にあるペットの総合専門店、ペットエコです。大型店舗各店の最新情報が満載、話題集中充実のOnline Shop。ワンちゃん、ネコちゃん、小鳥、 ...,46,横浜 世田谷 多摩 仙台 ある ﾍﾟｯﾄ 総合 専門 ﾍﾟｯﾄ ｴｺ 大型 店舗 各店 最新 情報 満載 話題 集中 充実 Online Shop ﾜﾝ ﾈｺ 小鳥
46,ペット,家族のいる風景 with ペット - パナソニック ホームズ - Panasonic,https://homes.panasonic.com/common/with-pet/,パナソニック ホームズ（パナホーム）の、「ペットとの快適な暮らし」を紹介するサイト「with pet」。人にもペットにも心地よい家をご紹介いたします。,47,ﾊﾟﾅｿﾆｯｸ ﾎｰﾑｽﾞ ﾊﾟﾅ ﾎｰﾑ ﾍﾟｯﾄ 快適 暮らし 紹介 する ｻｲﾄ with pet 人 ﾍﾟｯﾄ 心地よい 家 紹介 いたし
47,ペット,港区の賃貸 「ペット可(相談可)物件特集」 - アットホーム,https://www.athome.co.jp/chintai/theme/pet/tokyo/minato-city/list/,港区でペット可・ペット相談可の賃貸物件一覧。賃貸・不動産の情報サイト「アットホーム」なら、家賃や間取りなどご希望にぴったりの賃貸物件が簡単に検索できます。,48,港 区 ﾍﾟｯﾄ 可 ﾍﾟｯﾄ 相談 可 賃貸 物件 一覧 賃貸 動産 情報 ｻｲﾄ ｱｯﾄ ﾎｰﾑ 家賃 間取り 希望 賃貸 物件 検索 でき
48,ペット,ペットの輸出入：動物検疫所 - 農林水産省,https://www.maff.go.jp/aqs/animal/index.html,ペットの輸出入. 動物検疫は、動物の病気の侵入を防止するため世界各国で行われている検疫制度です。,49,ﾍﾟｯﾄ 輸出入 動物 検疫 動物 病気 侵入 防止 する ため 世界 各国 行わ いる 検疫 制度
49,ペット,ペット用品・ペットフード｜商品情報｜アイリスオーヤマ,https://www.irisohyama.co.jp/products/pet-supplies-pet-food,ペットシーツ／猫砂／サークル・ケージ・キャリー／犬舎／トイレ／フード などのペット関連用品はこちら.,50,ﾍﾟｯﾄ ｼｰﾂ 猫砂 ｻｰｸﾙ ｹｰｼﾞ ｷｬﾘｰ 犬舎 ﾄｲﾚ ﾌｰﾄﾞ ﾍﾟｯﾄ 関連
50,ペット,｢ペット｣業界がコロナ後も強いと言えるワケ - 東洋経済 ...,https://toyokeizai.net/articles/-/452427,2021/09/04 — ペットフード協会によれば、2020年の新規の飼育頭数は犬が46.2万頭（前年比14％増）、猫が48.3万頭（同16％増）と増加傾向にある 。 最近、オスで0歳の ...,51,0 0 0 ﾍﾟｯﾄ ﾌｰﾄﾞ 協会 よれ 0 年 飼育 頭数 犬 0 0 万 前年 比 0 % 増 猫 0 0 万 同 0 % 増 増加 傾向 ある 最近 ｵｽ 0
51,ペット,ペットことならZOO オールペット界をリードする最高の ...,https://zoojapan.com/,ZOOは東京都内、新大久保・四谷・恵比寿・五反田・六本木・新宿・渋谷に店舗を構え、犬・猫・小動物・鳥・猛禽類・魚・爬虫類・両生類・昆虫、幅広いジャンルの動物の ...,52,ZOO 東京 都内 大久保 四谷 恵比寿 五反田 六本木 新宿 渋谷 店舗 構え 犬 猫 動物 鳥 猛禽 魚 爬虫 両生 昆虫 幅広い ｼﾞｬﾝﾙ 動物
52,ペット,ひだかペットクリニック｜知立市・刈谷市の動物病院,https://www.hidaka-pet-clinic.com/,知立市・刈谷市・豊田市・安城市の動物病院なら、ひだかペットクリニックへ。犬・猫の診療を中心に、各種診療にも対応しております。年間300件もの手術実績を持つ質の ...,53,知立 市 刈谷 市 豊田 市 安城 市 動物 病院 ひだ ﾍﾟｯﾄ ｸﾘﾆｯｸ 犬 猫 診療 中心 各種 診療 対応 し おり 年間 0 件 手術 実績 持つ 質
53,ペット,ペットホテル 港区のペットホテル 送迎有 犬預かり港区 ... - 東京,https://harutomana.com/,ペットホテル 港区のペットホテル 送迎有 犬のしつけ教室 子犬トイレトレーニング 子犬預かり港区でのペット預かりホテル Haru to Mana。港区のペットホテル、犬の ...,54,ﾍﾟｯﾄ ﾎﾃﾙ 区 ﾍﾟｯﾄ ﾎﾃﾙ 送迎 有 しつけ 教室 子犬 ﾄｲﾚ ﾄﾚｰﾆﾝｸﾞ 子犬 預かり 港 区 ﾍﾟｯﾄ 預かり ﾎﾃﾙ Haru to Mana 港 区 ﾍﾟｯﾄ ﾎﾃﾙ 犬
54,ペット,株式会社ジャパンペットコミュニケーションズ | 安心で幸せな ...,https://jpc-co.jp/,私たちはペットオーナーが安心して幸せに暮らしていくお手伝いを、ぺットショップや動物病院、トリミング、ペットホテル、安心安全なペットフードなどを通して、目に ...,55,ﾍﾟｯﾄ ｵｰﾅｰ 安心 し 幸せ 暮らし いく 手伝い ｯﾄｼｮｯﾌﾟ 動物 病院 ﾄﾘﾐﾝｸﾞ ﾍﾟｯﾄ ﾎﾃﾙ 安心 安全 ﾍﾟｯﾄ ﾌｰﾄﾞ 通し 目
55,ペット,ペット用品 その他通販 | ニトリネット【公式】,https://www.nitori-net.jp/ec/cat/Pet/PetOther/1/,ニトリのペット用品 その他です。クッション、ステップ、マットなど豊富に取り揃えています。 全65件 ...,56,ﾆﾄﾘ ﾍﾟｯﾄ 他 ｸｯｼｮﾝ ｽﾃｯﾌﾟ ﾏｯﾄ 取り揃え い 0 件
56,ペット,株式会社 ザ・ペット｜人と人、人とペットの幸せ創りを ...,https://the-pet.co.jp/,関西・関東を中心に展開するペット用品卸会社。株式会社ザ・ペット THE PET.,57,関西 関東 中心 展開 する ﾍﾟｯﾄ 卸 会社 株式 会社 ｻﾞ ﾍﾟｯﾄ THE PET
57,ペット,ペットゴー（petgo）＜公式＞｜犬猫の療法食、医薬品 ...,https://www.petgo.jp/,ペットゴーは食事療法食、総合栄養食、動物用医薬品、サプリメントなどを取り扱うペットヘルスケア通販サイトです。ハッピーペットライフ・ハッピーワールドの ...,58,ﾍﾟｯﾄ ｺﾞｰ 食事 療法 食 総合 栄養 食 動物 医薬 ｻﾌﾟﾘﾒﾝﾄ 取り扱う ﾍﾟｯﾄ ﾍﾙｽｹｱ 通販 ｻｲﾄ ﾍﾟｯﾄ ﾗｲﾌ ﾜｰﾙﾄﾞ
58,ペット,ペット可・相談で探す東京都港区の中古マンション購入情報,https://suumo.jp/ms/chuko/tokyo/sc_minato/nj_127/,【SUUMO(スーモ)中古マンション】東京都港区の人気条件「ペット可・相談」の中古マンション一覧です。中古マンションの最新販売情報が満載。ご希望の間取りでの ...,59,SUUMO ｽｰﾓ 中古 ﾏﾝｼｮﾝ 東京 都 港 区 人気 条件 ﾍﾟｯﾄ 可 相談 中古 ﾏﾝｼｮﾝ 一覧 中古 ﾏﾝｼｮﾝ 最新 販売 情報 満載 希望 間取り
59,ペット,ペット家族動物病院,https://www.pet-kazoku-clinic.net/,ペット家族動物病院はご家族にとっての安心と信頼の獣医療の提供を大切にしています。,60,ﾍﾟｯﾄ 家族 動物 病院 家族 とっ 安心 信頼 医療 提供 し い
60,ペット,保険料 | ペットの保険 | auの損害ほけん,https://www.au.com/finance/nonlife-insurance/pet/charge/,「ペットの保険」は、愛犬・愛猫の高額になりがちな治療費を補償します！！ あなたのワンちゃん、ネコちゃんは？？ まずは、保険料をチェック. ペットの種類と年齢を ...,61,ﾍﾟｯﾄ 保険 愛犬 愛猫 高額 なり 治療 補償 し ﾜﾝ ﾈｺ 保険 ﾁｪｯｸ ﾍﾟｯﾄ 種類 年齢
61,ペット,日本ペットシッターサービス,https://www.pet-ss.com/,北海道から九州・沖縄まで全国チェーンで展開しているペットシッターサービスです。ペットシッター向け賠償責任保険に加入している身元の確実なペットシッターのみ登録 ...,62,北海道 九州 沖縄 全国 ﾁｪｰﾝ 展開 し いる ﾍﾟｯﾄ ｼｯﾀｰ ｻｰﾋﾞｽ ﾍﾟｯﾄ ｼｯﾀｰ 賠償 責任 保険 加入 し いる 身元 ﾍﾟｯﾄ ｼｯﾀｰ 登録
62,ペット,PETSELECT ペットセレクト：大切なペットへ、ベビー品質の ...,https://petselect.jp/,コンセプト. ペットゲート・ペットサークルを選ぶなら. Pet Select. 安全はもちろんのことペットには快適な、オーナーに ...,63,ｺﾝｾﾌﾟﾄ ﾍﾟｯﾄ ｹﾞｰﾄ ﾍﾟｯﾄ ｻｰｸﾙ 選ぶ Pet Select 安全 こと ﾍﾟｯﾄ 快適 ｵｰﾅｰ
63,ペット,ホーム＆キッチン・ペット 通販【全品無料配達】 - ヨドバシ,https://www.yodobashi.com/category/162842/,ホーム＆キッチン・ペットの通販ならヨドバシカメラの公式サイト「ヨドバシ.com」で！キッチン用品・食器やペットフード・ペット用品など人気の商品を多数取り揃えてい ...,64,ﾎｰﾑ ｷｯﾁﾝ ﾍﾟｯﾄ 通販 ﾖﾄﾞﾊﾞｼ ｶﾒﾗ 公式 ｻｲﾄ ﾖﾄﾞﾊﾞｼ com ｷｯﾁﾝ 食器 ﾍﾟｯﾄ ﾌｰﾄﾞ ﾍﾟｯﾄ 人気 商品 多数 取り揃え い
64,ペット,フェアリーペットクリニック ｜ 港区・白金高輪・広尾の動物 ...,https://www.fairypet-cl.com/,東京都港区白金高輪にあるフェアリーペットクリニックは、犬・猫専門の動物病院です。一般診療はもちろん、予防医療やペットホテルにも対応しております。,65,東京 都 港 区 白金 高輪 ある ﾌｪｱﾘｰ ﾍﾟｯﾄ ｸﾘﾆｯｸ 犬 猫 専門 動物 病院 一般 診療 予防 医療 ﾍﾟｯﾄ ﾎﾃﾙ 対応 し おり
65,ペット,ハナモペッツ | 港区三田のペットショップ・ペットホテル,https://www.mita-kirin.co.jp/shop/,ハナモペッツは港区三田の動物病院、ペットホテルを併設したペットショップです。ペット販売を始めとし、ペットホテル・トリミング・しつけ教室・ペットシッター・ ...,66,ﾊﾅﾓﾍﾟｯﾂ 港 区 三田 動物 病院 ﾍﾟｯﾄ ﾎﾃﾙ 併設 し ﾍﾟｯﾄ ｼｮｯﾌﾟ ﾍﾟｯﾄ 販売 始め し ﾍﾟｯﾄ ﾎﾃﾙ ﾄﾘﾐﾝｸﾞ しつけ 教室 ﾍﾟｯﾄ ｼｯﾀｰ
66,ペット,港区のペット可賃貸 物件一覧 - 東京 - ペットホームウェブ,https://www.pethomeweb.com/chintai/tokyo/minato-city/list/,港区のペット可賃貸物件をご紹介しています。ペットホームウェブの物件はすべてペット可（相談可）。港区の大型犬、中型犬、小型犬、猫、多頭飼育などのこだわり条件で ...,67,港 区 ﾍﾟｯﾄ 可 賃貸 物件 紹介 し い ﾍﾟｯﾄ ﾎｰﾑ ｳｪﾌﾞ 物件 すべて ﾍﾟｯﾄ 可 相談 可 港 区 大型 中型 小型 猫 多頭 飼育 こだわり 条件
67,ペット,ペット手帳 | あなたとペットに安心の毎日を,https://pet-techo.com/,ペット手帳は動物病院の先生や専門家と一緒にあなたとペットに安心の毎日をお届けするスマホサービスです。ワンちゃん、ネコちゃんの成長や季節に合わせた今週の ...,68,ﾍﾟｯﾄ 手帳 動物 病院 先生 専門 一緒 ﾍﾟｯﾄ 安心 毎日 届け する ｽﾏﾎｻｰﾋﾞｽ ﾜﾝ ﾈｺ 成長 季節 合わせ 今週
68,ペット,ペットライフ動物病院 - 港区,https://petlife.asia/hospital/11699/,"港区(東京)の動物病院 ペットライフ動物病院のご紹介。犬,猫の診療可能。土日祝日対応。港区の動物病院探しはEPARKペットライフ！ 施設情報です。 評価: 4.8 · ‎21 件のレビュー",69,港 区 東京 動物 病院 ﾍﾟｯﾄ ﾗｲﾌ 動物 病院 紹介 犬 猫 診療 土日 祝日 対応 港 区 動物 病院 探し EPARK ﾍﾟｯﾄ ﾗｲﾌ 施設 情報 評価 0 0 0 件 ﾚﾋﾞｭｰ
69,ペット,ペットとツーショット撮ったら… - 人間まおと愉快な仲間たち,http://ningenmao.blog.jp/archives/10642669.html,21 時間前 — すぐ編集して自分とこトリミングするよね他のおすすめ漫画よもぎ蒸しに行ってきた話料理教室の体験に行ってきたソロウェディング行ってきた話人間まお ...,70,0 時間 前 編集 し 自分 とこ ﾄﾘﾐﾝｸﾞ する 他 すすめ 漫画 よもぎ 行っ き 話 料理 教室 体験 行っ き ｿﾛ ｳｪﾃﾞｨﾝｸﾞ 行っ き 話 人間 まお
70,ペット,スターフライヤー、ペット同伴可に 年明け導入めざす,https://www.asahi.com/articles/ASP9J5V3TP9JTIPE012.html,2 日前 — スターフライヤー（北九州市）は16日、ペット（小型犬、小型猫）を機内に同伴するサービスの導入を目指して、検証フライトを実施すると発表した。,71,0 前 ｽﾀｰ ﾌﾗｲﾔｰ 北九州 市 0 ﾍﾟｯﾄ 小型 小型 猫 機内 同伴 する ｻｰﾋﾞｽ 導入 目指し 検証 ﾌﾗｲﾄ 実施 する 発表 し
71,ペット,ペットの防災（クルマに関する注意喚起） - JAF,https://jaf.or.jp/common/attention/pet,ペットと一緒に避難するには、災害に対する普段からの備えが必要です。ペット用フードや水などの備蓄はもちろん、住まいの自治体の取り決めをあらかじめ確認し、家族で ...,72,ﾍﾟｯﾄ 一緒 避難 する 災害 対する 普段 備え 必要 ﾍﾟｯﾄ ﾌｰﾄﾞ 水 備蓄 住まい 自治 体 取り決め 確認 し 家族
72,ペット,スターフライヤー 客室にペット持ち込めるサービス導入へ,https://www3.nhk.or.jp/news/html/20210916/k10013262011000.html,2 日前 — 【NHK】北九州市に本社がある航空会社「スターフライヤー」は、新型コロナウイルスの影響で搭乗率が落ち込む中、新たな利用客の獲得をね…,73,0 前 NHK 北九州 市 本社 ある 航空 会社 ｽﾀｰ ﾌﾗｲﾔｰ 新型 ｺﾛﾅ ｳｲﾙｽ 影響 搭乗 率 落ち込む 中 利用 客 獲得
73,ペット,港区南青山のペットショップ ココ・パル: PetShop ココ・パル,https://cocopal.co/,ペットショップ ココ・パルは港区南青山の日赤通り商店街にあるペットショップです。子犬や子猫のご紹介の他、ワンちゃんネコちゃんの為のペットホテルも行ってい ...,74,ﾍﾟｯﾄ ｼｮｯﾌﾟ ｺｺ ﾊﾟﾙ 港 区 南青山 日赤 通り 商店 ある ﾍﾟｯﾄ ｼｮｯﾌﾟ 子犬 子猫 紹介 他 ﾜﾝ ﾈｺ 為 ﾍﾟｯﾄ ﾎﾃﾙ 行っ い
74,ペット,PETボトルリサイクル推進協議会,https://www.petbottle-rec.gr.jp/,統計データ「PETボトルの再商品化実績」を更新しました。 2021年09月09日NEW. 統計データ「使用済み ...,75,統計 ﾃﾞｰﾀ PET ﾎﾞﾄﾙ 商品 実績 更新 し 0 年 0 月 0 NEW 統計 ﾃﾞｰﾀ 使用
75,ペット,FRANKLIN PET[港区白金フランクリンペット] | 白金の ...,http://www.franklin-pet.com/,港区白金にあるトリミングとペットショップのお店フランクリンペット。種類豊富なプレミアムフード取扱店！かわいいトイプードルのトリミング、大型犬のカットも対応、 ...,76,港 区 白金 ある ﾄﾘﾐﾝｸﾞ ﾍﾟｯﾄ ｼｮｯﾌﾟ 店 ﾌﾗﾝｸﾘﾝ ﾍﾟｯﾄ 種類 ﾌﾟﾚﾐｱﾑ ﾌｰﾄﾞ 取扱 かわいい ﾄｲ ﾌﾟｰﾄﾞﾙ ﾄﾘﾐﾝｸﾞ 大型 ｶｯﾄ 対応
76,ペット,ペットイベント みんな大好き!!ペット王国（ペット ... - 大阪市,https://pet-oukoku.jp/,みんな大好き!!ペット王国は京セラドーム大阪で毎年ゴールデンウィーク（GW）に開催されるペットイベントです。犬、猫、小動物、爬虫類、昆虫、観賞魚、鳥などがドーム ...,77,みんな ﾍﾟｯﾄ 王国 京ｾﾗ ﾄﾞｰﾑ 大阪 毎年 ｺﾞｰﾙﾃﾞﾝ ｳｨｰｸ GW 開催 さ ﾍﾟｯﾄ ｲﾍﾞﾝﾄ 犬 猫 動物 爬虫 昆虫 観賞 鳥 ﾄﾞｰﾑ
77,ペット,警察が捜索したペット業者、2か所で1000匹の犬を飼育…,https://www.yomiuri.co.jp/national/20210916-OYT1T50259/,2 日前 — 長野県警が松本市のペット業者を動物愛護法違反容疑で捜索した事件に関連し、臥雲義尚市長は16日の定例記者会見で、この業者が市内2か所で飼育し ...,78,0 前 長野 県 松本 市 ﾍﾟｯﾄ 動物 愛護 法 違反 容疑 捜索 し 事件 関連 し 臥雲 義尚 市長 0 定例 記者 会見 業者 市内 0 か所 飼育 し
78,ペット,PET-CTとは - 国立国際医療研究センター病院,http://www.hosp.ncgm.go.jp/s037/010/010/pet.html,PETでは全身のがんなどを一度に調べることが出来る. PETとは、positron emission tomography （陽電子放出断層撮影） の略で、放射能を含む薬剤を用いる、核医学検査 ...,79,PET 全身 がん 一 度 調べる こと 出来る PET positron emission tomography 陽 電子 放出 断層 撮影 略 放射 能 含む 薬剤 用いる 核 医学 検査
79,ペット,日本ペット共済,https://petlife.or.jp/,犬、ネコのペット共済は日本ペット共済にお任せ下さい。,80,犬 ﾈｺ ﾍﾟｯﾄ 共済 日本 ﾍﾟｯﾄ 共済 任せ 下さい
80,ペット,ペット保険(犬・猫)のペット＆ファミリー損保【公式】 | T&D ...,https://www.petfamilyins.co.jp/,ペット保険のペット＆ファミリー損保(T＆D保険グループ)公式サイト。犬・猫のペット保険「げんきナンバーわん」「げんきナンバーわんスリム」を展開。家族であるペット ...,81,ﾍﾟｯﾄ 保険 ﾍﾟｯﾄ ﾌｧﾐﾘｰ 損保 T D 保険 ｸﾞﾙｰﾌﾟ 公式 ｻｲﾄ 犬 猫 ﾍﾟｯﾄ 保険 げんき ﾅﾝﾊﾞｰ わん げんき ﾅﾝﾊﾞｰ わん 展開 家族 ある ﾍﾟｯﾄ
81,ペット,トリミング ペットホテルのPET-SPA｜西武ペットケア,http://www.pet-spa.co.jp/,株式会社西武ペットケアの運営するトリミングサロン PET-SPA（ペットスパ）。東京、神奈川、埼玉などの首都圏を中心に店舗を展開しています。トリミングやペットホテル ...,82,株式 会社 西武 ﾍﾟｯﾄ ｹｱ 運営 する ﾄﾘﾐﾝｸﾞ ｻﾛﾝ PET SPA ﾍﾟｯﾄ ｽﾊﾟ 東京 神奈川 埼玉 首都 中心 店舗 展開 し い ﾄﾘﾐﾝｸﾞ ﾍﾟｯﾄ ﾎﾃﾙ
82,ペット,ペットショップジョーカー,http://www.joker.co.jp/,ペットショップ ジョーカーは東京六本木、二子玉川、日本橋、南町田、立川、お台場、横浜、大宮、千葉、柏の葉に展開し健康な子犬、子猫のご紹介からトリミング ...,83,ﾍﾟｯﾄ ｼｮｯﾌﾟ ｼﾞｮｰｶｰ 東京 六本木 二子玉川 日本橋 南 町田 立川 台場 横浜 大宮 千葉 柏 葉 展開 し 健康 子犬 子猫 紹介 ﾄﾘﾐﾝｸﾞ
83,ペット,Life with Pet ～ペットと人の健やかな毎日のために～ |エラン ...,https://jp.mypetandi.com/,バイエル薬品が提供、犬・猫の病気予防、健康管理のための情報発信サイト。ノミ・マダニ・フィラリア・回虫・条虫などの寄生虫駆除・予防対策、細菌感染症の情報などを ...,84,ﾊﾞｲｴﾙ 薬品 提供 犬 猫 病気 予防 健康 管理 ため 情報 発信 ｻｲﾄ ﾉﾐ ﾏﾀﾞﾆ ﾌｨﾗﾘｱ 回虫 条虫 寄生 駆除 予防 対策 細菌 感染 情報
84,ペット,ミミクリーペット｜スペシャルサイト｜タカラトミーアーツ,https://www.takaratomy-arts.co.jp/specials/mimicry/,話しかけるとノリノリのアクションと共にあなたのコトバを何でもマネしておしゃべりするぬいぐるみ『ミミクリーペット』の公式サイトです。,85,話しかける ｱｸｼｮﾝ 共 ｺﾄﾊﾞ ﾏﾈ し しゃべり する ぬいぐるみ ﾐﾐｸﾘｰ ﾍﾟｯﾄ 公式 ｻｲﾄ
85,ペット,西武グループ ペットスマイルプロジェクト  SEIBU GROUP,https://www.seibuholdings.co.jp/pet-smile/,西武グループでは、ペットと楽しめるひとときを大切にするため、「ペットと一緒」がもっと楽しくなるペットスマイルプロジェクトを展開してまいります。,86,西武 ｸﾞﾙｰﾌﾟ ﾍﾟｯﾄ 楽しめる ひととき する ため ﾍﾟｯﾄ 一緒 楽しく なる ﾍﾟｯﾄ ｽﾏｲﾙ ﾌﾟﾛｼﾞｪｸﾄ 展開 し まいり
86,ペット,プレゼントペット（PRESENT PETS） - タカラトミー,https://www.takaratomy.co.jp/products/presentpets/,あなたに会うために、かわいいペットが自分で箱から出てきちゃう！？箱から出てくるあまえんぼ「プレゼントペット（PRESENT PETS）」が新登場♪ フワフワなわんことの ...,87,会う ため かわいい ﾍﾟｯﾄ 自分 箱 出 き 箱 出 くる ﾌﾟﾚｾﾞﾝﾄ ﾍﾟｯﾄ PRESENT PETS 登場 なわ こと
87,ペット,ペット家族 公式サイト | ペットショップ・動物病院・ペット ...,https://www.pet-kazoku.net/,ペットショップや動物病院、ペットホテルも併設！動物たちが楽しく過ごすための環境を整えたペット家族の総合サイト。,88,ﾍﾟｯﾄ ｼｮｯﾌﾟ 動物 病院 ﾍﾟｯﾄ ﾎﾃﾙ 併設 動物 楽しく 過ごす ため 環境 整え ﾍﾟｯﾄ 家族 総合 ｻｲﾄ
88,ペット,PET DESIGN natural care,https://petdesign.jp/,PET LIST最新のワンちゃん ねこちゃん ... PET DESIGN 赤坂けやき通り店. 福岡県福岡市中央区赤坂2-3-1. ペット販売; トリミング; ペットホテル; グッズ販売.,89,PET LIST 最新 ﾜﾝ ねこ PET DESIGN 赤坂 けやき 通り 福岡 県 福岡 市 中央 区 赤坂 0 0 0 ﾍﾟｯﾄ 販売 ﾄﾘﾐﾝｸﾞ ﾍﾟｯﾄ ﾎﾃﾙ ｸﾞｯｽﾞ 販売
89,ペット,ペット総合通販サイトPETEMOオンラインストア「しあわせも ...,https://shop.petemo.jp/,イオンペットが運営するペット専門の総合通販サイト。ごはんやトイレ用品、アパレルなど、ペットライフに必要なものが揃います。ペットに関する幅広いサービス ...,90,ｲｵﾝ ﾍﾟｯﾄ 運営 する ﾍﾟｯﾄ 専門 総合 通販 ｻｲﾄ ごはん ﾄｲﾚ ｱﾊﾟﾚﾙ ﾍﾟｯﾄ ﾗｲﾌ 必要 もの 揃い ﾍﾟｯﾄ 関する 幅広い ｻｰﾋﾞｽ
90,ペット,ペットの専門店コジマ通信販売オンライン - PET-SHOP.JP,https://pet-shop.jp/kojima/,ペットの専門店コジマが提供する犬・猫・小動物・鳥類などの、ペットフードやペット用品を専門に販売するショッピングサイトです。,91,ﾍﾟｯﾄ 専門 ｺｼﾞﾏ 提供 する 犬 猫 動物 鳥類 ﾍﾟｯﾄ ﾌｰﾄﾞ ﾍﾟｯﾄ 専門 販売 する ｼｮｯﾋﾟﾝｸﾞ ｻｲﾄ
91,ペット,ペットとおでかけサービス（ご搭乗サポート） - JAL国内線,https://www.jal.co.jp/dom/support/pet/,"ペットをお連れの方. お客さまの""ご家族""を大切にお預かりする「ペットとおでかけサービス」についてご案内します。",92,ﾍﾟｯﾄ 連れ 方 客 家族 預かり する ﾍﾟｯﾄ でかけ ｻｰﾋﾞｽ つい 案内 し
92,ペット,一般社団法人日本ペット用品工業会,http://www.jppma.or.jp/,... 会員企業・賛助会員企業 · 消費者様向けQ&A · 会員ページ · お問い合わせ · JP · EN. 2021適合品証; ペット用品産業実態調査について; ペット用品取扱士検定試験 ...,93,会員 企業 賛助 会員 企業 消費 Q A 会員 ﾍﾟｰｼﾞ 問い合わせ JP EN 0 適合 ﾍﾟｯﾄ 産業 実態 調査 つい ﾍﾟｯﾄ 取扱 検定 試験
93,ペット,ペット保険は【日本ペットオーナーズクラブ】犬・猫の病気や ...,https://www.petowner.co.jp/,大切な家族（ペット）の万が一のためのペット保険の専門会社「日本ペットオーナーズクラブ」。犬、猫の医療保険から飼い主様向け保険【ペットのお守り】や飼い主様の ...,94,家族 ﾍﾟｯﾄ 万が一 ため ﾍﾟｯﾄ 保険 専門 会社 日本 ﾍﾟｯﾄ ｵｰﾅｰｽﾞ ｸﾗﾌﾞ 犬 猫 医療 保険 飼い主 保険 ﾍﾟｯﾄ 守り 飼い主
