,keyword,site_name,URL,snippet,ranking,target
94,ペット,株式会社テラオ | 静岡・浜松のペットショップ、ペット用品 ...,http://www.terao-pet.jp/,テラオは静岡・浜松のペットプラザ・ペット愛らんど・ペット愛ランドにてペットフード・ペット用品を販売しております。 最新のトレンド品、新機能商品などをいかに ...,95,ﾃﾗｵ 静岡 浜松 ﾍﾟｯﾄ ﾌﾟﾗｻﾞ ﾍﾟｯﾄ 愛 ﾍﾟｯﾄ 愛 ﾗﾝﾄﾞ ﾍﾟｯﾄ ﾌｰﾄﾞ ﾍﾟｯﾄ 販売 し おり 最新 ﾄﾚﾝﾄﾞ 機能 商品
95,ペット,クラブアイペット,https://www.ipetclub.jp/connect/,クラブアイペットは、ペットとのライフスタイルやお得なクーポン情報を「ごほうび」としてお届けするWEBマガジンです。,96,ｸﾗﾌﾞ ｱｲ ﾍﾟｯﾄ ﾍﾟｯﾄ ﾗｲﾌｽﾀｲﾙ 得 ｸｰﾎﾟﾝ 情報 ほうび し 届け する WEB ﾏｶﾞｼﾞﾝ
96,ペット,みんなのブリーダー - 優良ブリーダー直販の子犬販売サイト,https://www.min-breeder.com/,【成約数19万件突破】全国の優良ブリーダーから、かわいい子犬を安心価格で購入できる子犬販売サイトです。1ヶ月間の無料ペット保険・取引保証があるので安心！,97,成約 数 0 万 件 突破 全国 ﾌﾞﾘｰﾀﾞｰ かわいい 子犬 安心 価格 購入 できる 子犬 販売 ｻｲﾄ 0 ヶ月 無料 ﾍﾟｯﾄ 保険 取引 保証 ある 安心
97,ペット,横浜市の動物病院｜洋光台ペットクリニック,https://www.youkoudai-pet.com/,神奈川県横浜市磯子区。洋光台駅から徒歩5分の動物病院。動物と飼い主がもっとも良い関係でいられるような治療を目指しています。トリミング・ペットホテル・避妊 ...,98,神奈川 県 横浜 市 磯子 区 洋 光台 駅 徒歩 0 動物 病院 動物 飼い主 良い 関係 い 治療 目指し い ﾄﾘﾐﾝｸﾞ ﾍﾟｯﾄ ﾎﾃﾙ 避妊
98,ペット,業界初、初回ケガ全額補償のペット保険はイーペット少額短期 ...,https://www.e-pet.co.jp/,イーペット少額短期保険株式会社のe-ペット70は、業界初の初回ケガ全額補償！安心・充実補償のペット保険です。,99,ｲｰ ﾍﾟｯﾄ 少額 短期 保険 株式 会社 e ﾍﾟｯﾄ 0 業界 初 初回 ｹｶﾞ 全額 補償 安心 充実 補償 ﾍﾟｯﾄ 保険
