,keyword,site_name,URL,snippet,ranking,target
0,ペット,人気ランキング | ペットショップのコジマ,https://pets-kojima.com/ranking/,子犬や子猫などのペットの販売専門店ペットショップコジマオフィシャルサイト。人気のダックスフント、チワワ、トイ・プードルなどの犬、アメリカンショートヘア、 ...‎ハーフ・MIX犬の子犬たち · ‎全ての子犬たち · ‎トイ・プードル · ‎ビション・フリーゼ,1,子犬 子猫 ﾍﾟｯﾄ 販売 専門 ﾍﾟｯﾄｼｮｯﾌﾟｺｼﾞﾏｵﾌｨｼｬﾙｻｲﾄ 人気 ﾀﾞｯｸｽﾌﾝﾄ ﾁﾜﾜ ﾄｲ ﾌﾟｰﾄﾞﾙ 犬 ｱﾒﾘｶﾝ ｼｮｰﾄ ﾍｱ ﾊｰﾌ MIX 犬 子犬 全て 子犬 ﾄｲ ﾌﾟｰﾄﾞﾙ ﾋﾞｼｮﾝ ﾌﾘｰ
1,ペット,人気ランキング | ペットショップのコジマ,https://pets-kojima.com/ranking/,子犬や子猫などのペットの販売専門店ペットショップコジマオフィシャルサイト。人気のダックスフント、チワワ、トイ・プードルなどの犬、アメリカンショートヘア、 ...‎ハーフ・MIX犬の子犬たち · ‎全ての子犬たち · ‎トイ・プードル · ‎ビション・フリーゼ,2,子犬 子猫 ﾍﾟｯﾄ 販売 専門 ﾍﾟｯﾄｼｮｯﾌﾟｺｼﾞﾏｵﾌｨｼｬﾙｻｲﾄ 人気 ﾀﾞｯｸｽﾌﾝﾄ ﾁﾜﾜ ﾄｲ ﾌﾟｰﾄﾞﾙ 犬 ｱﾒﾘｶﾝ ｼｮｰﾄ ﾍｱ ﾊｰﾌ MIX 犬 子犬 全て 子犬 ﾄｲ ﾌﾟｰﾄﾞﾙ ﾋﾞｼｮﾝ ﾌﾘｰ
2,ペット,ペットショップのコジマ,https://pets-kojima.com/,子犬や子猫などのペットの販売専門店、ペットショップのコジマです。東京都内をはじめ、全国にペットショップを展開しています。ペットと人との素敵なライフスタイル ...,3,子犬 子猫 ﾍﾟｯﾄ 販売 専門 ﾍﾟｯﾄ ｼｮｯﾌﾟ ｺｼﾞﾏ 東京 都内 はじめ 全国 ﾍﾟｯﾄ ｼｮｯﾌﾟ 展開 し い ﾍﾟｯﾄ 人 ﾗｲﾌｽﾀｲﾙ
3,ペット,ペット - Wikipedia,https://ja.wikipedia.org/wiki/%E3%83%9A%E3%83%83%E3%83%88,ペットは、人の心を和ませたり楽しませてくれる、といった理由で飼われる動物である。人はペットとの様々なやり取りを楽しんだり、その姿や鳴き声などを鑑賞したりする ...‎Category:ペット · ‎ペットロス症候群 · ‎ペット・ロック · ‎ペット供養,4,ﾍﾟｯﾄ 人 心 和ま 楽しま くれる いっ 理由 飼わ 動物 ある 人 ﾍﾟｯﾄ やり取り 楽しん 姿 鳴き声 鑑賞 し する Category ﾍﾟｯﾄ ﾍﾟｯﾄ ﾛｽ 症候 群 ﾍﾟｯﾄ ﾛｯｸ ﾍﾟｯﾄ 供養
4,ペット,ペットショップ「Coo＆RIKU」｜全国に200店舗以上,https://www.pet-coo.com/,一人でも多くの方にワンちゃんネコちゃんと暮らす幸せを」をモットーに、全国に店舗を展開するペットショップ「Coo＆RIKU」のホームページです。‎ペット検索 · ‎お気に入り · ‎地図から店舗検索 · ‎保護・譲渡の犬猫 里親募集,5,一人 多く 方 ﾜﾝ ﾈｺ 暮らす 幸せ ﾓｯﾄｰ 全国 店舗 展開 する ﾍﾟｯﾄ ｼｮｯﾌﾟ Coo RIKU ﾎｰﾑ ﾍﾟｰｼﾞ ﾍﾟｯﾄ 検索 気 入り 地図 店舗 検索 保護 譲渡 犬猫 里親 募集
5,ペット,子犬・子猫専門ペットショップはPetPlus（ペットプラス）,https://www.ahb.jpn.com/,PetPlus（ペットプラス）のホームページへようこそ。全国でペットショップを運営している株式会社AHBの子犬・子猫の販売サイトです。毎日新着のワンちゃん・ネコちゃん ...,6,PetPlus ﾍﾟｯﾄ ﾌﾟﾗｽ ﾎｰﾑ ﾍﾟｰｼﾞ よう 全国 ﾍﾟｯﾄ ｼｮｯﾌﾟ 運営 し いる 株式 会社 AHB 子犬 子猫 販売 ｻｲﾄ 毎日 新着 ﾜﾝ ﾈｺ
6,ペット,ペットの里親募集情報 :: ペットのおうち【月間利用者150万人 ...,https://www.pet-home.jp/,「ペットのおうち」は全国のペット里親募集情報サイトです。飼い主が止むを得ず手放さないといけないペットや保護活動者が保護しているペットなどの里親募集情報が全国 ...,7,ﾍﾟｯﾄ うち 全国 ﾍﾟｯﾄ 里親 募集 情報 ｻｲﾄ 飼い主 止む 得 手放さ いけ ﾍﾟｯﾄ 保護 活動 保護 し いる ﾍﾟｯﾄ 里親 募集 情報 全国
7,ペット,ペット宿ドットコム,https://petyado.com/,ペット宿ドットコム公式ホームページ。ペットと泊まれる宿・犬と泊まれる宿・犬と宿泊できるペット宿を紹介しているpet宿.com ペット宿.com（ペット宿ドットコム）。,8,ﾍﾟｯﾄ 宿 ﾄﾞｯﾄ ｺﾑ 公式 ﾎｰﾑ ﾍﾟｰｼﾞ ﾍﾟｯﾄ 泊まれる 宿 犬 泊まれる 宿 犬 宿泊 できる ﾍﾟｯﾄ 宿 紹介 し いる pet 宿 com ﾍﾟｯﾄ 宿 com ﾍﾟｯﾄ 宿 ﾄﾞｯﾄ ｺﾑ
8,ペット,TVアニメ・舞台「pet」公式サイト,https://pet-anime.com/,三宅乱丈『ペット リマスター・エディション』（ビームコミックス／KADOKAWA刊）がアニメ化＆舞台化。アニメはTOKYO MX 毎週月曜22:00～BS11、AT-Xほかにて 2020年1月6 ...,9,三宅 乱 丈 ﾍﾟｯﾄ ﾘﾏｽﾀｰ ｴﾃﾞｨｼｮﾝ ﾋﾞｰﾑ ｺﾐｯｸｽ KADOKAWA ｱﾆﾒ 舞台 ｱﾆﾒ TOKYO MX 毎週 月曜 0 0 BS 0 AT X ほか 0 年 0 月 0
9,ペット,東京都港区 | ペット火葬・ペット葬儀なら「ジャパン動物 ...,https://j-d-m.jp/area_info/tokyo_minato_ku/,24時間365日無料相談。東京都港区 でペット火葬・ペット葬儀は「ジャパン動物メモリアル社 」へ。犬、猫、小動物まで、全ての大切な動物の命に真剣に向き合い、また ...,10,0 時間 0 無料 相談 東京 都 港 区 ﾍﾟｯﾄ 火葬 ﾍﾟｯﾄ 葬儀 ｼﾞｬﾊﾟﾝ 動物 ﾒﾓﾘｱﾙ 社 犬 猫 動物 全て 動物 命 真剣 向き合い
10,ペット,港区ホームページ／動物・ペット,https://www.city.minato.tokyo.jp/kurashi/dobutsu/,動物・ペット. 区立公園等におけるドッグラン設置の基本的考え方の策定について · 犬の登録と狂犬病予防注射 · 狂犬病にご注意ください.,11,動物 ﾍﾟｯﾄ 区 公園 おけ ﾄﾞｯｸﾞ ﾗﾝ 設置 基本 考え 策定 つい 犬 登録 狂犬 予防 注射 狂犬 注意 ください
11,ペット,ペットと泊まれる宿 - じゃらんnet,https://www.jalan.net/pet/,愛犬・ペットと一緒に泊まれる宿特集。わんちゃんに嬉しいサービスも充実！おすすめのお遊びスポットや、一緒に旅行する時のノウハウも紹介。大切なペットと泊まれる ...,12,愛犬 ﾍﾟｯﾄ 一緒 泊まれる 宿 特集 嬉しい ｻｰﾋﾞｽ 充実 すすめ 遊び ｽﾎﾟｯﾄ 一緒 旅行 する 時 ﾉｳﾊｳ 紹介 ﾍﾟｯﾄ 泊まれる
12,ペット,ペット検索 - 犬の家&猫の里,https://dognoie.com/pet/,2016/09/18 — トップ; ペット検索. よく見られている子. こだわり検索. ペットの種類で絞り込む. すべて ワンちゃん ネコちゃん. さらにこだわって検索. 店舗名.,13,0 0 0 ﾄｯﾌﾟ ﾍﾟｯﾄ 検索 見 いる 子 こだわり 検索 ﾍﾟｯﾄ 種類 絞り込む すべて ﾜﾝ ﾈｺ こだわっ 検索 店舗 名
13,ペット,ペット情報｜総合ペットショップ[PET FOREST] - ペット ...,http://www.petforest.co.jp/pet/,宇都宮インターパーク店とてもおしとやかな性格の白柴ちゃんがやって参りました♡. 詳細を見る. MIX犬 ミックス犬（トイプードル×チワワ）.,14,宇都宮 ｲﾝﾀｰ ﾊﾟｰｸ 性格 白 柴 やっ 参り 詳細 見る MIX ﾐｯｸｽ ﾄｲ ﾌﾟｰﾄﾞﾙ ﾁﾜﾜ
14,ペット,ペットショップ P's-first  ペットを最優先に考えます,https://pfirst.jp/,ペットショップ P's-first（ペッツファースト／ピーズファースト)は子犬子猫専門ペットショップです。様々な種類の子犬や子猫達からお気に入りのペットを見つけて ...,15,ﾍﾟｯﾄ ｼｮｯﾌﾟ P s first ﾍﾟｯﾂﾌｧｰｽﾄ ﾋﾟｰｽﾞ ﾌｧｰｽﾄ 子犬 子猫 専門 ﾍﾟｯﾄ ｼｮｯﾌﾟ 種類 子犬 子猫 気 入り ﾍﾟｯﾄ 見つけ
15,ペット,ペットショップのワンラブ 写真と動画でご紹介,https://www.pet-onelove.com/,子犬や子猫などのペットの販売専門店。ペットショップディーラーワンラブグループは、全国1都1道2府36県で160店舗を展開する信頼と安心の総合ペットショップ。店舗： お選びください愛知県――全部 ├ 星崎店 ├ ...毛質： お選びくださいスムース【短毛】スムースコー...価格帯： お選びください セールの子 ～5万円未満 ...種類： お選びくださいｱｲﾘｯｼｭｾﾀｰｱｷﾀｹﾝ【秋田犬】ｱ...,16,子犬 子猫 ﾍﾟｯﾄ 販売 専門 ﾍﾟｯﾄｼｮｯﾌﾟﾃﾞｨｰﾗｰﾜﾝﾗﾌﾞｸﾞﾙｰﾌﾟ 全国 0 都 0 道 0 府 0 県 0 店舗 展開 する 信頼 安心 総合 ﾍﾟｯﾄ ｼｮｯﾌﾟ 店舗 選び ください 愛知 県 全部 星崎 毛質 選び ください 短毛 価格 選び ください ｾｰﾙ 子 0 万 円 未満 種類 選び ください ｱｲﾘｯｼｭｾﾀｰｱｷﾀｹﾝ 秋田 ｱ
16,ペット,「ペット」の検索結果 - 【楽天市場】ジャンルトップ一覧 ...,https://search.rakuten.co.jp/search/mall/%E3%83%9A%E3%83%83%E3%83%88/,楽天市場-「ペット」3783093件 人気の商品を価格比較・ランキング･レビュー・口コミで検討できます。ご購入でポイント取得がお得。セール商品・送料無料商品も多数。,17,楽天 市場 ﾍﾟｯﾄ 0 件 人気 商品 価格 比較 ﾗﾝｷﾝｸﾞ ﾚﾋﾞｭｰ 口ｺﾐ 検討 でき 購入 ﾎﾟｲﾝﾄ 取得 得 ｾｰﾙ 商品 送料 無料 商品 多数
17,ペット,ペット用品の通販サイト ペピイ（PEPPY）,https://www.peppynet.com/,ペット用品の通販サイト ペピイ（PEPPY）公式HP【スマホ対応】。ドッグフード・キャットフードをはじめとしたペット用品通販やペットのお役立ち情報、ペットの施設検索 ...,18,ﾍﾟｯﾄ 通販 ｻｲﾄ ﾍﾟﾋﾟｲ PEPPY 公式 HP ｽﾏﾎ 対応 ﾄﾞｯｸﾞﾌｰﾄﾞ･ｷｬｯﾄﾌｰﾄﾞ はじめ し ﾍﾟｯﾄ 通販 ﾍﾟｯﾄ 役立ち 情報 ﾍﾟｯﾄ 施設 検索
18,ペット,ペットワールド アミーゴ,https://amigo-pet.co.jp/,ペット専門店アミーゴオフィシャルサイト。わんちゃん、ねこちゃんを中心に、小動物、鳥、爬虫類、昆虫、熱帯魚まで扱う総合ペットショップ。ペットフード、ペット用品 ...,19,ﾍﾟｯﾄ 専門 ｱﾐｰｺﾞ ｻｲﾄ ねこ 中心 動物 鳥 爬虫 昆虫 熱帯 扱う 総合 ﾍﾟｯﾄ ｼｮｯﾌﾟ ﾍﾟｯﾄ ﾌｰﾄﾞ ﾍﾟｯﾄ 用品
19,ペット,イオンペット [AEON PET],https://www.aeonpet.com/,イオンペットは、動物と人間の幸せな共生社会の実現を目指します。ペットフード、ペット用品の販売のほか、トリミングサロン、ペットホテル、動物病院、しつけ教室他、 ...,20,ｲｵﾝ ﾍﾟｯﾄ 動物 人間 幸せ 共生 社会 実現 目指し ﾍﾟｯﾄ ﾌｰﾄﾞ ﾍﾟｯﾄ 販売 ほか ﾄﾘﾐﾝｸﾞ ｻﾛﾝ ﾍﾟｯﾄ ﾎﾃﾙ 動物 病院 しつけ 教室 他
20,ペット,ペットフード ペット用品 | Amazon | アマゾン,https://www.amazon.co.jp/%E3%83%9A%E3%83%83%E3%83%88%E3%83%95%E3%83%BC%E3%83%89-%E3%83%9A%E3%83%83%E3%83%88%E7%94%A8%E5%93%81/b?ie=UTF8&node=2127212051,ペットフード・ペット用品ならAmazon.co.jp。ドッグフード、キャットフード、猫砂、ペットシートなどの重たい、かさばるものもご自宅までお届け。,21,ﾍﾟｯﾄ ﾌｰﾄﾞ ﾍﾟｯﾄ Amazon co jp ﾄﾞｯｸﾞ ﾌｰﾄﾞ ｷｬｯﾄ ﾌｰﾄﾞ 猫砂 ﾍﾟｯﾄ ｼｰﾄ 重たい かさばる もの 自宅 届け
21,ペット,ペット : 作品情報 - 映画.com,https://eiga.com/movie/82613/,2016/08/11 — ペットの作品情報。上映スケジュール、映画レビュー、予告動画。「ミニオンズ」のイルミネーション・エンターテインメントとユニバーサル・スタジオが ... 評価: 3.3 · ‎200 件のレビュー,22,0 0 0 ﾍﾟｯﾄ 作品 情報 上映 ｽｹｼﾞｭｰﾙ 映画 ﾚﾋﾞｭｰ 予告 動画 ﾐﾆ ｵﾝｽﾞ ｲﾙﾐﾈｰｼｮﾝ ｴﾝﾀｰﾃｲﾝﾒﾝﾄ ｽﾀｼﾞｵ 評価 0 0 0 件 ﾚﾋﾞｭｰ
22,ペット,東京都港区のペットショップ (36件) - goo地図,https://map.goo.ne.jp/search/address/13103/genre/12002/,東京都港区にあるペットショップを紹介します。周辺のお店、施設、観光スポット、イベント情報、天気予報、防災情報も検索できます。主な情報提供元はタウンページ、 ...,23,東京 都 港 区 ある ﾍﾟｯﾄ ｼｮｯﾌﾟ 紹介 し 周辺 店 施設 観光 ｽﾎﾟｯﾄ ｲﾍﾞﾝﾄ 情報 天気 予報 防災 情報 検索 でき 情報 提供 元 ﾀｳﾝ ﾍﾟｰｼﾞ
23,ペット,ペット用品の通販 - アイリスプラザ,https://www.irisplaza.co.jp/index.php?KB=KAISO&CID=6,アイリスオーヤマの公式通販サイト【アイリスプラザ】の園芸ペット専門店・ペット一覧ページです。お客様のライフスタイルに合わせた各種園芸ペット専門店・ペットを ...,24,ｱｲﾘｽ ｵｰﾔﾏ 公式 通販 ｻｲﾄ ｱｲﾘｽ ﾌﾟﾗｻﾞ 園芸 ﾍﾟｯﾄ 専門 ﾍﾟｯﾄ 一覧 ﾍﾟｰｼﾞ 客 ﾗｲﾌｽﾀｲﾙ 合わせ 各種 園芸 ﾍﾟｯﾄ 専門 ﾍﾟｯﾄ
24,ペット,兵庫、奈良、京都、和歌山 犬猫ペットの事ならおまかせ!,https://www.higopet.com/sp/,ひごペットフレンドリー. メニュー; 店舗一覧. わんちゃん; ねこちゃん; 観賞魚・水草 ... 新着ペット; ペット検索; 人気のペット. いぬ; ねこ; アクア; 小動物・鳥 ...; マルチーズ： ; ミックス; スムース・チワワ： ; トイ・プードル; ミニチュア・ダックスフンド・ロングヘアー： ; ヨーク...; イタリアン・グレーハウンド： ; ウェルシュ・コーギー...,25,ひご ﾍﾟｯﾄ ﾒﾆｭｰ 店舗 一覧 ねこ 観賞 水草 新着 ﾍﾟｯﾄ ﾍﾟｯﾄ 検索 人気 ﾍﾟｯﾄ いぬ ねこ ｱｸｱ 動物 鳥 ﾏﾙﾁｰｽﾞ ﾐｯｸｽ ﾁﾜﾜ ﾄｲ ﾌﾟｰﾄﾞﾙ ﾐﾆﾁｭｱ ﾀﾞｯｸｽﾌﾝﾄﾞ ﾛﾝｸﾞﾍｱ ﾖｰｸ ｲﾀﾘｱﾝ ｸﾞﾚｰﾊｳﾝﾄﾞ ｳｪﾙｼｭ ｺｰｷﾞｰ
25,ペット,ペット大好き！｜ペット大好き！,https://www.petoffice.co.jp/,ワールドペットニュース. 配達員が荷物を届けた家の猫を盗む. 2021.09.17. 配達員が荷物を届けた家の猫を盗む · 首に心臓をもつ子ヤギ。小さな命を守る夫妻との温かい.,26,ﾜｰﾙﾄﾞ ﾍﾟｯﾄ ﾆｭｰｽ 配達 荷物 届け 家 猫 盗む 0 0 0 配達 荷物 届け 家 猫 盗む 首 心臓 もつ 子ﾔｷﾞ 命 守る 夫妻 温かい
26,ペット,ペット - Y!きっず図鑑,https://kids.yahoo.co.jp/zukan/pet/,Yahoo!きっず図鑑の「ペット図鑑」だよ。犬や猫、金魚やハムスターなど、かわいいペットたちの特徴や飼い方を調べてみよう！ Yahoo!きっず図鑑は無料で使えるマルチ ...,27,Yahoo きっ 図鑑 ﾍﾟｯﾄ 図鑑 犬 猫 金魚 ﾊﾑｽﾀｰ かわいい ﾍﾟｯﾄ 特徴 飼い 調べ みよう Yahoo きっ 図鑑 無料 使える ﾏﾙﾁ
27,ペット,ペット - Y!きっず図鑑,https://kids.yahoo.co.jp/zukan/pet/,Yahoo!きっず図鑑の「ペット図鑑」だよ。犬や猫、金魚やハムスターなど、かわいいペットたちの特徴や飼い方を調べてみよう！ Yahoo!きっず図鑑は無料で使えるマルチ ...,28,Yahoo きっ 図鑑 ﾍﾟｯﾄ 図鑑 犬 猫 金魚 ﾊﾑｽﾀｰ かわいい ﾍﾟｯﾄ 特徴 飼い 調べ みよう Yahoo きっ 図鑑 無料 使える ﾏﾙﾁ
28,ペット,LOHACO - ペット用品 通販 - ロハコ,https://lohaco.yahoo.co.jp/category/61481/,ペット用品 の通販ならLOHACO（ロハコ）で！LOHACO発送の商品は、最短翌日お届け。PayPayが使える、貯まる。アスクル個人向け日用品ショッピングサイトです。,29,ﾍﾟｯﾄ 通販 LOHACO ﾛﾊｺ LOHACO 発送 商品 最短 翌日 届け PayPay 使える 貯まる ｱｽｸﾙ 個人 日用 ｼｮｯﾋﾟﾝｸﾞ ｻｲﾄ
29,ペット,ペット | 通販・価格比較・製品情報,https://kakaku.com/pet/,ペットを買うなら、まずは価格.comペットをチェック！ 全国の通販サイトの販売価格情報をはじめ、スペック検索、クチコミ情報、ランキングなど、さまざまな視点から ...,30,ﾍﾟｯﾄ 買う 価格 com ﾍﾟｯﾄ ﾁｪｯｸ 全国 通販 ｻｲﾄ 販売 価格 情報 はじめ ｽﾍﾟｯｸ 検索 ｸﾁｺﾐ 情報 ﾗﾝｷﾝｸﾞ 視点
30,ペット,ペット・花・ガーデニング・DIYの通販 | dポイントでお得にお ...,https://shopping.dmkt-sp.jp/genre/pet/?genre_code=14,ペット・花・ガーデニング・DIYに関する通販ならdショッピング。 ワンちゃんから猫ちゃん熱帯魚まで様々な種類のペットに対応した商品や花、ガーデニング用品、DIY用品 ...,31,ﾍﾟｯﾄ 花 ｶﾞｰﾃﾞﾆﾝｸﾞ DIY 関する 通販 d ｼｮｯﾋﾟﾝｸﾞ ﾜﾝ 猫 熱帯 種類 ﾍﾟｯﾄ 対応 し 商品 花 ｶﾞｰﾃﾞﾆﾝｸﾞ DIY 用品
31,ペット,犬・猫のペット保険ならアイペット損保【23個のNo.1受賞】,https://www.ipet-ins.com/,ペット保険のアイペット損保公式サイト。全国すべての動物病院で利用可能。日々の通院から高額になりがちな手術まで充実補償。新規加入は12歳11か月まで。・ペット保険のポイント： ・ペット保険申込書の記入例・重要事項説明書： ・返信用封筒,32,ﾍﾟｯﾄ 保険 ｱｲ ﾍﾟｯﾄ 損保 公式 ｻｲﾄ 全国 すべて 動物 病院 利用 日々 通院 高額 なり 手術 充実 補償 加入 0 0 か月 ﾍﾟｯﾄ 保険 ﾎﾟｲﾝﾄ ﾍﾟｯﾄ 保険 申込 記入 例 事項 説明 返信 封筒
32,ペット,ペット情報総合サイトPETPET,https://www.petpet.ne.jp/,ペット情報総合サイト「PETPET」。全国動物病院検索、その他ペット同伴可能飲食店やトリミングサロン、ペットショップ検索、ペットと泊まれる宿検索など。,33,ﾍﾟｯﾄ 情報 総合 ｻｲﾄ PETPET 全国 動物 病院 検索 他 ﾍﾟｯﾄ 同伴 飲食 ﾄﾘﾐﾝｸﾞ ｻﾛﾝ ﾍﾟｯﾄ ｼｮｯﾌﾟ 検索 ﾍﾟｯﾄ 泊まれる 宿 検索
33,ペット,ペット｜ホームセンター通販 - カインズ,https://www.cainz.com/pet/,犬と暮らす毎日を、もっと心地よく快適に。 ペットシーツやドッグフードなど、暮らしに欠かせないアイテムはもちろん、ワンちゃんにとって心地よさを追求したペットベット ...,34,犬 暮らす 毎日 心地よく 快適 ﾍﾟｯﾄ ｼｰﾂ ﾄﾞｯｸﾞ ﾌｰﾄﾞ 暮らし 欠かせ ｱｲﾃﾑ ﾜﾝ とっ 心地よ 追求 し ﾍﾟｯﾄ ﾍﾞｯﾄ
34,ペット,18周年 e-net shop Pet館～ペット館,https://www.rakuten.ne.jp/gold/dog-kan/,ペットシーツ・猫砂を送料無料で格安販売！業務用にもオススメ！犬猫フード・グッズ専門店 Pet館.,35,ﾍﾟｯﾄ ｼｰﾂ 猫砂 送料 無料 販売 業務 ｽｽﾒ 犬猫 ﾌｰﾄﾞ ｸﾞｯｽﾞ 専門 Pet
35,ペット,保険料かんたんお見積り - ペット保険 | SBIいきいき少額短期保険,https://www.i-sedai.com/pet/apply/estimate.html,※お申し込みいただけるのは、生後2か月から11歳11か月までとなります。 ペットの区分. 犬の場合、サイズを一覧でご確認のうえ、選択ください。一覧はこちら.,36,申し込み いただける 生後 0 か月 0 0 か月 なり ﾍﾟｯﾄ 区分 犬 場合 ｻｲｽﾞ 一覧 確認 うえ 選択 ください 一覧
36,ペット,ペットの災害対策 [動物の愛護と適切な管理] - 環境省,https://www.env.go.jp/nature/dobutsu/aigo/1_law/disaster.html,十分な水や食料の他、常備薬等も用意し、避難所や避難ルートを確認しておく等、いざというときに慌てないように、ペットに基本的なしつけをし、備えておきましょう。避難 ...,37,水 食料 他 常備 用意 し 避難 避難 ﾙｰﾄ 確認 し おく いう とき 慌て ﾍﾟｯﾄ 基本 しつけ し 備え おき 避難
37,ペット,ペット（各種相談の件数や傾向） - 国民生活センター,http://www.kokusen.go.jp/soudan_topics/data/pet.html,ペットショップで購入したウサギが、先天性の病気だった。書面には「生体のため保証はありません」と書かれていたが、解約できないのか。 生後2カ月の犬を購入 ...,38,ﾍﾟｯﾄ ｼｮｯﾌﾟ 購入 し ｳｻｷﾞ 先天 病気 書面 生体 ため 保証 あり 書か い 解約 でき 生後 0 ｶ月 犬 購入
38,ペット,ドッグフード・キャットフード・ペットフードのペットライン,https://www.petline.co.jp/,ペットライン株式会社は、国内に研究開発センターと製造工場を持ち、愛犬・愛猫の健康を第一に考えた安心・安全なドッグフード・キャットフードをお届けするペット ...,39,ﾍﾟｯﾄ ﾗｲﾝ 株式 会社 国内 研究 開発 ｾﾝﾀｰ 製造 工場 持ち 愛犬 愛猫 健康 一 考え 安心 安全 ﾄﾞｯｸﾞﾌｰﾄﾞ･ｷｬｯﾄﾌｰﾄﾞ 届け する ﾍﾟｯﾄ
39,ペット,ペットの求人 - 東京都 港区 - インディード,https://jp.indeed.com/%E3%83%9A%E3%83%83%E3%83%88%E9%96%A2%E9%80%A3%E3%81%AE%E6%B1%82%E4%BA%BA%E6%9D%B1%E4%BA%AC%E9%83%BD-%E6%B8%AF%E5%8C%BA,Indeed.com で東京都 港区のペットの592件の検索結果: ペットショップスタッフ、接客、ペットシッターなどの求人を見る。,40,Indeed com 東京 都 港 区 ﾍﾟｯﾄ 0 件 検索 結果 ﾍﾟｯﾄ ｼｮｯﾌﾟ ｽﾀｯﾌ 接客 ﾍﾟｯﾄ ｼｯﾀｰ 求人 見る
40,ペット,ペット保険シェアNo.1の【アニコム損保】公式サイト,https://www.anicom-sompo.co.jp/,ペット保険シェア10年連続NO.1の「アニコム損保」の公式サイト。選ばれている理由は、圧倒的な保険の使いやすさ！全国6400以上の動物病院の窓口での精算や、LINEでの ...,41,ﾍﾟｯﾄ 保険 ｼｪｱ 0 年 連続 NO 0 ｱﾆｺﾑ 損保 公式 ｻｲﾄ 選ば いる 理由 圧倒 保険 使い 全国 0 以上 動物 病院 窓口 精算 LINE
41,ペット,港区芝浦の動物病院なら、芝浦ペットクリニック,https://www.doc-shibaura.com/,犬・猫の診療、往診、手術、トリミングなら芝浦ペットクリニック。日の出駅・芝浦ふ頭駅より徒歩6分、田町駅より徒歩8分、土曜・日曜も診療しているとても通いやすい ...,42,犬 猫 診療 往診 手術 ﾄﾘﾐﾝｸﾞ 芝浦 ﾍﾟｯﾄ ｸﾘﾆｯｸ 日の出 駅 芝浦 ふ頭 駅 徒歩 0 分 田町 駅 徒歩 0 分 土曜 日曜 診療 し いる 通い
42,ペット,【公式】月々730円からのペット保険｜楽天ペット保険,https://www.rakuten-ssi.co.jp/,【月々730円からのペット保険！】楽天少額短期保険の公式サイト。楽天ペット保険「ずっといっしょ[もっと]」は保険料で楽天ポイントも貯まります。,43,月々 0 円 ﾍﾟｯﾄ 保険 楽天 少額 短期 保険 公式 ｻｲﾄ 楽天 ﾍﾟｯﾄ 保険 いっしょ 保険 楽天 ﾎﾟｲﾝﾄ 貯まり
43,ペット,『ペット2』2019.12.4[Wed] リリース - NBCユニバーサル ...,https://www.nbcuni.co.jp/movie/sp/pets2/,『ペット2』2019.12.4[Wed] リリース. 商品ページ · HOME. 『ペット2』2019.12.4[Wed] リリース. ご購入はこちら. amazon; HMV ONLINE; セブンネットショッピング ...2019/12/04 · アップロード元: NBCユニバーサル アジア,44,ﾍﾟｯﾄ 0 0 0 0 Wed ﾘﾘｰｽ 商品 ﾍﾟｰｼﾞ HOME ﾍﾟｯﾄ 0 0 0 0 Wed ﾘﾘｰｽ 購入 amazon HMV ONLINE ｾﾌﾞﾝ ﾈｯﾄ ｼｮｯﾋﾟﾝｸﾞ 0 0 0 ｱｯﾌﾟﾛｰﾄﾞ 元 NBC ｱｼﾞｱ
