,keyword,site_name,URL,snippet,ranking,target
59,マック,MAQ inc.,https://www.maq.co.jp/,東京、大阪のクリエイティブカンパニー、MAQ inc.（株式会社マック）。広告制作、グラフィックデザイン、ウェブ制作など。,60,東京 大阪 ｶﾝﾊﾟﾆｰ MAQ inc 株式 会社 ﾏｯｸ 広告 制作 ｸﾞﾗﾌｨｯｸ ﾃﾞｻﾞｲﾝ ｳｪﾌﾞ 制作
60,マック,macpac - マックパックブランドサイト - GOLDWIN,https://www.goldwin.co.jp/macpac/,ニュージーランドの自然環境が生んだシンプルで機能的なバック、リュックを幅広く展開するアウトドアブランド。株式会社ゴールドウインが運営するmacpac公式オンライン ...,61,ﾆｭｰｼﾞｰﾗﾝﾄﾞ 自然 環境 生ん 機能 ﾊﾞｯｸ ﾘｭｯｸ 幅広く 展開 する ｱｳﾄﾄﾞｱ ﾌﾞﾗﾝﾄﾞ 株式 会社 ｺﾞｰﾙﾄﾞ ｳｲﾝ 運営 する macpac 公式 ｵﾝ ﾗｲﾝ
61,マック,計測・試験のトータルプランナー 株式会社マックシステムズ,https://www.macsystems.co.jp/,株式会社マックシステムズは計測・試験のトータルプランナーとして、最新の情報と技術で最適な計測・試験システムをご提案いたします。,62,株式 会社 ﾏｯｸ ｼｽﾃﾑｽﾞ 計測 試験 ﾄｰﾀﾙ ﾌﾟﾗﾝﾅｰ し 最新 情報 技術 計測 試験 ｼｽﾃﾑ 提案 いたし
62,マック,管・弦楽器の専門商社 マックコーポレーション株式会社,http://www.maccorp.co.jp/,マックコーポレーションは管楽器、弦楽器、二胡の専門商社です。 マックコーポレーション株式会社. TOP 会社概要 修理に関して お問合せ English.,63,ﾏｯｸ ｺｰﾎﾟﾚｰｼｮﾝ 管楽 弦 楽器 二胡 専門 商社 ﾏｯｸ ｺｰﾎﾟﾚｰｼｮﾝ 株式 会社 TOP 会社 概要 修理 関し 問合せ English
63,マック,Janice Mac Avoy - Fried Frank,https://www.friedfrank.com/macavja,"Mac Avoy concentrates her practice in complex real estate-related transactions and disputes, commercial litigation and arbitration, complex commercial landlord ...",64,Mac Avoy concentrates her practice in complex real estate related transactions and disputes commercial litigation and arbitration complex commercial landlord
64,マック,"Mac McCaughan - Albums, Songs, and News | Pitchfork",https://pitchfork.com/artists/6231-mac-mccaughan/,"The Superchunk frontman, Merge Records honcho, and overall indie rock immortal talks to Jayson Greene about the music of his life: combining Donald Duck and ...",65,The Superchunk frontman Merge Records honcho and overall indie rock immortal talks to Jayson Greene about the music of his life combining Donald Duck and
65,マック,Mack Trucks Home,https://www.macktrucks.com/,"Mack Trucks Home, Mack Trucks are built to last. Every semi truck is born ready for the toughest road conditions and long haul challenges.",66,Mack Trucks Home Mack Trucks are built to last Every semi truck is born ready for the toughest road conditions and long haul challenges
66,マック,MAC 24/7 Waikiki,https://mac247waikiki.com/,"Inside the Hilton Waikiki Beach - 2500 Kuhio Avenue, Waikiki Beach, HI 96815 | tel: 808.921.5564 Currently open 6:00 am - 10:00 pm. M.A.C. 24/7 Waikiki.",67,Inside the Hilton Waikiki Beach 0 Kuhio Avenue Waikiki Beach HI 0 tel 0 0 0 Currently open 0 0 am 0 0 pm M A C 0 0 Waikiki
67,マック,マックのバーガーに金属片 調理器具か、客の歯欠ける,https://www.nikkei.com/article/DGXZQOUE17DLM0X10C21A9000000/,20 hours ago — 福岡市中央区のマクドナルド天神西通り店で女性客（26）が金属片のようなものが入ったハンバーガーを食べ、歯が欠けたことが17日、日本マクドナルド ...,68,0 hours ago 福岡 市 中央 区 ﾏｸﾄﾞﾅﾙﾄﾞ 天神 西 通り 女性 客 0 金属 もの 入っ ﾊﾝﾊﾞｰｶﾞｰ 食べ 歯 欠け こと 0 日本 ﾏｸﾄﾞﾅﾙﾄﾞ
68,マック,NYC Mac Truck,https://mactrucknyc.com/,"NYC's Mac and Cheese Truck. The mac and cheese we're famous for, now delivered right to your door! Order mac and cheese online from NYC's Mac and Cheese ...",69,NYC s Mac and Cheese Truck The mac and cheese we re famous for now delivered right to your door Order mac and cheese online from NYC s Mac and Cheese
69,マック,"Apple Mac Computers, iPads & Accessories from MacMall",https://www.tigerdirect.com/applications/campaigns/deals.asp?campaignid=3873,"Apple Mac Computers, iPads & Accessories from MacMall, The #1 Mac Warehouse.",70,Apple Mac Computers iPads Accessories from MacMall The 0 Mac Warehouse
70,マック,Mac Jones Draft and Combine Prospect Profile | NFL.com,https://www.nfl.com/prospects/mac-jones/32004a4f-4e58-6540-bb7f-c07b995d57a4,"All Combine and Draft-Related Analysis, News, Video, and Biographical Information for Mac Jones.",71,All Combine and Draft Related Analysis News Video and Biographical Information for Mac Jones
71,マック,bmac scissors,https://bmac-scissors.jp/,bmac scissors（株式会社マック）のホームページです。新潟県燕市を拠点に理・美容師用のハサミをつくり続けています。,72,bmac scissors 株式 会社 ﾏｯｸ ﾎｰﾑ ﾍﾟｰｼﾞ 新潟 県 燕 市 拠点 理 美容 ﾊｻﾐ つくり 続け い
72,マック,BACON MAC N' CHEESE | Bubby's | NYC,https://www.bubbys.com/store/product/bacon-mac-n-cheese/,"BACON MAC N' CHEESE. $95.00. Serves 12. Quantity. Add Ins. Add serving utensils, cutlery, and plates. Add To Cart Please check errors in the form above.",73,BACON MAC N CHEESE 0 0 Serves 0 Quantity Add Ins Add serving utensils cutlery and plates Add To Cart Please check errors in the form above
73,マック,MACnyc - Manhattan Association of Cabarets,https://macnyc.com/,"MAC's mission is to advance the art and business of live entertainment. Members of MAC include cabaret, comedy and jazz artists as well as directors, musical ...",74,MAC s mission is to advance the art and business of live entertainment Members of MAC include cabaret comedy and jazz artists as well as directors musical
74,マック,How to Download and Install Panopto for Mac,https://support.panopto.com/s/article/Install-Panopto-for-Mac,"Apr 6, 2021 — OS Version - Mac OSX versions 10.15, supported. · Processor - Standard Quality: Intel Core i3 or Core M recommended - Default Setting.",75,Apr 0 0 OS Version Mac OSX versions 0 0 supported Processor Standard Quality Intel Core i 0 or Core M recommended Default Setting
75,マック,MacinCloud - Rent a Mac in the Cloud! - Mac in Cloud,https://www.macincloud.com/,"MacinCloud is a Mac cloud platform that provides on-demand Mac cloud servers, flexible dev workload infrastructure and comprehensive Mac in the Cloud ...",76,MacinCloud is a Mac cloud platform that provides on demand Mac cloud servers flexible dev workload infrastructure and comprehensive Mac in the Cloud
76,マック,MAC(マック) - BUYMA,https://www.buyma.com/brand/MAC_%E3%83%9E%E3%83%83%E3%82%AF.html,【BUYMA】MAC(マック)の最新作から定番人気アイテムまで徹底網羅。日本未入荷や入手困難なレアアイテムも全世界のパーソナルショッパーからいますぐ買える！,77,BUYMA MAC ﾏｯｸ 最新 定番 人気 ｱｲﾃﾑ 徹底 網羅 日本 入荷 入手 困難 ﾚｱ ｱｲﾃﾑ 世界 ﾊﾟｰｿﾅﾙ ｼｮｯﾊﾟｰ いま 買える
77,マック,M.A.C Cosmetics | Times Square NYC,https://www.timessquarenyc.org/locations/mac-cosmetics,"M.A.C Cosmetics. 1540 Broadway New York, New York 10036. (646) 355-0296. Get Directions. M·A·C is the world's leading professional makeup authority because ...",78,M A C Cosmetics 0 Broadway New York New York 0 0 0 0 Get Directions M A C is the world s leading professional makeup authority because
78,マック,【最新情報】「マクドナルド」 - もぐナビ,https://mognavi.jp/brand/2701,マクドナルドのランキングをチェック. 「マクドナルド」の「ドリンク」のおすすめ人気ランキング. マクドナルド マックカフェ バイ バリスタ オレンジフレーバーラテ.,79,ﾏｸﾄﾞﾅﾙﾄﾞ ﾗﾝｷﾝｸﾞ ﾁｪｯｸ ﾏｸﾄﾞﾅﾙﾄﾞ ﾄﾞﾘﾝｸ すすめ 人気 ﾗﾝｷﾝｸﾞ ﾏｸﾄﾞﾅﾙﾄﾞ ﾏｯｸ ｶﾌｪ ﾊﾞｲ ﾊﾞﾘｽﾀ ｵﾚﾝｼﾞ ﾌﾚｰﾊﾞｰ ﾗﾃ
79,マック,おうちで「ビッグマック」をつくる方法【ハンバーガーとソース,https://www.esquire.com/jp/lifestyle/food-drink/a32737021/how-to-make-bigmac-hamburger-in-your-home/,"Jun 3, 2020 — 世界で最も有名なハンバーガーである、マクドナルドのビッグマック。つくり方はとてもシンプルで特別な材料は必要ありません。ここでは、ビッグマック ...",80,Jun 0 0 世界 ﾊﾝﾊﾞｰｶﾞｰ ある ﾏｸﾄﾞﾅﾙﾄﾞ ﾏｯｸ つくり 材料 必要 あり ﾏｯｸ
80,マック,"Mac Jones Stats, News, Bio | ESPN",https://www.espn.com/nfl/player/_/id/4241464/mac-jones,"Latest on New England Patriots quarterback Mac Jones including news, stats, videos, highlights and more on ESPN.",81,Latest on New England Patriots quarterback Mac Jones including news stats videos highlights and more on ESPN
81,マック,"SecureMac – Mac Security News, Apple Advisories, Reviews ...",https://www.securemac.com/,"SecureMac - Mac Security News, Apple Advisories, Reviews and Software for Everything Apple and Mac.",82,SecureMac Mac Security News Apple Advisories Reviews and Software for Everything Apple and Mac
82,マック,大屋グループ｜ドラッグストアmac｜TSUTAYA｜養老乃瀧 ...,https://www.daiya-grp.co.jp/,大屋グループの企業サイト。愛媛県西条市、株式会社大屋。四国を中心としたドラッグストアなどの運営。,83,大屋 ｸﾞﾙｰﾌﾟ 企業 ｻｲﾄ 愛媛 県 西条 市 株式 会社 大屋 四国 中心 し ﾄﾞﾗｯｸﾞｽﾄｱ 運営
83,マック,"MacUpdate | Download Best Mac Software | 30,000+ Free Apps",https://www.macupdate.com/,First launched back in 1997 - MacUpdate is the most popular and complete Mac software directory. Download and read reviews of the best apps for your Mac.,84,First launched back in 0 MacUpdate is the most popular and complete Mac software directory Download and read reviews of the best apps for your Mac
84,マック,Mac and Bob's Restaurant,https://www.macandbobs.com/,"Mac and Bobs in Salem VA, a 15 minute drive from downtown Roanoke, offers the famous calzone, American food and over 80 beers on tap.",85,Mac and Bobs in Salem VA a 0 minute drive from downtown Roanoke offers the famous calzone American food and over 0 beers on tap
85,マック,Grammarly for Mac,https://www.grammarly.com/native/mac,"for Mac. Harness the power of Grammarly on your desktop. For mobile devices, try the Grammarly Keyboard. Google Play. Conveniently accessible through a Mac",86,for Mac Harness the power of Grammarly on your desktop For mobile devices try the Grammarly Keyboard Google Play Conveniently accessible through a Mac
86,マック,中古Mac専門店 -Macパラダイス-,https://www.mac-paradise.com/,中古マック専門店Macパラダイス。中古Mac本体からMac周辺機器、Macパーツまで幅広い品揃えです！！,87,中古 ﾏｯｸ 専門 Mac ﾊﾟﾗﾀﾞｲｽ 中古 Mac 本体 Mac 周辺 機器 Mac ﾊﾟｰﾂ 幅広い 品揃え
87,マック,CleanMyMac X: Make Your Mac As Good As New,https://cleanmymac.com/,"Here's the only legit tool for a health check, Mac speed up and protection. Get a smoothly-running system in no time — CleanMyMac X is incredibly easy to ...",88,Here s the only legit tool for a health check Mac speed up and protection Get a smoothly running system in no time CleanMyMac X is incredibly easy to
88,マック,Mrs. Mac's Kitchen | American Seafood Restaurant | Key ...,https://www.mrsmacskitchen.com/,"Welcome to Mrs. Mac's Kitchen! We are an American Seafood Restaurant with two locations in Key Largo, FL. One of our locations is located at 99336 Overseas ...",89,Welcome to Mrs Mac s Kitchen We are an American Seafood Restaurant with two locations in Key Largo FL One of our locations is located at 0 Overseas
89,マック,Fleetwood Mac - Official Site,https://www.fleetwoodmac.com/,Fleetwood Mac is celebrating half a century of music with a new tour and a new 50-song collection – '50 Years – Don't Stop'. Featuring hits and essentials ...,90,Fleetwood Mac is celebrating half a century of music with a new tour and a new 0 song collection 0 Years Don t Stop Featuring hits and essentials
90,マック,"MAC Cosmetics, Makeup, & Skin Care - Macy's",https://www.macys.com/shop/makeup-and-perfume/mac-cosmetics?id=45678,"Aug 18, 2021 — Looking for the best collection of MAC cosmetics? Find the perfect MAC foundations, powders, eye shadows, lipsticks, and more at Macy's.",91,Aug 0 0 Looking for the best collection of MAC cosmetics Find the perfect MAC foundations powders eye shadows lipsticks and more at Macy s
91,マック,Big Mac index worldwide 2021 - Statista,https://www.statista.com/statistics/274326/big-mac-index-global-prices-for-a-big-mac/,"Sep 10, 2021 — Switzerland topped the July 2020 Big Mac index, with a Big Mac costing 6.91 U.S. dollars. By comparison, the concurrent cost in the U.S. was ...",92,Sep 0 0 Switzerland topped the July 0 Big Mac index with a Big Mac costing 0 0 U S dollars By comparison the concurrent cost in the U S was
92,マック,"The Mac Observer - Apple iPhone, Mac, Watch and iPad ...",https://www.macobserver.com/,"Apple iPhone, Mac, Apple Watch, and iPad News, Opinions, Tips and Podcasts.",93,Apple iPhone Mac Apple Watch and iPad News Opinions Tips and Podcasts
93,マック,Alfred - Productivity App for macOS,https://www.alfredapp.com/,"Alfred is a productivity application for macOS, which boosts your efficiency with hotkeys, keywords and text expansion. Search your Mac and the web, ...",94,Alfred is a productivity application for macOS which boosts your efficiency with hotkeys keywords and text expansion Search your Mac and the web
94,マック,MENEHUNE MAC - Home,https://www.menehunemac.com/,"Founded in 1939, Menehune Mac is the oldest existing manufacturer of macadamia nut candies in Hawaii. With a commitment to quality and tradition, ...",95,Founded in 0 Menehune Mac is the oldest existing manufacturer of macadamia nut candies in Hawaii With a commitment to quality and tradition
95,マック,MacConnection: Apple Authorized Reseller,https://www.macconnection.com/,Extensive selection of quality Mac products. Receive great benefits buying Apple from an authorized reseller and get helpful service and fast delivery.,96,Extensive selection of quality Mac products Receive great benefits buying Apple from an authorized reseller and get helpful service and fast delivery
96,マック,ジャスマックプラザホテル,https://www.jasmacplaza.jp/,札幌のホテル・温泉・日帰り温泉・宴会・パーティー・結婚式ならジャスマックプラザ。すすきのからも徒歩ですぐ。圧倒的スケールの天然温泉が人気です。,97,札幌 ﾎﾃﾙ 温泉 日帰り 温泉 宴会 ﾊﾟｰﾃｨｰ 結婚 ｼﾞｬ ｽﾏｯｸ ﾌﾟﾗｻﾞ すすきの 徒歩 圧倒 ｽｹｰﾙ 天然 温泉 人気
97,マック,マック 人気記事（一般）｜アメーバブログ,https://blogtag.ameba.jp/detail/%E3%83%9E%E3%83%83%E3%82%AF,マックに関する一般一般の人気記事です。'|'2021/09/16 ※閲覧注意'|'マックの月見パイ♡'|'ピクルス…あたしも大きなってからやな〜。の、話。'|'岡山県のマックに人の ...,98,ﾏｯｸ 関する 一般 一般 人気 記事 0 0 0 閲覧 注意 ﾏｯｸ 月見 ﾊﾟｲ ﾋﾟｸﾙｽ 大き なっ 話 岡山 県 ﾏｯｸ 人
