,keyword,site_name,URL,snippet,ranking,target
0,マック,マクドナルド公式サイト | McDonald's Japan,https://www.mcdonalds.co.jp/,新商品「濃厚とろ～り月見」「和三盆きなこ味の月見 マックシェイク®」や、「黒みつとわらびもちの月見 マックフルーリー®」など全8種類が勢揃い！ 夜マック ポテナゲ ...,1,商品 月見 和 三盆 きなこ 味 月見 ﾏｯｸｼｪｲｸ 黒み わらびもち 月見 ﾏｯｸﾌﾙｰﾘｰ 0 種類 勢揃い 夜 ﾏｯｸ ﾎﾟﾃﾅｹﾞ
1,マック,マクドナルド公式サイト | McDonald's Japan,https://www.mcdonalds.co.jp/,新商品「濃厚とろ～り月見」「和三盆きなこ味の月見 マックシェイク®」や、「黒みつとわらびもちの月見 マックフルーリー®」など全8種類が勢揃い！ 夜マック ポテナゲ ...,2,商品 月見 和 三盆 きなこ 味 月見 ﾏｯｸｼｪｲｸ 黒み わらびもち 月見 ﾏｯｸﾌﾙｰﾘｰ 0 種類 勢揃い 夜 ﾏｯｸ ﾎﾟﾃﾅｹﾞ
2,マック,マクドナルド - Wikipedia,https://ja.wikipedia.org/wiki/%E3%83%9E%E3%82%AF%E3%83%89%E3%83%8A%E3%83%AB%E3%83%89,地域によっては宗教上の観点から特定あるいは一切の肉類を食せない顧客向けに、鶏肉を使った「チキンマハラジャマック（Chicken Maharaja Mac）」「チキンマックカレーパン ...,3,地域 よっ 宗教 観点 特定 一切 肉類 食せ 顧客 鶏肉 使っ ﾁｷﾝ ﾏﾊﾗｼﾞｬ ﾏｯｸ Chicken Maharaja Mac ﾁｷﾝﾏｯｸｶﾚｰﾊﾟﾝ
3,マック,マクドナルド - Wikipedia,https://ja.wikipedia.org/wiki/%E3%83%9E%E3%82%AF%E3%83%89%E3%83%8A%E3%83%AB%E3%83%89,地域によっては宗教上の観点から特定あるいは一切の肉類を食せない顧客向けに、鶏肉を使った「チキンマハラジャマック（Chicken Maharaja Mac）」「チキンマックカレーパン ...,4,地域 よっ 宗教 観点 特定 一切 肉類 食せ 顧客 鶏肉 使っ ﾁｷﾝ ﾏﾊﾗｼﾞｬ ﾏｯｸ Chicken Maharaja Mac ﾁｷﾝﾏｯｸｶﾚｰﾊﾟﾝ
4,マック,マック (ゲール語) - Wikipedia,https://ja.wikipedia.org/wiki/%E3%83%9E%E3%83%83%E3%82%AF_(%E3%82%B2%E3%83%BC%E3%83%AB%E8%AA%9E),マック、マク (mac) は、ゲール語（アイルランド語、スコットランド・ゲール語など）で「息子」を意味する言葉。現代のアイルランド語やスコットランド・ゲール語 ...,5,ﾏｯｸ mac ｹﾞｰﾙ 語 ｱｲﾙﾗﾝﾄﾞ 語 ｽｺｯﾄﾗﾝﾄﾞ ｹﾞｰﾙ 語 息子 意味 する 言葉 現代 ｱｲﾙﾗﾝﾄﾞ 語 ｽｺｯﾄﾗﾝﾄﾞ ｹﾞｰﾙ 語
5,マック,Mac - Apple（日本）,https://www.apple.com/jp/mac/,Macの世界へようこそ。MacBook Pro、iMac Pro、MacBook Air、iMacなど、Macのラインナップを紹介します。製品の情報も、購入も、サポートも、すべてAppleのウェブ ...,6,Mac 世界 よう MacBook Pro iMac Pro MacBook Air iMac Mac ﾗｲﾝﾅｯﾌﾟ 紹介 し 製品 情報 購入 ｻﾎﾟｰﾄ すべて Apple ｳｪﾌﾞ
6,マック,Mac - Apple（日本）,https://www.apple.com/jp/mac/,Macの世界へようこそ。MacBook Pro、iMac Pro、MacBook Air、iMacなど、Macのラインナップを紹介します。製品の情報も、購入も、サポートも、すべてAppleのウェブ ...,7,Mac 世界 よう MacBook Pro iMac Pro MacBook Air iMac Mac ﾗｲﾝﾅｯﾌﾟ 紹介 し 製品 情報 購入 ｻﾎﾟｰﾄ すべて Apple ｳｪﾌﾞ
7,マック,Mac computers - Apple,https://www.apple.com/mac/,"Explore the world of Mac. Check out MacBook Pro, MacBook Air, iMac, Mac mini, and more. Visit the Apple site to learn, buy, and get support.",8,Explore the world of Mac Check out MacBook Pro MacBook Air iMac Mac mini and more Visit the Apple site to learn buy and get support
8,マック,マックデリバリー,https://mcdelivery.mcdonalds.com/jp/,ログインしてスタート. Text Input: Password: ログイン. パスワードをお忘れの方. 初めてご利用のお客様. 会員登録すると、2回目以降簡単にご注文いただけます。,9,ﾛｸﾞ ｲﾝ し ｽﾀｰﾄ Text Input Password ﾛｸﾞ ｲﾝ ﾊﾟｽﾜｰﾄﾞ 忘れ 方 利用 客 会員 登録 する 0 回 以降 注文 いただけ
9,マック,MAC Cosmetics | Beauty and Makeup Products - Official Site,https://www.maccosmetics.com/,"Offering more than 100 shades of professional quality cosmetics for All Ages, All Races, and All Genders. Enjoy free shipping and returns on all orders.",10,Offering more than 0 shades of professional quality cosmetics for All Ages All Races and All Genders Enjoy free shipping and returns on all orders
10,マック,マックハンバーガーに金属片、客の歯欠ける - Yahoo!ニュース,https://news.yahoo.co.jp/articles/dab983b69b642c7be31c91fee1691e1f5f45b77f,マックハンバーガーに金属片、客の歯欠ける ... 福岡市のマクドナルド天神西通り店で女性客が金属片のようなものが入ったハンバーガーを食べ、歯が欠けたことが17日、日本 ...,11,ﾏｯｸ ﾊﾝﾊﾞｰｶﾞｰ 金属 客 歯 欠ける 福岡 市 ﾏｸﾄﾞﾅﾙﾄﾞ 天神 西 通り 女性 客 金属 もの 入っ ﾊﾝﾊﾞｰｶﾞｰ 食べ 歯 欠け こと 0 日本
11,マック,マック MAC リップスティック お値打ち価格で マックレッド,http://bovinosbrewery.com/Bulgari435995.html,1190円 マック MAC リップスティック 【マックレッド】 マック MAC リップスティック 【マックレッド】 美容・コスメ・香水 ベースメイク・メイクアップ 口紅・リップ ...,12,0 円 ﾏｯｸ MAC ﾘｯﾌﾟ ｽﾃｨｯｸ ﾏｯｸ ﾚｯﾄﾞ ﾏｯｸ MAC ﾘｯﾌﾟ ｽﾃｨｯｸ ﾏｯｸ ﾚｯﾄﾞ 美容 ｺｽﾒ 香水 ﾍﾞｰｽﾒｲｸ･ﾒｲｸｱｯﾌﾟ 口紅 ﾘｯﾌﾟ
12,マック,マクドナルド - Google Play のアプリ,https://play.google.com/store/apps/details?id=jp.co.mcdonalds.android&hl=ja&gl=US,"セキュリティ上の理由のため、Android 6.0 未満のOSのサポートを近日中に終了します。最新バージョンのご利用を続けるためには、OSのアップデートをお願いいたします。 Rating: 3.4 · ‎154,124 votes · ‎Free · ‎Android",13,ｾｷｭﾘﾃｨ 理由 ため Android 0 0 未満 OS ｻﾎﾟｰﾄ 近日 終了 し 最新 ﾊﾞｰｼﾞｮﾝ 利用 続ける ため OS ｱｯﾌﾟﾃﾞｰﾄ 願い いたし Rating 0 0 0 0 votes Free Android
13,マック,Mac | Downloads | Slack,https://slack.com/downloads/mac,"Download Slack for free for mobile devices and desktop. Keep up with the conversation with our apps for iOS, Android, Mac, Windows and Linux.",14,Download Slack for free for mobile devices and desktop Keep up with the conversation with our apps for iOS Android Mac Windows and Linux
14,マック,株式会社マック,https://www.mac-inc.co.jp/,株式会社マックは、医療機器や医療消耗品販売、病院施設の企画で、医療の現場で尊い命を支えるお手伝いをいたします。,15,株式 会社 ﾏｯｸ 医療 機器 医療 消耗 販売 病院 施設 企画 医療 現場 尊い 命 支える 手伝い いたし
15,マック,女性「歯が欠けた」 調理器具の部品か：朝日新聞デジタル,https://www.asahi.com/articles/ASP9K6HDNP9KULFA03Z.html,マックのバーガーから異物、女性「歯が欠けた」 調理器具の部品か. 2021/9/17 20:10. 日本マクドナルドは17日、福岡市中央区のマクドナルド天神西通り店で買った ...,16,ﾏｯｸ ﾊﾞｰｶﾞｰ 異物 女性 歯 欠け 調理 器具 部品 0 0 0 0 0 日本 ﾏｸﾄﾞﾅﾙﾄﾞ 0 福岡 市 中央 区 ﾏｸﾄﾞﾅﾙﾄﾞ 天神 西 通り 買っ
16,マック,マック株式会社,http://mac-net.co.jp/,マックのトンネル計測システム. ... MAC マック株式会社. Phone: 047-371-3191. Location: 〒272-0832 千葉県市川市曽谷8-16-3. HOME · 新着情報 · 会社案内 ...,17,ﾏｯｸ ﾄﾝﾈﾙ 計測 ｼｽﾃﾑ MAC ﾏｯｸ 株式 会社 Phone 0 0 0 Location 0 0 千葉 県 市川 市 曽 谷 0 0 0 HOME 新着 情報 会社 案内
17,マック,Mac Tools® Professional Automotive Tools Official Site,https://www.mactools.com/,"Worldwide supplier of automotive hand tools, toolboxes, power tools, electronics, and shop equipment. Mac Tools defines quality, innovation, and service.",18,Worldwide supplier of automotive hand tools toolboxes power tools electronics and shop equipment Mac Tools defines quality innovation and service
18,マック,Mac (@macmiller) • Instagram photos and videos,https://www.instagram.com/macmiller/?hl=ja,"6.9m Followers, 544 Following, 23 Posts - See Instagram photos and videos from Mac (@macmiller)",19,0 0 m Followers 0 Following 0 Posts See Instagram photos and videos from Mac macmiller
19,マック,マックハウス公式ファッションストア | Mac-House,https://www.mac-house.co.jp/,マックハウスの公式通販サイト。メンズ、ウィメンズ、キッズの衣料品やインナー、グッズ等を多数取り揃えています。3900円(税込)以上お買上げで送料無料。,20,ﾏｯｸ ﾊｳｽ 公式 通販 ｻｲﾄ ﾒﾝｽﾞ ｳｨﾒﾝｽﾞ ｷｯｽﾞ 衣料 ｲﾝﾅｰ ｸﾞｯｽﾞ 多数 取り揃え い 0 円 税込 以上 買上げ 送料 無料
20,マック,Malwarebytes Antivirus for Mac,https://www.malwarebytes.com/mac,"Malwarebytes Antivirus for Mac scans & removes viruses, adware, ransomware & other Mac malware. The Mac antivirus protects you & your mac so it keeps ...",21,Malwarebytes Antivirus for Mac scans removes viruses adware ransomware other Mac malware The Mac antivirus protects you your mac so it keeps
21,マック,HOME|マック株式会社は堺市で包丁の製造・販売を行ってい ...,https://mactheknife.co.jp/,マック株式会社は安全で良く切れる包丁を製造しています。ギフトからプロ用まで、幅広い商品を取り揃えております。一度使うと手放せない切れ味をお確かめください.,22,ﾏｯｸ 株式 会社 安全 切れる 包丁 製造 し い ｷﾞﾌﾄ ﾌﾟﾛ 幅広い 商品 取り揃え おり 一 度 使う 手放せ 切れ味 確かめ ください
22,マック,Install Docker Desktop on Mac,https://docs.docker.com/desktop/mac/install/,"Mac with Intel chip  . macOS must be version 10.14 or newer. That is, Mojave, Catalina, or Big Sur. We recommend upgrading to the latest version ...",23,Mac with Intel chip macOS must be version 0 0 or newer That is Mojave Catalina or Big Sur We recommend upgrading to the latest version
23,マック,Burgernomics The Big Mac index - The Economist,https://www.economist.com/big-mac-index,"Jul 21, 2021 — THE BIG MAC index was invented by The Economist in 1986 as a lighthearted guide to whether currencies are at their “correct” level.",24,Jul 0 0 THE BIG MAC index was invented by The Economist in 0 as a lighthearted guide to whether currencies are at their correct level
24,マック,Freddie Mac - We Make Home Possible,http://www.freddiemac.com/,We are supporting America's homeowners and renters while serving as a stabilizing force in the U.S. housing finance system.,25,We are supporting America s homeowners and renters while serving as a stabilizing force in the U S housing finance system
25,マック,"Macworld - News, Tips & Reviews from the Apple Experts",https://www.macworld.com/,Recover Deleted Texts · iPhone 'Other' Storage · Free macOS Apps · iPhone 12 Deals · Best Mac Antivirus · Best Mac VPNs · iOS 14.5.,26,Recover Deleted Texts iPhone Other Storage Free macOS Apps iPhone 0 Deals Best Mac Antivirus Best Mac VPNs iOS 0 0
26,マック,MacRumors: Apple News and Rumors,https://www.macrumors.com/,"16 hours ago — If you're unfamiliar with iMazing, it's Mac and Windows software that provides a range of handy tools for iOS device management, and it offers ...",27,0 hours ago If you re unfamiliar with iMazing it s Mac and Windows software that provides a range of handy tools for iOS device management and it offers
27,マック,MacStadium | Mac Servers and Cloud Solutions on Apple ...,https://www.macstadium.com/,"Build faster with MacStadium's globally available, enterprise-grade Mac cloud solutions for CI/CD, Xcode & iOS builds, macOS testing, and more.",28,Build faster with MacStadium s globally available enterprise grade Mac cloud solutions for CI CD Xcode iOS builds macOS testing and more
28,マック,S'MAC,https://www.eatsmac.com/,S'MAC (short for Sarita's Macaroni & Cheese) is an exciting eatery specializing in macaroni & cheese. We are located in the heart of Manhattan's East ...,29,S MAC short for Sarita s Macaroni Cheese is an exciting eatery specializing in macaroni cheese We are located in the heart of Manhattan s East
29,マック,株式会社マック(海洋調査・マリンショップ・シーフード ...,https://www.macmac.co.jp/,青い海への貢献.,30,青い 海 貢献
30,マック,Deluxe Cheddar Style Cheezy Mac - Daiya Foods,https://daiyafoods.com/our-foods/cheezy-mac/deluxe-cheddar-style/,"Our Deluxe Cheddar Style Cheezy Mac will delight your taste buds with its savory, rich cheddar flavor and the creaminess you love from a classic mac and ...",31,Our Deluxe Cheddar Style Cheezy Mac will delight your taste buds with its savory rich cheddar flavor and the creaminess you love from a classic mac and
31,マック,マック鈴木オフィシャルブログ「まっく すてっぷ じゃんぷ」,https://ameblo.jp/macsuzukiofficial/,マック鈴木さんのブログです。最近の記事は「昼寝してもらうために（画像あり）」です。,32,ﾏｯｸ 鈴木 ﾌﾞﾛｸﾞ 最近 記事 昼寝 し もらう ため 画像 あり
32,マック,MACお宝鑑定団,http://www.macotakara.jp/,一日約6万ヒットを超える日本語でのMac &iPod などApple関連の情報サイト。日本や海外の展示会取材、新製品情報、サードパーティー製品の情報、特価情報、フリーソフト ...Mac News Link: Antena Link先週のNews: バナー広告募集／カンパ・チップ募集,33,一 日 0 万 ﾋｯﾄ 超える 日本 語 Mac iPod Apple 関連 情報 ｻｲﾄ 日本 海外 展示 会 取材 製品 情報 ｻｰﾄﾞ ﾊﾟｰﾃｨｰ 製品 情報 特価 情報 ﾌﾘｰ ｿﾌﾄ Mac News Link Antena Link 先週 News ﾊﾞﾅｰ 広告 募集 ｶﾝﾊﾟ ﾁｯﾌﾟ 募集
33,マック,Mac Benchmarks - Geekbench Browser,https://browser.geekbench.com/mac-benchmarks,"To make sure the results accurately reflect the average performance of each Mac, the chart only includes Macs with at least five unique results in the Geekbench ...",34,To make sure the results accurately reflect the average performance of each Mac the chart only includes Macs with at least five unique results in the Geekbench
34,マック,M.A.C Cosmetics | The Shops at Columbus Circle,https://www.theshopsatcolumbuscircle.com/shopping/mac/,"... endorsement from Makeup Artists, celebrities, models, photographers and journalists around the world. M-A-C is sold in 106 countries worldwide.",35,endorsement from Makeup Artists celebrities models photographers and journalists around the world M A C is sold in 0 countries worldwide
35,マック,マック食品株式会社 || 安心・おいしい・キレイで健康,http://www.macfoods.co.jp/,私たちマック食品は、安全で、安心な、おいしい高品質な商品を全てに優先し、 お客様の健康づくりに貢献します。 マックのこだわり · 製品紹介 · 大豆の力 ...,36,ﾏｯｸ 食品 安全 安心 おいしい 品質 商品 全て 優先 し 客 健康 づくり 貢献 し ﾏｯｸ こだわり 製品 紹介 大豆 力
36,マック,Cult of Mac | Tech and culture through an Apple lens,https://www.cultofmac.com/,"This week, Cult of Mac is giving five lucky winners one year of cloud backups from Backblaze. Your data is invaluable, and Backblaze is one of the most ...",37,This week Cult of Mac is giving five lucky winners one year of cloud backups from Backblaze Your data is invaluable and Backblaze is one of the most
37,マック,Mac's Seafood: Home Page,https://www.macsseafood.com/,Restaurants. Back; All Restaurants · Mac's Fish House Provincetown · Mac's Shack · Mac's on the Pier · Mac's Chatham Fish & Lobster · Mac's Market & Kitchen.,38,Restaurants Back All Restaurants Mac s Fish House Provincetown Mac s Shack Mac s on the Pier Mac s Chatham Fish Lobster Mac s Market Kitchen
38,マック,27歳が人生で初めてマックの“月見バーガー”を食べてみた話。,https://www.buzzfeed.com/jp/tomoyakosugi/mcdonald-tsukimi-burger,1 day ago — ソースの塩味は控えめで、トマトのほのかな酸味を感じます。 その反面、ベーコンはしっかりしょっぱい。このバランスが素晴らしい。 てりやきマック、 ...,39,0 day ago ｿｰｽ 塩味 ﾄﾏﾄ 酸味 感じ 反面 ﾍﾞｰｺﾝ しょっぱい ﾊﾞﾗﾝｽ 素晴らしい ﾏｯｸ
39,マック,カラオケマック,https://www.karaokemac.com/,5秒後に自動的にTOPページへ移動します。 ページが更新されない方はこちらをクリックしてください。,40,0 秒 自動 TOP ﾍﾟｰｼﾞ 移動 し ﾍﾟｰｼﾞ 更新 さ 方 ｸﾘｯｸ し ください
40,マック,M・A・C｜マックの通販 - ZOZOTOWN,https://zozo.jp/shop/mac/,M・A・C｜マックの通販サイトです。ZOZOTOWNが運営。即日配送（一部地域）もご利用いただけます。,41,M A C ﾏｯｸ 通販 ｻｲﾄ ZOZOTOWN 運営 即日 配送 一部 地域 利用 いただけ
41,マック,自動車用エアロパーツ製作・販売/株式会社マック,http://www.aeroparts.co.jp/,（株）マックは自動車用エアロパーツ・ドレスアップパーツのオリジナルブランドを制作販売しています。,42,ﾏｯｸ 自動 ｴｱﾛﾊﾟｰﾂ ﾄﾞﾚｽ ｱｯﾌﾟ ﾊﾟｰﾂ ｵﾘｼﾞﾅﾙ ﾌﾞﾗﾝﾄﾞ 制作 販売 し い
42,マック,Mac Miller | Official Website,https://www.macmillerswebsite.com/,Faces by Mac Miller. Digital album and vinyl out October 15. Pre-order available now.,43,Faces by Mac Miller Digital album and vinyl out October 0 Pre order available now
43,マック,マックジャパンwebサイト,http://www.mac-japan.co.jp/,すぐにご購入をご希望の方は、下記へ電話連絡・メールにてご連絡ください。 TEL：03－5917－6488 Mail：info@mac-japan.co.jp □爆音プラグ□,44,購入 希望 方 下記 電話 連絡 ﾒｰﾙ 連絡 ください TEL 0 0 0 Mail info mac japan co jp 爆音 ﾌﾟﾗｸﾞ
44,マック,食器、厨房備品の販売商社｜株式会社マック,http://www.kk-mac.com/,マックは食器の専門商社です。お客様のご使用シーンに合わせて、バリエーション豊かな和食器、洋食器、グラス、厨房備品、消耗品をご提案します。,45,ﾏｯｸ 食器 専門 商社 客 使用 ｼｰﾝ 合わせ ﾊﾞﾘｴｰｼｮﾝ 和食 洋食 ｸﾞﾗｽ 厨房 備品 消耗 提案 し
45,マック,Mac 通販【全品無料配達】 - ヨドバシ.com,https://www.yodobashi.com/category/19531/47027/,Macの通販ならヨドバシカメラの公式サイト「ヨドバシ.com」で！MacBook Air （マックブックエアー）やMacBook Pro （マックブックプロ）など人気の商品を多数取り揃え ...,46,Mac 通販 ﾖﾄﾞﾊﾞｼ ｶﾒﾗ 公式 ｻｲﾄ ﾖﾄﾞﾊﾞｼ com MacBook Air ﾏｯｸ ﾌﾞｯｸ ｴｱｰ MacBook Pro ﾏｯｸ ﾌﾞｯｸ ﾌﾟﾛ 人気 商品 多数 取り揃え
46,マック,マック,http://macthelife.cool.coocan.jp/index.html,マック・二元冷凍機が「省エネルギー投資促進に向けた支援補助金（エネルギー使用合理化等事業者支援事業）」の交付決定案件に選ばれました。info >> ...,47,ﾏｯｸ 二 元 冷凍 機 ｴﾈﾙｷﾞｰ 投資 促進 向け 支援 補助 ｴﾈﾙｷﾞｰ 使用 合理 事業 支援 事業 交付 決定 案件 選ば info
47,マック,Simply Mac - Apple Premier Partner,https://store.simplymac.com/,"We offer unique solutions around new and pre-owned Apple products, and the best selection of the accessories to pair with your devices. Shop or trade today!",48,We offer unique solutions around new and pre owned Apple products and the best selection of the accessories to pair with your devices Shop or trade today
48,マック,Mac ノート(MacBook) 通販 価格比較,https://kakaku.com/pc/mac-note-pc/,Mac ノート(MacBook)を買うなら､まずは価格.comをチェック！ 全国の通販サイトの販売価格情報をはじめ、スペック検索、クチコミ情報、ランキングなど、さまざまな視点 ...,49,Mac ﾉｰﾄ MacBook 買う 価格 com ﾁｪｯｸ 全国 通販 ｻｲﾄ 販売 価格 情報 はじめ ｽﾍﾟｯｸ 検索 ｸﾁｺﾐ 情報 ﾗﾝｷﾝｸﾞ 視点
49,マック,"Mac Specs, Prices, Answers and Comparison: EveryMac.com ...",https://everymac.com/,"A complete guide of every Mac, iPod, iPhone, iPad and Mac clone with technical and pricing info. Specs on every Mac, answer Mac questions, compare Macs and ...",50,A complete guide of every Mac iPod iPhone iPad and Mac clone with technical and pricing info Specs on every Mac answer Mac questions compare Macs and
50,マック,Fantastical | The calendar and tasks app you won't ... - Flexibits,https://flexibits.com/fantastical,Mac. iPad icon. iPad. iPhone icon. iPhone. Apple Watch icon. Watch. Add your existing calendar accounts directly to Fantastical and keep all of your events ...,51,Mac iPad icon iPad iPhone icon iPhone Apple Watch icon Watch Add your existing calendar accounts directly to Fantastical and keep all of your events
51,マック,マクド新商品「サムライマック」登場、「グラン」は終了へ,https://www.lmaga.jp/news/2021/04/243199/,"Apr 5, 2021 — 「サムライマック」と銘打ち、2020年4月に期間限定商品として発売されていた同商品。ボリュームたっぷりのビーフと炙り醤油風ソースの和風 ...",52,Apr 0 0 ｻﾑﾗｲ ﾏｯｸ 銘打ち 0 年 0 月 期間 限定 商品 し 発売 さ い 同 商品 ﾎﾞﾘｭｰﾑ ﾋﾞｰﾌ 炙り 醤油 ｿｰｽ 和風
52,マック,Taco Mac | Georgia's Neighbhorhood BarTaco Mac,https://tacomac.com/,"Taco Mac's world-class wings, curated craft beer menus, and love for our home teams have set the scene for friends and family to gather and celebrate ...",53,Taco Mac s world class wings curated craft beer menus and love for our home teams have set the scene for friends and family to gather and celebrate
53,マック,Mac | B&H Photo Video,https://www.bhphotovideo.com/c/browse/mac/ci/37094,"Apple Mac Laptops. The MacBook is the smallest laptop, with a 12-inch screen. It has an IPS Retina screen with a pixel density of 2304 x 1440 ...",54,Apple Mac Laptops The MacBook is the smallest laptop with a 0 inch screen It has an IPS Retina screen with a pixel density of 0 x 0
54,マック,MAC Cosmetics | Sephora,https://www.sephora.com/ca/en/brand/mac-cosmetics,"MAC Cosmetics is finally available at Sephora! Shop MAC Cosmetics at Sephora and order the perfect MAC lipstick, foundation, concealer or eyeshadow today.",55,MAC Cosmetics is finally available at Sephora Shop MAC Cosmetics at Sephora and order the perfect MAC lipstick foundation concealer or eyeshadow today
55,マック,M・A・C（マック） | ビューティー | 高島屋オンラインストア,https://www.takashimaya.co.jp/shopping/beauty/mac/,M・A・C（マック）、ビューティー人気アイテムなど、高島屋バイヤー厳選の公式商品を豊富にお取り揃え。人気ランキングや価格別にお探しいただけます。,56,M A C ﾏｯｸ ﾋﾞｭｰﾃｨｰ 人気 ｱｲﾃﾑ 高島 ﾊﾞｲﾔｰ 厳選 公式 商品 取り揃え 人気 ﾗﾝｷﾝｸﾞ 価格 別 探し いただけ
56,マック,Mac DeMarco -,https://www.mac-demarco.com/,"Mac and the band are playing the Frost Amphitheater in Stanford, California on Sunday, Oct 24th, 2021. Tickets go on sale Friday, June 25th @ 10 am PT.",57,Mac and the band are playing the Frost Amphitheater in Stanford California on Sunday Oct 0 th 0 Tickets go on sale Friday June 0 th 0 am PT
57,マック,Heather Mac Donald | Bestselling Author - Manhattan Institute,https://www.manhattan-institute.org/expert/heather-mac-donald,"Heather Mac Donald is the Thomas W. Smith Fellow at the Manhattan Institute, a contributing editor of City Journal, and a New York Times bestselling author.",58,Heather Mac Donald is the Thomas W Smith Fellow at the Manhattan Institute a contributing editor of City Journal and a New York Times bestselling author
58,マック,マクドナルドおすすめ人気メニュー【2021年9月版】期間限定 ...,https://www.o-uccino.jp/article/posts/66707,6 days ago — ビッグマックセット・ダブルチーズバーガーセット・てりやきマックバーガーセットなど90円引き！ バリューランチ(コンビ). ・ビッグマック® バリュー ...,59,0 days ago ﾋﾞｯｸﾞﾏｯｸｾｯﾄ･ﾀﾞﾌﾞﾙﾁｰｽﾞﾊﾞｰｶﾞｰｾｯﾄ･ ﾏｯｸ ﾊﾞｰｶﾞｰ ｾｯﾄ 0 円 引き ﾊﾞﾘｭｰ ﾗﾝﾁ ｺﾝﾋﾞ ﾏｯｸ ﾊﾞﾘｭｰ
